# Mr.Quin 直播回放 (from 自行车二层)

| 主播 | Mr.Quin |
| -------------------- | ------------------------------------------------------------ |
| **上传者** | **自行车二层** |
| **数据更新时间** | **1/11/2026, 6:24:40 PM** |
| **累积计入视频数量** | **375** |
| **最旧视频** | [【quin录播】 22-12-31 猛男寨mc宝可梦之夜](https://www.bilibili.com/video/av649604600/) |
| **最新视频** | [【quin录播】 2026-01-09 2026最后一博](https://www.bilibili.com/video/av115866960204247/) |

---

[TOC]

---

## 2026最后一博

| 游戏名称 | 直播日期 | 时长 | 集数   | 标题                                                         |
| -------- | -------- | ---- | ------ | ------------------------------------------------------------ |
| 2026最后一博 | 1/9/2026 | 05:39:25 | Part 1 | [【quin录播】 2026-01-09 2026最后一博](https://www.bilibili.com/video/av115866960204247/) |

## 2026第六播

| 游戏名称 | 直播日期 | 时长 | 集数   | 标题                                                         |
| -------- | -------- | ---- | ------ | ------------------------------------------------------------ |
| 2026第六播 | 1/8/2026 | 04:19:33 | Part 1 | [【quin录播】 2026-01-08 2026第六播](https://www.bilibili.com/video/av115860870010269/) |

## 2026第五播

| 游戏名称 | 直播日期 | 时长 | 集数   | 标题                                                         |
| -------- | -------- | ---- | ------ | ------------------------------------------------------------ |
| 2026第五播 | 1/6/2026 | 05:00:59 | Part 1 | [【quin录播】 2026-01-06 2026第五播](https://www.bilibili.com/video/av115849847379329/) |

## 2026第四播

| 游戏名称 | 直播日期 | 时长 | 集数   | 标题                                                         |
| -------- | -------- | ---- | ------ | ------------------------------------------------------------ |
| 2026第四播 | 1/5/2026 | 04:15:24 | Part 1 | [【quin录播】 2026-01-05 2026第四播](https://www.bilibili.com/video/av115843874689739/) |

## 水上乐园模拟器

| 游戏名称 | 直播日期 | 时长 | 集数   | 标题                                                         |
| -------- | -------- | ---- | ------ | ------------------------------------------------------------ |
| 水上乐园模拟器 | 1/4/2026 | 05:04:32 | Part 1 | [【quin录播】 2026-01-04 水上乐园模拟器](https://www.bilibili.com/video/av115838841522195/) |

## 别拽了！烤串师傅

| 游戏名称 | 直播日期 | 时长 | 集数   | 标题                                                         |
| -------- | -------- | ---- | ------ | ------------------------------------------------------------ |
| 别拽了！烤串师傅 | 1/1/2026 | 04:29:39 | Part 1 | [【quin录播】 2026-01-01 别拽了！烤串师傅 + 英雄立志传：三国志 + 猛男寨mc](https://www.bilibili.com/video/av115821292556662/) |

## 英雄立志传：三国志

| 游戏名称 | 直播日期 | 时长 | 集数   | 标题                                                         |
| -------- | -------- | ---- | ------ | ------------------------------------------------------------ |
| 英雄立志传：三国志 | 1/1/2026 | 04:29:39 | Part 1 | [【quin录播】 2026-01-01 别拽了！烤串师傅 + 英雄立志传：三国志 + 猛男寨mc](https://www.bilibili.com/video/av115821292556662/) |

## 猛男寨mc

| 游戏名称 | 直播日期 | 时长 | 集数   | 标题                                                         |
| -------- | -------- | ---- | ------ | ------------------------------------------------------------ |
| 猛男寨mc | 12/30/2025 | 05:03:00 | Part 1 | [【quin录播】 2025-12-30 猛男寨mc](https://www.bilibili.com/video/av115810555135715/) |
| 猛男寨mc | 12/31/2025 | 05:42:56 | Part 2 | [【quin录播】 2025-12-31 猛男寨mc](https://www.bilibili.com/video/av115816024512246/) |
| 猛男寨mc | 1/1/2026 | 04:29:39 | Part 3 | [【quin录播】 2026-01-01 别拽了！烤串师傅 + 英雄立志传：三国志 + 猛男寨mc](https://www.bilibili.com/video/av115821292556662/) |

## 真三国无双7

| 游戏名称 | 直播日期 | 时长 | 集数   | 标题                                                         |
| -------- | -------- | ---- | ------ | ------------------------------------------------------------ |
| 真三国无双7 | 12/26/2025 | 05:17:34 | Part 1 | [【quin录播】 2025-12-26 我们到了吗？ + 真三国无双7](https://www.bilibili.com/video/av115786261793518/) |
| 真三国无双7 | 12/29/2025 | 05:04:40 | Part 2 | [【quin录播】 2025-12-29 真三国无双7](https://www.bilibili.com/video/av115803223496892/) |

## 觅长生

| 游戏名称 | 直播日期 | 时长 | 集数   | 标题                                                         |
| -------- | -------- | ---- | ------ | ------------------------------------------------------------ |
| 觅长生 | 12/22/2025 | 04:55:42 | Part 1 | [【quin录播】 2025-12-22 觅长生](https://www.bilibili.com/video/av115763243385238/) |
| 觅长生 | 12/23/2025 | 04:54:46 | Part 2 | [【quin录播】 2025-12-23 觅长生](https://www.bilibili.com/video/av115768930928220/) |
| 觅长生 | 12/25/2025 | 05:36:48 | Part 3 | [【quin录播】 2025-12-25 觅长生](https://www.bilibili.com/video/av115780574319757/) |
| 觅长生 | 12/28/2025 | 04:38:15 | Part 4 | [【quin录播】 2025-12-28 觅长生](https://www.bilibili.com/video/av115797435356273/) |

## 我们到了吗？

| 游戏名称 | 直播日期 | 时长 | 集数   | 标题                                                         |
| -------- | -------- | ---- | ------ | ------------------------------------------------------------ |
| 我们到了吗？ | 10/29/2025 | 05:40:00 | Part 1 | [【quin录播】 2025-10-29 我们到了吗？](https://www.bilibili.com/video/av115457461851153/) |
| 我们到了吗？ | 10/30/2025 | 04:06:59 | Part 2 | [【quin录播】 2025-10-30 我们到了吗？ + 物种：未知](https://www.bilibili.com/video/av115463250059138/) |
| 我们到了吗？ | 12/26/2025 | 05:17:34 | Part 3 | [【quin录播】 2025-12-26 我们到了吗？ + 真三国无双7](https://www.bilibili.com/video/av115786261793518/) |

## 月球任务

| 游戏名称 | 直播日期 | 时长 | 集数   | 标题                                                         |
| -------- | -------- | ---- | ------ | ------------------------------------------------------------ |
| 月球任务 | 12/20/2025 | 04:58:02 | Part 1 | [【quin录播】 2025-12-20 月球任务 + 日本事故物件监视协会2](https://www.bilibili.com/video/av115752271091077/) |

## 日本事故物件监视协会2

| 游戏名称 | 直播日期 | 时长 | 集数   | 标题                                                         |
| -------- | -------- | ---- | ------ | ------------------------------------------------------------ |
| 日本事故物件监视协会2 | 12/20/2025 | 04:58:02 | Part 1 | [【quin录播】 2025-12-20 月球任务 + 日本事故物件监视协会2](https://www.bilibili.com/video/av115752271091077/) |

## 生化危机5

| 游戏名称 | 直播日期 | 时长 | 集数   | 标题                                                         |
| -------- | -------- | ---- | ------ | ------------------------------------------------------------ |
| 生化危机5 | 12/15/2025 | 04:47:51 | Part 1 | [【quin录播】 2025-12-15 生化危机5 + 无畏契约](https://www.bilibili.com/video/av115723867331076/) |
| 生化危机5 | 12/16/2025 | 04:04:03 | Part 2 | [【quin录播】 2025-12-16 生化危机5](https://www.bilibili.com/video/av115729521316885/) |
| 生化危机5 | 12/17/2025 | 04:30:27 | Part 3 | [【quin录播】 2025-12-17 生化危机5](https://www.bilibili.com/video/av115735292676763/) |
| 生化危机5 | 12/19/2025 | 04:19:05 | Part 4 | [【quin录播】 2025-12-19 生化危机5 + 生化危机6](https://www.bilibili.com/video/av115746550060697/) |

## 生化危机6

| 游戏名称 | 直播日期 | 时长 | 集数   | 标题                                                         |
| -------- | -------- | ---- | ------ | ------------------------------------------------------------ |
| 生化危机6 | 12/19/2025 | 04:19:05 | Part 1 | [【quin录播】 2025-12-19 生化危机5 + 生化危机6](https://www.bilibili.com/video/av115746550060697/) |

## VALORANT/无畏契约

| 游戏名称 | 直播日期 | 时长 | 集数   | 标题                                                         |
| -------- | -------- | ---- | ------ | ------------------------------------------------------------ |
| VALORANT/无畏契约 | 9/28/2024 | 04:07:41 | Part 1 | [【quin录播】 2024-09-28 无畏契约 + 沙威玛传奇](https://www.bilibili.com/video/av113215505698665/) |
| VALORANT/无畏契约 | 10/9/2024 | 05:11:59 | Part 2 | [【quin录播】 2024-10-09 无畏契约](https://www.bilibili.com/video/av113276708981809/) |
| VALORANT/无畏契约 | 10/10/2024 | 02:33:17 | Part 3 | [【quin录播】 2024-10-10 三角洲行动 + 无畏契约](https://www.bilibili.com/video/av113283571059539/) |
| VALORANT/无畏契约 | 10/12/2024 | 04:23:23 | Part 4 | [【quin录播】 2024-10-12 三角洲行动 + 无畏契约](https://www.bilibili.com/video/av113294727710308/) |
| VALORANT/无畏契约 | 10/13/2024 | 04:35:00 | Part 5 | [【quin录播】 2024-10-13 无畏契约](https://www.bilibili.com/video/av113300348144361/) |
| VALORANT/无畏契约 | 10/14/2024 | 04:06:58 | Part 6 | [【quin录播】 2024-10-14 无畏契约 + 三角洲行动](https://www.bilibili.com/video/av113306119440221/) |
| VALORANT/无畏契约 | 10/16/2024 | 04:40:11 | Part 7 | [【quin录播】 2024-10-16 泡姆泡姆 + 无畏契约](https://www.bilibili.com/video/av113317293067671/) |
| VALORANT/无畏契约 | 10/17/2024 | 04:35:36 | Part 8 | [【quin录播】 2024-10-17 无畏契约](https://www.bilibili.com/video/av113322963766211/) |
| VALORANT/无畏契约 | 10/24/2024 | 04:38:26 | Part 9 | [【quin录播】 2024-10-24 骰子浪游者 + 无畏契约](https://www.bilibili.com/video/av113362742542761/) |
| VALORANT/无畏契约 | 12/11/2025 | 04:28:36 | Part 10 | [【quin录播】 2025-12-11 宝可梦传说z-a + 无畏契约](https://www.bilibili.com/video/av115701318685129/) |
| VALORANT/无畏契约 | 12/14/2025 | 04:23:23 | Part 11 | [【quin录播】 2025-12-14 超级食肉男孩 3D + 虚实万象 + 无畏契约 + 漫威争锋](https://www.bilibili.com/video/av115718481840893/) |
| VALORANT/无畏契约 | 12/15/2025 | 04:47:51 | Part 12 | [【quin录播】 2025-12-15 生化危机5 + 无畏契约](https://www.bilibili.com/video/av115723867331076/) |

## 超级食肉男孩 3D

| 游戏名称 | 直播日期 | 时长 | 集数   | 标题                                                         |
| -------- | -------- | ---- | ------ | ------------------------------------------------------------ |
| 超级食肉男孩 3D | 12/14/2025 | 04:23:23 | Part 1 | [【quin录播】 2025-12-14 超级食肉男孩 3D + 虚实万象 + 无畏契约 + 漫威争锋](https://www.bilibili.com/video/av115718481840893/) |

## 虚实万象

| 游戏名称 | 直播日期 | 时长 | 集数   | 标题                                                         |
| -------- | -------- | ---- | ------ | ------------------------------------------------------------ |
| 虚实万象 | 12/14/2025 | 04:23:23 | Part 1 | [【quin录播】 2025-12-14 超级食肉男孩 3D + 虚实万象 + 无畏契约 + 漫威争锋](https://www.bilibili.com/video/av115718481840893/) |

## Marvel Rivals/漫威争锋

| 游戏名称 | 直播日期 | 时长 | 集数   | 标题                                                         |
| -------- | -------- | ---- | ------ | ------------------------------------------------------------ |
| Marvel Rivals/漫威争锋 | 10/19/2024 | 04:23:19 | Part 1 | [【quin录播】 2024-10-19 漫威争锋](https://www.bilibili.com/video/av113334288453546/) |
| Marvel Rivals/漫威争锋 | 10/20/2024 | 04:10:29 | Part 2 | [【quin录播】 2024-10-20 漫威争锋](https://www.bilibili.com/video/av113339942373352/) |
| Marvel Rivals/漫威争锋 | 10/21/2024 | 04:55:48 | Part 3 | [【quin录播】 2024-10-21 绝地潜兵2 + 漫威争锋](https://www.bilibili.com/video/av113346267320209/) |
| Marvel Rivals/漫威争锋 | 10/22/2024 | 04:09:54 | Part 4 | [【quin录播】 2024-10-22 漫威争锋](https://www.bilibili.com/video/av113351367722692/) |
| Marvel Rivals/漫威争锋 | 12/6/2024 | 05:54:48 | Part 5 | [【quin录播】 2024-12-06 漫威争锋](https://www.bilibili.com/video/av113605995403525/) |
| Marvel Rivals/漫威争锋 | 12/7/2024 | 05:36:45 | Part 6 | [【quin录播】 2024-12-07 漫威争锋](https://www.bilibili.com/video/av113611900979019/) |
| Marvel Rivals/漫威争锋 | 12/8/2024 | 03:36:02 | Part 7 | [【quin录播】 2024-12-08 漫威争锋](https://www.bilibili.com/video/av113617588458978/) |
| Marvel Rivals/漫威争锋 | 12/13/2024 | 05:18:04 | Part 8 | [【quin录播】 2024-12-13 绝地潜兵2 + 漫威争锋](https://www.bilibili.com/video/av113646311048512/) |
| Marvel Rivals/漫威争锋 | 12/15/2024 | 04:13:11 | Part 9 | [【quin录播】 2024-12-15 漫威争锋](https://www.bilibili.com/video/av113657149196947/) |
| Marvel Rivals/漫威争锋 | 12/16/2024 | 04:25:16 | Part 10 | [【quin录播】 2024-12-16 黑神话：悟空 + 漫威争锋（后半段无弹幕）](https://www.bilibili.com/video/av113662853387112/) |
| Marvel Rivals/漫威争锋 | 12/17/2024 | 05:21:25 | Part 11 | [【quin录播】 2024-12-17 笼子 + 黑神话：悟空 + 漫威争锋](https://www.bilibili.com/video/av113668507308155/) |
| Marvel Rivals/漫威争锋 | 12/18/2024 | 04:29:38 | Part 12 | [【quin录播】 2024-12-18 漫威争锋](https://www.bilibili.com/video/av113674127807925/) |
| Marvel Rivals/漫威争锋 | 12/19/2024 | 04:48:15 | Part 13 | [【quin录播】 2024-12-19 黑神话：悟空 + 漫威争锋](https://www.bilibili.com/video/av113679865485644/) |
| Marvel Rivals/漫威争锋 | 12/21/2024 | 04:37:13 | Part 14 | [【quin录播】 2024-12-21 漫威争锋](https://www.bilibili.com/video/av113691005552896/) |
| Marvel Rivals/漫威争锋 | 12/22/2024 | 04:49:27 | Part 15 | [【quin录播】 2024-12-22 漫威争锋](https://www.bilibili.com/video/av113696827248797/) |
| Marvel Rivals/漫威争锋 | 12/23/2024 | 04:33:20 | Part 16 | [【quin录播】 2024-12-23 漫威争锋](https://www.bilibili.com/video/av113702330173366/) |
| Marvel Rivals/漫威争锋 | 12/24/2024 | 05:04:45 | Part 17 | [【quin录播】 2024-12-24 漫威争锋](https://www.bilibili.com/video/av113708101537390/) |
| Marvel Rivals/漫威争锋 | 12/25/2024 | 05:22:27 | Part 18 | [【quin录播】 2024-12-25 漫威争锋](https://www.bilibili.com/video/av113713671574636/) |
| Marvel Rivals/漫威争锋 | 12/27/2024 | 04:34:52 | Part 19 | [【quin录播】 2024-12-27 漫威争锋](https://www.bilibili.com/video/av113725012972175/) |
| Marvel Rivals/漫威争锋 | 12/28/2024 | 02:49:42 | Part 20 | [【quin录播】 2024-12-28 漫威争锋](https://www.bilibili.com/video/av113730884995349/) |
| Marvel Rivals/漫威争锋 | 1/1/2025 | 04:58:26 | Part 21 | [【quin录播】 2025-01-01 zort + 暗黑潜水员 + 漫威争锋](https://www.bilibili.com/video/av113753483907511/) |
| Marvel Rivals/漫威争锋 | 1/4/2025 | 05:51:22 | Part 22 | [【quin录播】 2025-01-04 晃晃人生 + 漫威争锋](https://www.bilibili.com/video/av113770680552247/) |
| Marvel Rivals/漫威争锋 | 1/5/2025 | 05:41:16 | Part 23 | [【quin录播】 2025-01-05 天国拯救 + 漫威争锋](https://www.bilibili.com/video/av113776166765149/) |
| Marvel Rivals/漫威争锋 | 1/7/2025 | 05:35:10 | Part 24 | [【quin录播】 2025-01-07 天国拯救 + 漫威争锋](https://www.bilibili.com/video/av113787457771847/) |
| Marvel Rivals/漫威争锋 | 1/10/2025 | 05:30:27 | Part 25 | [【quin录播】 2025-01-10 漫威争锋](https://www.bilibili.com/video/av113804385980769/) |
| Marvel Rivals/漫威争锋 | 1/14/2025 | 07:38:21 | Part 26 | [【quin录播】 2025-01-14 真三国无双起源 + 漫威争锋](https://www.bilibili.com/video/av113826884295688/) |
| Marvel Rivals/漫威争锋 | 1/16/2025 | 06:15:20 | Part 27 | [【quin录播】 2025-01-16 真三国无双起源 + 漫威争锋](https://www.bilibili.com/video/av113838376682938/) |
| Marvel Rivals/漫威争锋 | 1/18/2025 | 06:27:24 | Part 28 | [【quin录播】 2025-01-18 明日方舟终末地 + 漫威争锋](https://www.bilibili.com/video/av113849600575991/) |
| Marvel Rivals/漫威争锋 | 1/19/2025 | 06:01:09 | Part 29 | [【quin录播】 2025-01-19 真三国无双起源 + 漫威争锋](https://www.bilibili.com/video/av113855338388165/) |
| Marvel Rivals/漫威争锋 | 1/25/2025 | 05:42:51 | Part 30 | [【quin录播】 2025-01-25 真三国无双起源 + 抽奖 + nuclear nightmare + 漫威争锋](https://www.bilibili.com/video/av113889228365665/) |
| Marvel Rivals/漫威争锋 | 2/21/2025 | 05:21:38 | Part 31 | [【quin录播】 2025-02-21 三角洲 + 漫威争锋](https://www.bilibili.com/video/av114042001691890/) |
| Marvel Rivals/漫威争锋 | 2/23/2025 | 05:01:16 | Part 32 | [【quin录播】 2025-02-23 天国拯救2 + 漫威争锋](https://www.bilibili.com/video/av114053594750728/) |
| Marvel Rivals/漫威争锋 | 2/26/2025 | 04:35:57 | Part 33 | [【quin录播】 2025-02-26 天国拯救2 + 漫威争锋](https://www.bilibili.com/video/av114070606840789/) |
| Marvel Rivals/漫威争锋 | 3/6/2025 | 07:27:31 | Part 34 | [【quin录播】 2025-03-06 r.e.p.o + 漫威争锋 + 双影奇境](https://www.bilibili.com/video/av114115687224766/) |
| Marvel Rivals/漫威争锋 | 3/8/2025 | 05:00:43 | Part 35 | [【quin录播】 2025-03-08 双影奇境 + 漫威争锋](https://www.bilibili.com/video/av114127095795658/) |
| Marvel Rivals/漫威争锋 | 4/15/2025 | 03:59:39 | Part 36 | [【quin录播】 2025-04-15 漫威争锋](https://www.bilibili.com/video/av114342380963524/) |
| Marvel Rivals/漫威争锋 | 4/18/2025 | 05:47:46 | Part 37 | [【quin录播】 2025-04-18 越来越黑暗 + 漫威争锋](https://www.bilibili.com/video/av114358923365190/) |
| Marvel Rivals/漫威争锋 | 4/20/2025 | 05:04:23 | Part 38 | [【quin录播】 2025-04-20 联机黑暗之魂 + 漫威争锋](https://www.bilibili.com/video/av114370667352273/) |
| Marvel Rivals/漫威争锋 | 4/25/2025 | 05:12:48 | Part 39 | [【quin录播】 2025-04-25 漫威争锋 + 光与影：33号远征队](https://www.bilibili.com/video/av114398953801125/) |
| Marvel Rivals/漫威争锋 | 4/28/2025 | 04:50:15 | Part 40 | [【quin录播】 2025-04-28 联机黑暗之魂 + 漫威争锋](https://www.bilibili.com/video/av114415898725559/) |
| Marvel Rivals/漫威争锋 | 5/2/2025 | 04:50:04 | Part 41 | [【quin录播】 2025-05-02 暗区突围 + 漫威争锋](https://www.bilibili.com/video/av114438514479952/) |
| Marvel Rivals/漫威争锋 | 7/11/2025 | 03:57:31 | Part 42 | [【quin录播】 2025-07-11 mycopunk + 曙光防御 + 漫威争锋](https://www.bilibili.com/video/av114834960024949/) |
| Marvel Rivals/漫威争锋 | 12/8/2025 | 04:15:21 | Part 43 | [【quin录播】 2025-12-08 云之国 + 漫威争锋](https://www.bilibili.com/video/av115684189280798/) |
| Marvel Rivals/漫威争锋 | 12/14/2025 | 04:23:23 | Part 44 | [【quin录播】 2025-12-14 超级食肉男孩 3D + 虚实万象 + 无畏契约 + 漫威争锋](https://www.bilibili.com/video/av115718481840893/) |

## tga

| 游戏名称 | 直播日期 | 时长 | 集数   | 标题                                                         |
| -------- | -------- | ---- | ------ | ------------------------------------------------------------ |
| tga | 12/12/2025 | 03:18:45 | Part 1 | [【quin录播】 2025-12-12 tga](https://www.bilibili.com/video/av115704204365798/) |

## 宝可梦传说z-a

| 游戏名称 | 直播日期 | 时长 | 集数   | 标题                                                         |
| -------- | -------- | ---- | ------ | ------------------------------------------------------------ |
| 宝可梦传说z-a | 10/16/2025 | 03:50:37 | Part 1 | [【quin录播】 2025-10-16 宝可梦传说z-a](https://www.bilibili.com/video/av115379179426875/) |
| 宝可梦传说z-a | 10/16/2025 | 01:00:02 | Part 2 | [【quin录播】 2025-10-16 宝可梦传说z-a（已爆炸）](https://www.bilibili.com/video/av115384179033211/) |
| 宝可梦传说z-a | 10/21/2025 | 04:14:53 | Part 3 | [【quin录播】 2025-10-21 宝可梦传说z-a](https://www.bilibili.com/video/av115412582864131/) |
| 宝可梦传说z-a | 10/31/2025 | 04:20:04 | Part 4 | [【quin录播】 2025-10-31 宝可梦传说z-a + 物种：未知 + dinoblade](https://www.bilibili.com/video/av115469205898584/) |
| 宝可梦传说z-a | 11/1/2025 | 04:47:29 | Part 5 | [【quin录播】 2025-11-01 宝可梦传说z-a](https://www.bilibili.com/video/av115474708893822/) |
| 宝可梦传说z-a | 11/4/2025 | 04:45:04 | Part 6 | [【quin录播】 2025-11-04 宝可梦传说z-a](https://www.bilibili.com/video/av115491653951079/) |
| 宝可梦传说z-a | 11/5/2025 | 04:57:04 | Part 7 | [【quin录播】 2025-11-05 宝可梦传说z-a](https://www.bilibili.com/video/av115497391759198/) |
| 宝可梦传说z-a | 11/7/2025 | 05:41:58 | Part 8 | [【quin录播】 2025-11-07 宝可梦传说z-a](https://www.bilibili.com/video/av115508716378141/) |
| 宝可梦传说z-a | 12/5/2025 | 04:48:18 | Part 9 | [【quin录播】 2025-12-05 gt7 dlc + 宝可梦传说z-a](https://www.bilibili.com/video/av115668569555221/) |
| 宝可梦传说z-a | 12/10/2025 | 04:42:23 | Part 10 | [【quin录播】 2025-12-10 宝可梦传说z-a](https://www.bilibili.com/video/av115695580873098/) |
| 宝可梦传说z-a | 12/11/2025 | 04:28:36 | Part 11 | [【quin录播】 2025-12-11 宝可梦传说z-a + 无畏契约](https://www.bilibili.com/video/av115701318685129/) |

## 云之国

| 游戏名称 | 直播日期 | 时长 | 集数   | 标题                                                         |
| -------- | -------- | ---- | ------ | ------------------------------------------------------------ |
| 云之国 | 12/8/2025 | 04:15:21 | Part 1 | [【quin录播】 2025-12-08 云之国 + 漫威争锋](https://www.bilibili.com/video/av115684189280798/) |

## 汽车经销商模拟器

| 游戏名称 | 直播日期 | 时长 | 集数   | 标题                                                         |
| -------- | -------- | ---- | ------ | ------------------------------------------------------------ |
| 汽车经销商模拟器 | 11/24/2025 | 05:46:54 | Part 1 | [【quin录播】 2025-11-24 汽车经销商模拟器](https://www.bilibili.com/video/av115606510702885/) |
| 汽车经销商模拟器 | 11/25/2025 | 06:00:05 | Part 2 | [【quin录播】 2025-11-25 预视武宗 + 汽车经销商模拟器](https://www.bilibili.com/video/av115612214891626/) |
| 汽车经销商模拟器 | 11/27/2025 | 04:24:19 | Part 3 | [【quin录播】 2025-11-27 汽车经销商模拟器](https://www.bilibili.com/video/av115623170475450/) |
| 汽车经销商模拟器 | 12/7/2025 | 04:09:33 | Part 4 | [【quin录播】 2025-12-07 汽车经销商模拟器 + SchoolBoy Runaway](https://www.bilibili.com/video/av115678602336500/) |

## SchoolBoy Runaway

| 游戏名称 | 直播日期 | 时长 | 集数   | 标题                                                         |
| -------- | -------- | ---- | ------ | ------------------------------------------------------------ |
| SchoolBoy Runaway | 12/6/2025 | 05:09:34 | Part 1 | [【quin录播】 2025-12-06 SchoolBoy Runaway](https://www.bilibili.com/video/av115674341054685/) |
| SchoolBoy Runaway | 12/7/2025 | 04:09:33 | Part 2 | [【quin录播】 2025-12-07 汽车经销商模拟器 + SchoolBoy Runaway](https://www.bilibili.com/video/av115678602336500/) |

## gt7

| 游戏名称 | 直播日期 | 时长 | 集数   | 标题                                                         |
| -------- | -------- | ---- | ------ | ------------------------------------------------------------ |
| gt7 | 7/3/2025 | 03:00:03 | Part 1 | [【quin录播】 2025-07-03 gt7 + 死亡搁浅2（已爆炸）](https://www.bilibili.com/video/av114789728655751/) |
| gt7 | 12/5/2025 | 04:48:18 | Part 2 | [【quin录播】 2025-12-05 gt7 dlc + 宝可梦传说z-a](https://www.bilibili.com/video/av115668569555221/) |

## 明日方舟：终末地

| 游戏名称 | 直播日期 | 时长 | 集数   | 标题                                                         |
| -------- | -------- | ---- | ------ | ------------------------------------------------------------ |
| 明日方舟：终末地 | 11/28/2025 | 05:30:03 | Part 1 | [【quin录播】 2025-11-28 明日方舟：终末地](https://www.bilibili.com/video/av115630015517466/) |
| 明日方舟：终末地 | 11/29/2025 | 05:57:03 | Part 2 | [【quin录播】 2025-11-29 明日方舟：终末地](https://www.bilibili.com/video/av115634847353259/) |
| 明日方舟：终末地 | 12/1/2025 | 04:24:36 | Part 3 | [【quin录播】 2025-12-01 明日方舟：终末地](https://www.bilibili.com/video/av115646004267867/) |

## 预视武宗

| 游戏名称 | 直播日期 | 时长 | 集数   | 标题                                                         |
| -------- | -------- | ---- | ------ | ------------------------------------------------------------ |
| 预视武宗 | 11/25/2025 | 06:00:05 | Part 1 | [【quin录播】 2025-11-25 预视武宗 + 汽车经销商模拟器](https://www.bilibili.com/video/av115612214891626/) |

## 黑猫速递

| 游戏名称 | 直播日期 | 时长 | 集数   | 标题                                                         |
| -------- | -------- | ---- | ------ | ------------------------------------------------------------ |
| 黑猫速递 | 11/22/2025 | 05:40:43 | Part 1 | [【quin录播】 2025-11-22 黑猫速递 + 如胶似漆](https://www.bilibili.com/video/av115595286679740/) |

## 如胶似漆

| 游戏名称 | 直播日期 | 时长 | 集数   | 标题                                                         |
| -------- | -------- | ---- | ------ | ------------------------------------------------------------ |
| 如胶似漆 | 11/22/2025 | 05:40:43 | Part 1 | [【quin录播】 2025-11-22 黑猫速递 + 如胶似漆](https://www.bilibili.com/video/av115595286679740/) |

## 肉鸽之魂

| 游戏名称 | 直播日期 | 时长 | 集数   | 标题                                                         |
| -------- | -------- | ---- | ------ | ------------------------------------------------------------ |
| 肉鸽之魂 | 11/21/2025 | 04:25:17 | Part 1 | [【quin录播】 2025-11-21 肉鸽之魂](https://www.bilibili.com/video/av115587888060038/) |

## 这个商城不太对劲

| 游戏名称 | 直播日期 | 时长 | 集数   | 标题                                                         |
| -------- | -------- | ---- | ------ | ------------------------------------------------------------ |
| 这个商城不太对劲 | 11/19/2025 | 04:44:10 | Part 1 | [【quin录播】 2025-11-19 这个商城不太对劲 + boat together](https://www.bilibili.com/video/av115576445862126/) |

## boat together

| 游戏名称 | 直播日期 | 时长 | 集数   | 标题                                                         |
| -------- | -------- | ---- | ------ | ------------------------------------------------------------ |
| boat together | 11/19/2025 | 04:44:10 | Part 1 | [【quin录播】 2025-11-19 这个商城不太对劲 + boat together](https://www.bilibili.com/video/av115576445862126/) |

## 逃离后室

| 游戏名称 | 直播日期 | 时长 | 集数   | 标题                                                         |
| -------- | -------- | ---- | ------ | ------------------------------------------------------------ |
| 逃离后室 | 11/17/2025 | 05:42:37 | Part 1 | [【quin录播】 2025-11-17 逃离后室](https://www.bilibili.com/video/av115565389677732/) |
| 逃离后室 | 11/18/2025 | 04:41:41 | Part 2 | [【quin录播】 2025-11-18 逃离后室 + 忍者龙剑传3](https://www.bilibili.com/video/av115571161172050/) |

## 忍者龙剑传3

| 游戏名称 | 直播日期 | 时长 | 集数   | 标题                                                         |
| -------- | -------- | ---- | ------ | ------------------------------------------------------------ |
| 忍者龙剑传3 | 11/11/2025 | 04:31:53 | Part 1 | [【quin录播】 2025-11-11 忍者龙剑传3](https://www.bilibili.com/video/av115531231399992/) |
| 忍者龙剑传3 | 11/18/2025 | 04:41:41 | Part 2 | [【quin录播】 2025-11-18 逃离后室 + 忍者龙剑传3](https://www.bilibili.com/video/av115571161172050/) |

## 闪电十一人 英雄们的胜利之路

| 游戏名称 | 直播日期 | 时长 | 集数   | 标题                                                         |
| -------- | -------- | ---- | ------ | ------------------------------------------------------------ |
| 闪电十一人 英雄们的胜利之路 | 11/15/2025 | 04:14:15 | Part 1 | [【quin录播】 2025-11-15 闪电十一人 英雄们的胜利之路](https://www.bilibili.com/video/av115553813595323/) |

## 失落城堡2

| 游戏名称 | 直播日期 | 时长 | 集数   | 标题                                                         |
| -------- | -------- | ---- | ------ | ------------------------------------------------------------ |
| 失落城堡2 | 11/14/2025 | 05:12:22 | Part 1 | [【quin录播】 2025-11-14 失落城堡2](https://www.bilibili.com/video/av115548226586357/) |

## 超英派遣中心

| 游戏名称 | 直播日期 | 时长 | 集数   | 标题                                                         |
| -------- | -------- | ---- | ------ | ------------------------------------------------------------ |
| 超英派遣中心 | 11/13/2025 | 03:32:09 | Part 1 | [【quin录播】 2025-11-13 超英派遣中心](https://www.bilibili.com/video/av115542790840090/) |

## 忍者龙剑传4

| 游戏名称 | 直播日期 | 时长 | 集数   | 标题                                                         |
| -------- | -------- | ---- | ------ | ------------------------------------------------------------ |
| 忍者龙剑传4 | 10/26/2025 | 07:00:48 | Part 1 | [【quin录播】 2025-10-26 忍者龙剑传4](https://www.bilibili.com/video/av115439527006250/) |
| 忍者龙剑传4 | 10/27/2025 | 05:02:51 | Part 2 | [【quin录播】 2025-10-27 忍者龙剑传4](https://www.bilibili.com/video/av115446221179442/) |
| 忍者龙剑传4 | 11/8/2025 | 05:30:40 | Part 3 | [【quin录播】 2025-11-08 忍者龙剑传4](https://www.bilibili.com/video/av115514386947415/) |
| 忍者龙剑传4 | 11/9/2025 | 05:36:39 | Part 4 | [【quin录播】 2025-11-09 忍者龙剑传4](https://www.bilibili.com/video/av115519772499715/) |

## 七日世界

| 游戏名称 | 直播日期 | 时长 | 集数   | 标题                                                         |
| -------- | -------- | ---- | ------ | ------------------------------------------------------------ |
| 七日世界 | 11/2/2025 | 03:59:58 | Part 1 | [【quin录播】 2025-11-02 七日世界](https://www.bilibili.com/video/av115480262086153/) |
| 七日世界 | 11/3/2025 | 04:18:11 | Part 2 | [【quin录播】 2025-11-03 七日世界 + backseat drivers + try to drive](https://www.bilibili.com/video/av115485949624733/) |

## backseat drivers

| 游戏名称 | 直播日期 | 时长 | 集数   | 标题                                                         |
| -------- | -------- | ---- | ------ | ------------------------------------------------------------ |
| backseat drivers | 11/3/2025 | 04:18:11 | Part 1 | [【quin录播】 2025-11-03 七日世界 + backseat drivers + try to drive](https://www.bilibili.com/video/av115485949624733/) |

## try to drive

| 游戏名称 | 直播日期 | 时长 | 集数   | 标题                                                         |
| -------- | -------- | ---- | ------ | ------------------------------------------------------------ |
| try to drive | 11/3/2025 | 04:18:11 | Part 1 | [【quin录播】 2025-11-03 七日世界 + backseat drivers + try to drive](https://www.bilibili.com/video/av115485949624733/) |

## 物种：未知

| 游戏名称 | 直播日期 | 时长 | 集数   | 标题                                                         |
| -------- | -------- | ---- | ------ | ------------------------------------------------------------ |
| 物种：未知 | 10/30/2025 | 04:06:59 | Part 1 | [【quin录播】 2025-10-30 我们到了吗？ + 物种：未知](https://www.bilibili.com/video/av115463250059138/) |
| 物种：未知 | 10/31/2025 | 04:20:04 | Part 2 | [【quin录播】 2025-10-31 宝可梦传说z-a + 物种：未知 + dinoblade](https://www.bilibili.com/video/av115469205898584/) |

## dinoblade

| 游戏名称 | 直播日期 | 时长 | 集数   | 标题                                                         |
| -------- | -------- | ---- | ------ | ------------------------------------------------------------ |
| dinoblade | 10/31/2025 | 04:20:04 | Part 1 | [【quin录播】 2025-10-31 宝可梦传说z-a + 物种：未知 + dinoblade](https://www.bilibili.com/video/av115469205898584/) |

## 核处逢生

| 游戏名称 | 直播日期 | 时长 | 集数   | 标题                                                         |
| -------- | -------- | ---- | ------ | ------------------------------------------------------------ |
| 核处逢生 | 10/28/2025 | 04:52:16 | Part 1 | [【quin录播】 2025-10-28 核处逢生 + 逃离鸭科夫](https://www.bilibili.com/video/av115451925367426/) |

## 逃离鸭科夫

| 游戏名称 | 直播日期 | 时长 | 集数   | 标题                                                         |
| -------- | -------- | ---- | ------ | ------------------------------------------------------------ |
| 逃离鸭科夫 | 10/28/2025 | 04:52:16 | Part 1 | [【quin录播】 2025-10-28 核处逢生 + 逃离鸭科夫](https://www.bilibili.com/video/av115451925367426/) |

## 现场手机直播

| 游戏名称 | 直播日期 | 时长 | 集数   | 标题                                                         |
| -------- | -------- | ---- | ------ | ------------------------------------------------------------ |
| 现场手机直播 | 10/24/2025 | 04:31:28 | Part 1 | [【quin录播】 2025-10-24 现场手机直播](https://www.bilibili.com/video/av115428487599123/) |

## 战地6

| 游戏名称 | 直播日期 | 时长 | 集数   | 标题                                                         |
| -------- | -------- | ---- | ------ | ------------------------------------------------------------ |
| 战地6 | 10/10/2025 | 06:11:58 | Part 1 | [【quin录播】 2025-10-10 羊蹄山之魂 + megabonk + 战地6单人](https://www.bilibili.com/video/av115350154780229/) |
| 战地6 | 10/11/2025 | 04:39:51 | Part 2 | [【quin录播】 2025-10-11 战地6](https://www.bilibili.com/video/av115355808762040/) |
| 战地6 | 10/13/2025 | 04:17:51 | Part 3 | [【quin录播】 2025-10-13 战地6](https://www.bilibili.com/video/av115367200428245/) |
| 战地6 | 10/14/2025 | 04:35:56 | Part 4 | [【quin录播】 2025-10-14 战地6](https://www.bilibili.com/video/av115372904680468/) |

## 羊蹄山之魂

| 游戏名称 | 直播日期 | 时长 | 集数   | 标题                                                         |
| -------- | -------- | ---- | ------ | ------------------------------------------------------------ |
| 羊蹄山之魂 | 10/1/2025 | 06:25:52 | Part 1 | [【quin录播】 2025-10-01 Keep Driving + 羊蹄山之魂](https://www.bilibili.com/video/av115299269478603/) |
| 羊蹄山之魂 | 10/2/2025 | 04:57:00 | Part 2 | [【quin录播】 2025-10-02 羊蹄山之魂](https://www.bilibili.com/video/av115304957019346/) |
| 羊蹄山之魂 | 10/4/2025 | 05:41:36 | Part 3 | [【quin录播】 2025-10-04 羊蹄山之魂](https://www.bilibili.com/video/av115315962875856/) |
| 羊蹄山之魂 | 10/5/2025 | 05:17:15 | Part 4 | [【quin录播】 2025-10-05 羊蹄山之魂](https://www.bilibili.com/video/av115321952272779/) |
| 羊蹄山之魂 | 10/7/2025 | 05:32:09 | Part 5 | [【quin录播】 2025-10-07 羊蹄山之魂](https://www.bilibili.com/video/av115333243412336/) |
| 羊蹄山之魂 | 10/8/2025 | 05:03:28 | Part 6 | [【quin录播】 2025-10-08 羊蹄山之魂](https://www.bilibili.com/video/av115338930821929/) |
| 羊蹄山之魂 | 10/10/2025 | 06:11:58 | Part 7 | [【quin录播】 2025-10-10 羊蹄山之魂 + megabonk + 战地6单人](https://www.bilibili.com/video/av115350154780229/) |
| 羊蹄山之魂 | 10/12/2025 | 06:01:41 | Part 8 | [【quin录播】 2025-10-12 羊蹄山之魂](https://www.bilibili.com/video/av115361529728603/) |

## megabonk

| 游戏名称 | 直播日期 | 时长 | 集数   | 标题                                                         |
| -------- | -------- | ---- | ------ | ------------------------------------------------------------ |
| megabonk | 10/10/2025 | 06:11:58 | Part 1 | [【quin录播】 2025-10-10 羊蹄山之魂 + megabonk + 战地6单人](https://www.bilibili.com/video/av115350154780229/) |

## cod22

| 游戏名称 | 直播日期 | 时长 | 集数   | 标题                                                         |
| -------- | -------- | ---- | ------ | ------------------------------------------------------------ |
| cod22 | 10/6/2025 | 03:46:24 | Part 1 | [【quin录播】 2025-10-06 cod22](https://www.bilibili.com/video/av115327471977644/) |

## Keep Driving

| 游戏名称 | 直播日期 | 时长 | 集数   | 标题                                                         |
| -------- | -------- | ---- | ------ | ------------------------------------------------------------ |
| Keep Driving | 9/30/2025 | 05:43:19 | Part 1 | [【quin录播】 2025-09-30 没票下车 + deep driving](https://www.bilibili.com/video/av115293514963105/) |
| Keep Driving | 10/1/2025 | 06:25:52 | Part 2 | [【quin录播】 2025-10-01 Keep Driving + 羊蹄山之魂](https://www.bilibili.com/video/av115299269478603/) |

## 没票下车

| 游戏名称 | 直播日期 | 时长 | 集数   | 标题                                                         |
| -------- | -------- | ---- | ------ | ------------------------------------------------------------ |
| 没票下车 | 9/30/2025 | 05:43:19 | Part 1 | [【quin录播】 2025-09-30 没票下车 + deep driving](https://www.bilibili.com/video/av115293514963105/) |

## 一步一脚印

| 游戏名称 | 直播日期 | 时长 | 集数   | 标题                                                         |
| -------- | -------- | ---- | ------ | ------------------------------------------------------------ |
| 一步一脚印 | 6/19/2025 | 05:02:19 | Part 1 | [【quin录播】 2025-06-19 暗区突围 + 一步一脚印](https://www.bilibili.com/video/av114710288600270/) |
| 一步一脚印 | 9/27/2025 | 04:52:01 | Part 2 | [【quin录播】 2025-09-27 一步一脚印](https://www.bilibili.com/video/av115276335089858/) |
| 一步一脚印 | 9/28/2025 | 05:11:54 | Part 3 | [【quin录播】 2025-09-28 一步一脚印](https://www.bilibili.com/video/av115282291005423/) |

## 消逝的光芒3

| 游戏名称 | 直播日期 | 时长 | 集数   | 标题                                                         |
| -------- | -------- | ---- | ------ | ------------------------------------------------------------ |
| 消逝的光芒3 | 9/19/2025 | 00:26:21 | Part 1 | [【quin录播】 2025-09-19 消逝的光芒3](https://www.bilibili.com/video/av115230684418651/) |
| 消逝的光芒3 | 9/26/2025 | 02:09:51 | Part 2 | [【quin录播】 2025-09-26 消逝的光芒3](https://www.bilibili.com/video/av115270731434335/) |

## 寂静岭f

| 游戏名称 | 直播日期 | 时长 | 集数   | 标题                                                         |
| -------- | -------- | ---- | ------ | ------------------------------------------------------------ |
| 寂静岭f | 9/23/2025 | 06:07:54 | Part 1 | [【quin录播】 2025-09-23 寂静岭f](https://www.bilibili.com/video/av115253937509417/) |
| 寂静岭f | 9/24/2025 | 05:59:35 | Part 2 | [【quin录播】 2025-09-24 寂静岭f](https://www.bilibili.com/video/av115259692094933/) |

## 无主之地4

| 游戏名称 | 直播日期 | 时长 | 集数   | 标题                                                         |
| -------- | -------- | ---- | ------ | ------------------------------------------------------------ |
| 无主之地4 | 9/13/2025 | 04:39:31 | Part 1 | [【quin录播】 2025-09-13 无主之地4](https://www.bilibili.com/video/av115197180124977/) |
| 无主之地4 | 9/15/2025 | 03:07:17 | Part 2 | [【quin录播】 2025-09-15 无主之地4](https://www.bilibili.com/video/av115209008122969/) |
| 无主之地4 | 9/16/2025 | 04:53:40 | Part 3 | [【quin录播】 2025-09-16 无主之地4](https://www.bilibili.com/video/av115214175439008/) |
| 无主之地4 | 9/22/2025 | 04:17:21 | Part 4 | [【quin录播】 2025-09-22 无主之地4](https://www.bilibili.com/video/av115248199634982/) |

## 寻找伪人

| 游戏名称 | 直播日期 | 时长 | 集数   | 标题                                                         |
| -------- | -------- | ---- | ------ | ------------------------------------------------------------ |
| 寻找伪人 | 9/17/2025 | 04:47:39 | Part 1 | [【quin录播】 2025-09-17 寻找伪人](https://www.bilibili.com/video/av115220030752262/) |

## 越狱模拟器：挖掘

| 游戏名称 | 直播日期 | 时长 | 集数   | 标题                                                         |
| -------- | -------- | ---- | ------ | ------------------------------------------------------------ |
| 越狱模拟器：挖掘 | 9/9/2025 | 05:07:33 | Part 1 | [【quin录播】 2025-09-09 越狱模拟器：挖掘 + 动物收容所2](https://www.bilibili.com/video/av115174715491715/) |

## 动物收容所2

| 游戏名称 | 直播日期 | 时长 | 集数   | 标题                                                         |
| -------- | -------- | ---- | ------ | ------------------------------------------------------------ |
| 动物收容所2 | 9/9/2025 | 05:07:33 | Part 1 | [【quin录播】 2025-09-09 越狱模拟器：挖掘 + 动物收容所2](https://www.bilibili.com/video/av115174715491715/) |

## 消逝的光芒2

| 游戏名称 | 直播日期 | 时长 | 集数   | 标题                                                         |
| -------- | -------- | ---- | ------ | ------------------------------------------------------------ |
| 消逝的光芒2 | 9/3/2025 | 05:41:14 | Part 1 | [【quin录播】 2025-09-03 消逝的光芒2 + 银河破裂者](https://www.bilibili.com/video/av115141009998160/) |
| 消逝的光芒2 | 9/4/2025 | 04:21:27 | Part 2 | [【quin录播】 2025-09-04 消逝的光芒2](https://www.bilibili.com/video/av115146211005829/) |
| 消逝的光芒2 | 9/6/2025 | 05:47:54 | Part 3 | [【quin录播】 2025-09-06 消逝的光芒2](https://www.bilibili.com/video/av115157653134855/) |
| 消逝的光芒2 | 9/8/2025 | 04:43:31 | Part 4 | [【quin录播】 2025-09-08 消逝的光芒2](https://www.bilibili.com/video/av115168843399548/) |

## 银河破裂者

| 游戏名称 | 直播日期 | 时长 | 集数   | 标题                                                         |
| -------- | -------- | ---- | ------ | ------------------------------------------------------------ |
| 银河破裂者 | 9/3/2025 | 05:41:14 | Part 1 | [【quin录播】 2025-09-03 消逝的光芒2 + 银河破裂者](https://www.bilibili.com/video/av115141009998160/) |
| 银河破裂者 | 9/5/2025 | 04:26:09 | Part 2 | [【quin录播】 2025-09-05 银河破裂者](https://www.bilibili.com/video/av115151948813336/) |

## 四海兄弟：故乡

| 游戏名称 | 直播日期 | 时长 | 集数   | 标题                                                         |
| -------- | -------- | ---- | ------ | ------------------------------------------------------------ |
| 四海兄弟：故乡 | 9/1/2025 | 05:40:48 | Part 1 | [【quin录播】 2025-09-01 四海兄弟：故乡](https://www.bilibili.com/video/av115129282731838/) |
| 四海兄弟：故乡 | 9/2/2025 | 05:44:01 | Part 2 | [【quin录播】 2025-09-02 四海兄弟：故乡](https://www.bilibili.com/video/av115135054093947/) |

## 合金装备3重制版

| 游戏名称 | 直播日期 | 时长 | 集数   | 标题                                                         |
| -------- | -------- | ---- | ------ | ------------------------------------------------------------ |
| 合金装备3重制版 | 8/26/2025 | 03:34:07 | Part 1 | [【quin录播】 2025-08-26 合金装备3重制版](https://www.bilibili.com/video/av115094117749357/) |
| 合金装备3重制版 | 8/27/2025 | 06:39:42 | Part 2 | [【quin录播】 2025-08-27 合金装备3重制版](https://www.bilibili.com/video/av115099905824307/) |
| 合金装备3重制版 | 8/31/2025 | 06:25:20 | Part 3 | [【quin录播】 2025-08-31 合金装备3重制版](https://www.bilibili.com/video/av115123612026872/) |

## 暗区突围

| 游戏名称 | 直播日期 | 时长 | 集数   | 标题                                                         |
| -------- | -------- | ---- | ------ | ------------------------------------------------------------ |
| 暗区突围 | 4/29/2025 | 05:20:32 | Part 1 | [【quin录播】 2025-04-29 暗区突围](https://www.bilibili.com/video/av114421619756017/) |
| 暗区突围 | 4/30/2025 | 04:10:14 | Part 2 | [【quin录播】 2025-04-30 暗区突围](https://www.bilibili.com/video/av114427105904796/) |
| 暗区突围 | 5/2/2025 | 04:50:04 | Part 3 | [【quin录播】 2025-05-02 暗区突围 + 漫威争锋](https://www.bilibili.com/video/av114438514479952/) |
| 暗区突围 | 5/3/2025 | 04:26:43 | Part 4 | [【quin录播】 2025-05-03 暗区突围](https://www.bilibili.com/video/av114444302556192/) |
| 暗区突围 | 5/5/2025 | 04:48:58 | Part 5 | [【quin录播】 2025-05-05 暗区突围](https://www.bilibili.com/video/av114455442690586/) |
| 暗区突围 | 5/7/2025 | 04:18:39 | Part 6 | [【quin录播】 2025-05-07 gta6宣传 + 黑神话：悟空 + 暗区突围](https://www.bilibili.com/video/av114466918243153/) |
| 暗区突围 | 5/9/2025 | 04:59:11 | Part 7 | [【quin录播】 2025-05-09 暗区突围](https://www.bilibili.com/video/av114478175817780/) |
| 暗区突围 | 5/20/2025 | 04:31:11 | Part 8 | [【quin录播】 2025-05-20 暗区突围](https://www.bilibili.com/video/av114540452843623/) |
| 暗区突围 | 5/24/2025 | 07:26:31 | Part 9 | [【quin录播】 2025-05-24 暗区突围 + JDM：漂移大师](https://www.bilibili.com/video/av114562934243474/) |
| 暗区突围 | 5/28/2025 | 04:11:22 | Part 10 | [【quin录播】 2025-05-28 暗区突围](https://www.bilibili.com/video/av114588938935642/) |
| 暗区突围 | 5/29/2025 | 03:52:14 | Part 11 | [【quin录播】 2025-05-29 暗区突围](https://www.bilibili.com/video/av114591472289247/) |
| 暗区突围 | 6/14/2025 | 04:46:52 | Part 12 | [【quin录播】 2025-06-14 宝可梦：朱 + 暗区突围](https://www.bilibili.com/video/av114682019056831/) |
| 暗区突围 | 6/16/2025 | 04:36:00 | Part 13 | [【quin录播】 2025-06-16 暗区突围](https://www.bilibili.com/video/av114693343544903/) |
| 暗区突围 | 6/19/2025 | 05:02:19 | Part 14 | [【quin录播】 2025-06-19 暗区突围 + 一步一脚印](https://www.bilibili.com/video/av114710288600270/) |
| 暗区突围 | 6/20/2025 | 05:03:20 | Part 15 | [【quin录播】 2025-06-20 暗区突围](https://www.bilibili.com/video/av114715992788123/) |
| 暗区突围 | 6/21/2025 | 05:22:12 | Part 16 | [【quin录播】 2025-06-21 暗区突围](https://www.bilibili.com/video/av114721613156438/) |
| 暗区突围 | 8/30/2025 | 02:37:42 | Part 17 | [【quin录播】 2025-08-30 暗区突围（大韦代三人杂谈回）](https://www.bilibili.com/video/av115117656115267/) |

## 越狱模拟器

| 游戏名称 | 直播日期 | 时长 | 集数   | 标题                                                         |
| -------- | -------- | ---- | ------ | ------------------------------------------------------------ |
| 越狱模拟器 | 7/28/2025 | 02:38:22 | Part 1 | [【quin录播】 2025-07-28 越狱模拟器](https://www.bilibili.com/video/av114930674045586/) |
| 越狱模拟器 | 7/29/2025 | 02:28:24 | Part 2 | [【quin录播】 2025-07-29 越狱模拟器 + 动物迷城](https://www.bilibili.com/video/av114936915170309/) |

## 动物迷城

| 游戏名称 | 直播日期 | 时长 | 集数   | 标题                                                         |
| -------- | -------- | ---- | ------ | ------------------------------------------------------------ |
| 动物迷城 | 7/29/2025 | 02:28:24 | Part 1 | [【quin录播】 2025-07-29 越狱模拟器 + 动物迷城](https://www.bilibili.com/video/av114936915170309/) |

## 明末：渊虚之羽

| 游戏名称 | 直播日期 | 时长 | 集数   | 标题                                                         |
| -------- | -------- | ---- | ------ | ------------------------------------------------------------ |
| 明末：渊虚之羽 | 7/24/2025 | 05:51:34 | Part 1 | [【quin录播】 2025-07-24 明末：渊虚之羽](https://www.bilibili.com/video/av114908511342007/) |
| 明末：渊虚之羽 | 7/25/2025 | 02:00:02 | Part 2 | [【quin录播】 2025-07-25 明末：渊虚之羽（不全）](https://www.bilibili.com/video/av114914282702259/) |

## 咚奇刚 蕉力全开

| 游戏名称 | 直播日期 | 时长 | 集数   | 标题                                                         |
| -------- | -------- | ---- | ------ | ------------------------------------------------------------ |
| 咚奇刚 蕉力全开 | 7/16/2025 | 05:15:16 | Part 1 | [【quin录播】 2025-07-16 警区 + 咚奇刚 蕉力全开](https://www.bilibili.com/video/av114863296811728/) |
| 咚奇刚 蕉力全开 | 7/17/2025 | 04:57:28 | Part 2 | [【quin录播】 2025-07-17 咚奇刚 蕉力全开](https://www.bilibili.com/video/av114869001133535/) |
| 咚奇刚 蕉力全开 | 7/20/2025 | 05:20:38 | Part 3 | [【quin录播】 2025-07-20 suit for hire + 咚奇刚 蕉力全开](https://www.bilibili.com/video/av114885929276012/) |
| 咚奇刚 蕉力全开 | 7/21/2025 | 05:21:23 | Part 4 | [【quin录播】 2025-07-21 咚奇刚 蕉力全开](https://www.bilibili.com/video/av114891667083353/) |
| 咚奇刚 蕉力全开 | 7/22/2025 | 04:37:09 | Part 5 | [【quin录播】 2025-07-22 宝可梦直面会 + 咚奇刚 蕉力全开](https://www.bilibili.com/video/av114897304161589/) |
| 咚奇刚 蕉力全开 | 7/23/2025 | 04:49:15 | Part 6 | [【quin录播】 2025-07-23 咚奇刚 蕉力全开](https://www.bilibili.com/video/av114902974865138/) |

## 宝可梦直面会

| 游戏名称 | 直播日期 | 时长 | 集数   | 标题                                                         |
| -------- | -------- | ---- | ------ | ------------------------------------------------------------ |
| 宝可梦直面会 | 7/22/2025 | 04:37:09 | Part 1 | [【quin录播】 2025-07-22 宝可梦直面会 + 咚奇刚 蕉力全开](https://www.bilibili.com/video/av114897304161589/) |

## suit for hire

| 游戏名称 | 直播日期 | 时长 | 集数   | 标题                                                         |
| -------- | -------- | ---- | ------ | ------------------------------------------------------------ |
| suit for hire | 7/18/2025 | 04:42:18 | Part 1 | [【quin录播】 2025-07-18 魔卡学院 + suit for hire](https://www.bilibili.com/video/av114874537544855/) |
| suit for hire | 7/20/2025 | 05:20:38 | Part 2 | [【quin录播】 2025-07-20 suit for hire + 咚奇刚 蕉力全开](https://www.bilibili.com/video/av114885929276012/) |

## 魔卡学院

| 游戏名称 | 直播日期 | 时长 | 集数   | 标题                                                         |
| -------- | -------- | ---- | ------ | ------------------------------------------------------------ |
| 魔卡学院 | 7/18/2025 | 04:42:18 | Part 1 | [【quin录播】 2025-07-18 魔卡学院 + suit for hire](https://www.bilibili.com/video/av114874537544855/) |

## 警区

| 游戏名称 | 直播日期 | 时长 | 集数   | 标题                                                         |
| -------- | -------- | ---- | ------ | ------------------------------------------------------------ |
| 警区 | 7/10/2025 | 05:07:42 | Part 1 | [【quin录播】 2025-07-10 警区](https://www.bilibili.com/video/av114829222219964/) |
| 警区 | 7/12/2025 | 04:38:17 | Part 2 | [【quin录播】 2025-07-12 the headliners + 警区](https://www.bilibili.com/video/av114840546839550/) |
| 警区 | 7/16/2025 | 05:15:16 | Part 3 | [【quin录播】 2025-07-16 警区 + 咚奇刚 蕉力全开](https://www.bilibili.com/video/av114863296811728/) |

## school 666

| 游戏名称 | 直播日期 | 时长 | 集数   | 标题                                                         |
| -------- | -------- | ---- | ------ | ------------------------------------------------------------ |
| school 666 | 7/15/2025 | 05:20:23 | Part 1 | [【quin录播】 2025-07-15 school 666](https://www.bilibili.com/video/av114862323736006/) |

## the headliners

| 游戏名称 | 直播日期 | 时长 | 集数   | 标题                                                         |
| -------- | -------- | ---- | ------ | ------------------------------------------------------------ |
| the headliners | 7/12/2025 | 04:38:17 | Part 1 | [【quin录播】 2025-07-12 the headliners + 警区](https://www.bilibili.com/video/av114840546839550/) |

## mycopunk

| 游戏名称 | 直播日期 | 时长 | 集数   | 标题                                                         |
| -------- | -------- | ---- | ------ | ------------------------------------------------------------ |
| mycopunk | 7/11/2025 | 03:57:31 | Part 1 | [【quin录播】 2025-07-11 mycopunk + 曙光防御 + 漫威争锋](https://www.bilibili.com/video/av114834960024949/) |

## 曙光防御

| 游戏名称 | 直播日期 | 时长 | 集数   | 标题                                                         |
| -------- | -------- | ---- | ------ | ------------------------------------------------------------ |
| 曙光防御 | 7/11/2025 | 03:57:31 | Part 1 | [【quin录播】 2025-07-11 mycopunk + 曙光防御 + 漫威争锋](https://www.bilibili.com/video/av114834960024949/) |

## f1

| 游戏名称 | 直播日期 | 时长 | 集数   | 标题                                                         |
| -------- | -------- | ---- | ------ | ------------------------------------------------------------ |
| f1 | 7/9/2025 | 03:08:21 | Part 1 | [【quin录播】 2025-07-09 （不全）f1](https://www.bilibili.com/video/av114824138725668/) |

## peak

| 游戏名称 | 直播日期 | 时长 | 集数   | 标题                                                         |
| -------- | -------- | ---- | ------ | ------------------------------------------------------------ |
| peak | 7/4/2025 | 05:28:16 | Part 1 | [【quin录播】 2025-07-04 peak](https://www.bilibili.com/video/av114795315465992/) |
| peak | 7/6/2025 | 04:57:46 | Part 2 | [【quin录播】 2025-07-06 小偷模拟器 + peak](https://www.bilibili.com/video/av114806656863356/) |
| peak | 7/8/2025 | 05:28:02 | Part 3 | [【quin录播】 2025-07-08 peak](https://www.bilibili.com/video/av114817880821504/) |

## 小偷模拟器

| 游戏名称 | 直播日期 | 时长 | 集数   | 标题                                                         |
| -------- | -------- | ---- | ------ | ------------------------------------------------------------ |
| 小偷模拟器 | 7/5/2025 | 04:33:45 | Part 1 | [【quin录播】 2025-07-05 小偷模拟器](https://www.bilibili.com/video/av114801003070793/) |
| 小偷模拟器 | 7/6/2025 | 04:57:46 | Part 2 | [【quin录播】 2025-07-06 小偷模拟器 + peak](https://www.bilibili.com/video/av114806656863356/) |

## 死亡搁浅2

| 游戏名称 | 直播日期 | 时长 | 集数   | 标题                                                         |
| -------- | -------- | ---- | ------ | ------------------------------------------------------------ |
| 死亡搁浅2 | 6/23/2025 | 07:08:28 | Part 1 | [【quin录播】 2025-06-23 死亡搁浅2](https://www.bilibili.com/video/av114732971398277/) |
| 死亡搁浅2 | 6/24/2025 | 07:49:30 | Part 2 | [【quin录播】 2025-06-24 死亡搁浅2](https://www.bilibili.com/video/av114738340173481/) |
| 死亡搁浅2 | 6/25/2025 | 05:00:03 | Part 3 | [【quin录播】 2025-06-25 死亡搁浅2——已爆炸](https://www.bilibili.com/video/av114744346349536/) |
| 死亡搁浅2 | 6/26/2025 | 05:40:01 | Part 4 | [【quin录播】 2025-06-26 死亡搁浅2](https://www.bilibili.com/video/av114749949871770/) |
| 死亡搁浅2 | 6/27/2025 | 05:53:48 | Part 5 | [【quin录播】 2025-06-27 死亡搁浅2](https://www.bilibili.com/video/av114755754794947/) |
| 死亡搁浅2 | 6/28/2025 | 05:47:36 | Part 6 | [【quin录播】 2025-06-28 死亡搁浅2](https://www.bilibili.com/video/av114761341669262/) |
| 死亡搁浅2 | 6/30/2025 | 06:33:42 | Part 7 | [【quin录播】 2025-06-30 死亡搁浅2](https://www.bilibili.com/video/av114772666222756/) |
| 死亡搁浅2 | 7/1/2025 | 06:42:53 | Part 8 | [【quin录播】 2025-07-01 死亡搁浅2](https://www.bilibili.com/video/av114778320276062/) |
| 死亡搁浅2 | 7/2/2025 | 05:25:53 | Part 9 | [【quin录播】 2025-07-02 死亡搁浅2](https://www.bilibili.com/video/av114783990911892/) |
| 死亡搁浅2 | 7/3/2025 | 03:00:03 | Part 10 | [【quin录播】 2025-07-03 gt7 + 死亡搁浅2（已爆炸）](https://www.bilibili.com/video/av114789728655751/) |

## PEAK

| 游戏名称 | 直播日期 | 时长 | 集数   | 标题                                                         |
| -------- | -------- | ---- | ------ | ------------------------------------------------------------ |
| PEAK | 6/22/2025 | 03:35:48 | Part 1 | [【quin录播】 2025-06-22 PEAK](https://www.bilibili.com/video/av114727468474330/) |

## 宝可梦：朱

| 游戏名称 | 直播日期 | 时长 | 集数   | 标题                                                         |
| -------- | -------- | ---- | ------ | ------------------------------------------------------------ |
| 宝可梦：朱 | 6/8/2025 | 06:03:08 | Part 1 | [【quin录播】 2025-06-08 宝可梦：朱 + Switch2秘密展 + 马里奥赛车：世界 + 塞尔达传说：王国之泪 + XBOX游戏发布会](https://www.bilibili.com/video/av114647894067942/) |
| 宝可梦：朱 | 6/9/2025 | 04:07:49 | Part 2 | [【quin录播】 2025-06-09 宝可梦：朱](https://www.bilibili.com/video/av114653849981611/) |
| 宝可梦：朱 | 6/10/2025 | 04:52:08 | Part 3 | [【quin录播】 2025-06-10 马里奥赛车世界 + 宝可梦：朱](https://www.bilibili.com/video/av114659436794698/) |
| 宝可梦：朱 | 6/14/2025 | 04:46:52 | Part 4 | [【quin录播】 2025-06-14 宝可梦：朱 + 暗区突围](https://www.bilibili.com/video/av114682019056831/) |
| 宝可梦：朱 | 6/15/2025 | 04:26:03 | Part 5 | [【quin录播】 2025-06-15 宝可梦：朱](https://www.bilibili.com/video/av114687739960996/) |
| 宝可梦：朱 | 6/17/2025 | 05:35:49 | Part 6 | [【quin录播】 2025-06-17 宝可梦：朱](https://www.bilibili.com/video/av114699047862296/) |

## 马里奥赛车：世界

| 游戏名称 | 直播日期 | 时长 | 集数   | 标题                                                         |
| -------- | -------- | ---- | ------ | ------------------------------------------------------------ |
| 马里奥赛车：世界 | 6/7/2025 | 03:25:31 | Part 1 | [【quin录播】 2025-06-07 马里奥赛车世界](https://www.bilibili.com/video/av114642676354889/) |
| 马里奥赛车：世界 | 6/8/2025 | 06:03:08 | Part 2 | [【quin录播】 2025-06-08 宝可梦：朱 + Switch2秘密展 + 马里奥赛车：世界 + 塞尔达传说：王国之泪 + XBOX游戏发布会](https://www.bilibili.com/video/av114647894067942/) |
| 马里奥赛车：世界 | 6/10/2025 | 04:52:08 | Part 3 | [【quin录播】 2025-06-10 马里奥赛车世界 + 宝可梦：朱](https://www.bilibili.com/video/av114659436794698/) |
| 马里奥赛车：世界 | 6/11/2025 | 04:15:54 | Part 4 | [【quin录播】 2025-06-11 马里奥赛车世界](https://www.bilibili.com/video/av114665074006753/) |

## Switch2秘密展

| 游戏名称 | 直播日期 | 时长 | 集数   | 标题                                                         |
| -------- | -------- | ---- | ------ | ------------------------------------------------------------ |
| Switch2秘密展 | 6/8/2025 | 06:03:08 | Part 1 | [【quin录播】 2025-06-08 宝可梦：朱 + Switch2秘密展 + 马里奥赛车：世界 + 塞尔达传说：王国之泪 + XBOX游戏发布会](https://www.bilibili.com/video/av114647894067942/) |

## 塞尔达传说：王国之泪

| 游戏名称 | 直播日期 | 时长 | 集数   | 标题                                                         |
| -------- | -------- | ---- | ------ | ------------------------------------------------------------ |
| 塞尔达传说：王国之泪 | 6/8/2025 | 06:03:08 | Part 1 | [【quin录播】 2025-06-08 宝可梦：朱 + Switch2秘密展 + 马里奥赛车：世界 + 塞尔达传说：王国之泪 + XBOX游戏发布会](https://www.bilibili.com/video/av114647894067942/) |

## XBOX游戏发布会

| 游戏名称 | 直播日期 | 时长 | 集数   | 标题                                                         |
| -------- | -------- | ---- | ------ | ------------------------------------------------------------ |
| XBOX游戏发布会 | 6/8/2025 | 06:03:08 | Part 1 | [【quin录播】 2025-06-08 宝可梦：朱 + Switch2秘密展 + 马里奥赛车：世界 + 塞尔达传说：王国之泪 + XBOX游戏发布会](https://www.bilibili.com/video/av114647894067942/) |

## 艾尔登法环

| 游戏名称 | 直播日期 | 时长 | 集数   | 标题                                                         |
| -------- | -------- | ---- | ------ | ------------------------------------------------------------ |
| 艾尔登法环 | 6/23/2024 | 05:55:57 | Part 1 | [【quin录播】 2024-06-23 艾尔登法环dlc](https://www.bilibili.com/video/av1155852196/) |
| 艾尔登法环 | 6/24/2024 | 05:43:34 | Part 2 | [【quin录播】 2024-06-24 艾尔登法环dlc](https://www.bilibili.com/video/av1555956811/) |
| 艾尔登法环 | 6/25/2024 | 05:22:07 | Part 3 | [【quin录播】 2024-06-25 艾尔登法环dlc](https://www.bilibili.com/video/av1905762268/) |
| 艾尔登法环 | 6/26/2024 | 07:09:43 | Part 4 | [【quin录播】 2024-06-26 Chained Together + 艾尔登法环dlc](https://www.bilibili.com/video/av1205815092/) |
| 艾尔登法环 | 7/2/2024 | 02:01:12 | Part 5 | [【quin录播】 2024-07-02 残缺——联机艾尔登法环](https://www.bilibili.com/video/av1105770120/) |
| 艾尔登法环 | 7/3/2024 | 04:06:31 | Part 6 | [【quin录播】 2024-07-03 联机艾尔登法环](https://www.bilibili.com/video/av1756128122/) |
| 艾尔登法环 | 7/4/2024 | 04:55:51 | Part 7 | [【quin录播】 2024-07-04 艾尔登法环 + 清零计划2](https://www.bilibili.com/video/av1106128498/) |
| 艾尔登法环 | 7/6/2024 | 05:11:02 | Part 8 | [【quin录播】 2024-07-06 联机艾尔登法环 + 角斗士工会经理](https://www.bilibili.com/video/av1506080287/) |
| 艾尔登法环 | 7/15/2024 | 04:07:54 | Part 9 | [【quin录播】 2024-07-15 联机艾尔登法环](https://www.bilibili.com/video/av1056024038/) |
| 艾尔登法环 | 7/16/2024 | 04:14:35 | Part 10 | [【quin录播】 2024-07-16 联机艾尔登法环](https://www.bilibili.com/video/av1856017320/) |
| 艾尔登法环 | 5/30/2025 | 05:56:24 | Part 11 | [【quin录播】 2025-05-30 铃兰之剑 + 黑夜君临](https://www.bilibili.com/video/av114596975284096/) |
| 艾尔登法环 | 6/1/2025 | 07:17:24 | Part 12 | [【quin录播】 2025-06-01 黑夜君临](https://www.bilibili.com/video/av114608299835697/) |
| 艾尔登法环 | 6/5/2025 | 04:27:57 | Part 13 | [【quin录播】 2025-06-05 黑夜君临](https://www.bilibili.com/video/av114631200740862/) |
| 艾尔登法环 | 6/6/2025 | 03:58:42 | Part 14 | [【quin录播】 2025-06-06 黑夜君临](https://www.bilibili.com/video/av114636854661644/) |

## 泡姆泡姆

| 游戏名称 | 直播日期 | 时长 | 集数   | 标题                                                         |
| -------- | -------- | ---- | ------ | ------------------------------------------------------------ |
| 泡姆泡姆 | 10/16/2024 | 04:40:11 | Part 1 | [【quin录播】 2024-10-16 泡姆泡姆 + 无畏契约](https://www.bilibili.com/video/av113317293067671/) |
| 泡姆泡姆 | 6/2/2025 | 05:34:12 | Part 2 | [【quin录播】 2025-06-02 泡姆泡姆](https://www.bilibili.com/video/av114613735787152/) |
| 泡姆泡姆 | 6/3/2025 | 05:53:04 | Part 3 | [【quin录播】 2025-06-03 泡姆泡姆](https://www.bilibili.com/video/av114619406357252/) |

## 铃兰之剑

| 游戏名称 | 直播日期 | 时长 | 集数   | 标题                                                         |
| -------- | -------- | ---- | ------ | ------------------------------------------------------------ |
| 铃兰之剑 | 5/30/2025 | 05:56:24 | Part 1 | [【quin录播】 2025-05-30 铃兰之剑 + 黑夜君临](https://www.bilibili.com/video/av114596975284096/) |

## RoadCraft

| 游戏名称 | 直播日期 | 时长 | 集数   | 标题                                                         |
| -------- | -------- | ---- | ------ | ------------------------------------------------------------ |
| RoadCraft | 5/21/2025 | 03:00:02 | Part 1 | [【quin录播】 2025-05-21 RoadCraft（已爆炸）](https://www.bilibili.com/video/av114546006038087/) |
| RoadCraft | 5/22/2025 | 04:19:33 | Part 2 | [【quin录播】 2025-05-22 RoadCraft](https://www.bilibili.com/video/av114551928460805/) |
| RoadCraft | 5/27/2025 | 04:13:37 | Part 3 | [【quin录播】 2025-05-27 RoadCraft](https://www.bilibili.com/video/av114584392306572/) |

## JDM：漂移大师

| 游戏名称 | 直播日期 | 时长 | 集数   | 标题                                                         |
| -------- | -------- | ---- | ------ | ------------------------------------------------------------ |
| JDM：漂移大师 | 5/24/2025 | 07:26:31 | Part 1 | [【quin录播】 2025-05-24 暗区突围 + JDM：漂移大师](https://www.bilibili.com/video/av114562934243474/) |
| JDM：漂移大师 | 5/26/2025 | 01:00:02 | Part 2 | [【quin录播】 2025-05-26 JDM：漂移大师（已爆炸）](https://www.bilibili.com/video/av114574678299493/) |

## 铃兰之剑发布会

| 游戏名称 | 直播日期 | 时长 | 集数   | 标题                                                         |
| -------- | -------- | ---- | ------ | ------------------------------------------------------------ |
| 铃兰之剑发布会 | 5/23/2025 | 04:25:49 | Part 1 | [【quin录播】 2025-05-23 铃兰之剑发布会 + 幻想生活i](https://www.bilibili.com/video/av114557062225061/) |

## 幻想生活i：转圈圈的龙与偷取时间的少女

| 游戏名称 | 直播日期 | 时长 | 集数   | 标题                                                         |
| -------- | -------- | ---- | ------ | ------------------------------------------------------------ |
| 幻想生活i：转圈圈的龙与偷取时间的少女 | 5/19/2025 | 05:06:04 | Part 1 | [【quin录播】 2025-05-19 幻想生活i：转圈圈的龙与偷取时间的少女](https://www.bilibili.com/video/av114534832412581/) |
| 幻想生活i：转圈圈的龙与偷取时间的少女 | 5/23/2025 | 04:25:49 | Part 2 | [【quin录播】 2025-05-23 铃兰之剑发布会 + 幻想生活i](https://www.bilibili.com/video/av114557062225061/) |

## 黑暗之魂

| 游戏名称 | 直播日期 | 时长 | 集数   | 标题                                                         |
| -------- | -------- | ---- | ------ | ------------------------------------------------------------ |
| 黑暗之魂 | 4/20/2025 | 05:04:23 | Part 1 | [【quin录播】 2025-04-20 联机黑暗之魂 + 漫威争锋](https://www.bilibili.com/video/av114370667352273/) |
| 黑暗之魂 | 4/21/2025 | 04:19:12 | Part 2 | [【quin录播】 2025-04-21 联机黑暗之魂](https://www.bilibili.com/video/av114376338049802/) |
| 黑暗之魂 | 4/23/2025 | 03:44:32 | Part 3 | [【quin录播】 2025-04-23 联机黑暗之魂（缺22-23）](https://www.bilibili.com/video/av114387276799849/) |
| 黑暗之魂 | 4/28/2025 | 04:50:15 | Part 4 | [【quin录播】 2025-04-28 联机黑暗之魂 + 漫威争锋](https://www.bilibili.com/video/av114415898725559/) |
| 黑暗之魂 | 5/8/2025 | 04:58:07 | Part 5 | [【quin录播】 2025-05-08 联机黑暗之魂](https://www.bilibili.com/video/av114472572162052/) |

## gta6宣传

| 游戏名称 | 直播日期 | 时长 | 集数   | 标题                                                         |
| -------- | -------- | ---- | ------ | ------------------------------------------------------------ |
| gta6宣传 | 5/7/2025 | 04:18:39 | Part 1 | [【quin录播】 2025-05-07 gta6宣传 + 黑神话：悟空 + 暗区突围](https://www.bilibili.com/video/av114466918243153/) |

## 黑神话：悟空

| 游戏名称 | 直播日期 | 时长 | 集数   | 标题                                                         |
| -------- | -------- | ---- | ------ | ------------------------------------------------------------ |
| 黑神话：悟空 | 8/20/2024 | 15:49:35 | Part 1 | [【quin录播】 2024-08-20 黑神话：悟空](https://www.bilibili.com/video/av112992284837861/) |
| 黑神话：悟空 | 8/21/2024 | 09:48:10 | Part 2 | [【quin录播】 2024-08-21 黑神话：悟空](https://www.bilibili.com/video/av112999985644637/) |
| 黑神话：悟空 | 8/22/2024 | 06:59:27 | Part 3 | [【quin录播】 2024-08-22 黑神话：悟空](https://www.bilibili.com/video/av113005589367595/) |
| 黑神话：悟空 | 8/23/2024 | 07:46:30 | Part 4 | [【quin录播】 2024-08-23 黑神话：悟空](https://www.bilibili.com/video/av113011679364357/) |
| 黑神话：悟空 | 8/24/2024 | 05:17:09 | Part 5 | [【quin录播】 2024-08-24 黑神话：悟空](https://www.bilibili.com/video/av113017383551767/) |
| 黑神话：悟空 | 8/27/2024 | 05:03:19 | Part 6 | [【quin录播】 2024-08-27 黑神话：悟空](https://www.bilibili.com/video/av113034261434044/) |
| 黑神话：悟空 | 8/28/2024 | 05:00:39 | Part 7 | [【quin录播】 2024-08-28 黑神话：悟空](https://www.bilibili.com/video/av113040049702968/) |
| 黑神话：悟空 | 8/29/2024 | 05:00:29 | Part 8 | [【quin录播】 2024-08-29 黑神话：悟空](https://www.bilibili.com/video/av113045586051768/) |
| 黑神话：悟空 | 8/30/2024 | 05:18:17 | Part 9 | [【quin录播】 2024-08-30 黑神话：悟空](https://www.bilibili.com/video/av113051307214140/) |
| 黑神话：悟空 | 9/2/2024 | 05:11:43 | Part 10 | [【quin录播】 2024-09-02 the classrooms + 黑神话：悟空](https://www.bilibili.com/video/av113068050744651/) |
| 黑神话：悟空 | 12/16/2024 | 04:25:16 | Part 11 | [【quin录播】 2024-12-16 黑神话：悟空 + 漫威争锋（后半段无弹幕）](https://www.bilibili.com/video/av113662853387112/) |
| 黑神话：悟空 | 12/17/2024 | 05:21:25 | Part 12 | [【quin录播】 2024-12-17 笼子 + 黑神话：悟空 + 漫威争锋](https://www.bilibili.com/video/av113668507308155/) |
| 黑神话：悟空 | 12/19/2024 | 04:48:15 | Part 13 | [【quin录播】 2024-12-19 黑神话：悟空 + 漫威争锋](https://www.bilibili.com/video/av113679865485644/) |
| 黑神话：悟空 | 5/7/2025 | 04:18:39 | Part 14 | [【quin录播】 2025-05-07 gta6宣传 + 黑神话：悟空 + 暗区突围](https://www.bilibili.com/video/av114466918243153/) |

## the mr.rabbit magic show

| 游戏名称 | 直播日期 | 时长 | 集数   | 标题                                                         |
| -------- | -------- | ---- | ------ | ------------------------------------------------------------ |
| the mr.rabbit magic show | 5/6/2025 | 03:52:20 | Part 1 | [【quin录播】 2025-05-06 the mr.rabbit magic show](https://www.bilibili.com/video/av114461247540169/) |

## 破碎族裔

| 游戏名称 | 直播日期 | 时长 | 集数   | 标题                                                         |
| -------- | -------- | ---- | ------ | ------------------------------------------------------------ |
| 破碎族裔 | 4/26/2025 | 04:49:26 | Part 1 | [【quin录播】 2025-04-26 破碎族裔](https://www.bilibili.com/video/av114404523837565/) |

## 光与影：33号远征队

| 游戏名称 | 直播日期 | 时长 | 集数   | 标题                                                         |
| -------- | -------- | ---- | ------ | ------------------------------------------------------------ |
| 光与影：33号远征队 | 4/24/2025 | 05:05:14 | Part 1 | [【quin录播】 2025-04-24 光与影：33号远征队](https://www.bilibili.com/video/av114393182377140/) |
| 光与影：33号远征队 | 4/25/2025 | 05:12:48 | Part 2 | [【quin录播】 2025-04-25 漫威争锋 + 光与影：33号远征队](https://www.bilibili.com/video/av114398953801125/) |

## 雾影猎人

| 游戏名称 | 直播日期 | 时长 | 集数   | 标题                                                         |
| -------- | -------- | ---- | ------ | ------------------------------------------------------------ |
| 雾影猎人 | 4/22/2025 | 04:22:18 | Part 1 | [【quin录播】 2025-04-22 雾影猎人 + 上古卷轴4](https://www.bilibili.com/video/av114381874532371/) |

## 上古卷轴4

| 游戏名称 | 直播日期 | 时长 | 集数   | 标题                                                         |
| -------- | -------- | ---- | ------ | ------------------------------------------------------------ |
| 上古卷轴4 | 4/22/2025 | 04:22:18 | Part 1 | [【quin录播】 2025-04-22 雾影猎人 + 上古卷轴4](https://www.bilibili.com/video/av114381874532371/) |

## 家有恶邻

| 游戏名称 | 直播日期 | 时长 | 集数   | 标题                                                         |
| -------- | -------- | ---- | ------ | ------------------------------------------------------------ |
| 家有恶邻 | 4/19/2025 | 04:36:56 | Part 1 | [【quin录播】 2025-04-19 家有恶邻](https://www.bilibili.com/video/av114364828877902/) |

## 越来越黑暗

| 游戏名称 | 直播日期 | 时长 | 集数   | 标题                                                         |
| -------- | -------- | ---- | ------ | ------------------------------------------------------------ |
| 越来越黑暗 | 4/11/2025 | 03:02:41 | Part 1 | [【quin录播】 2025-04-11 越来越黑暗](https://www.bilibili.com/video/av114319312294627/) |
| 越来越黑暗 | 4/18/2025 | 05:47:46 | Part 2 | [【quin录播】 2025-04-18 越来越黑暗 + 漫威争锋](https://www.bilibili.com/video/av114358923365190/) |

## 死亡搁浅

| 游戏名称 | 直播日期 | 时长 | 集数   | 标题                                                         |
| -------- | -------- | ---- | ------ | ------------------------------------------------------------ |
| 死亡搁浅 | 3/14/2025 | 05:41:52 | Part 1 | [【quin录播】 2025-03-14 死亡搁浅（已爆炸）](https://www.bilibili.com/video/av114161103145239/) |
| 死亡搁浅 | 3/15/2025 | 05:49:15 | Part 2 | [【quin录播】 2025-03-15 死亡搁浅](https://www.bilibili.com/video/av114167042350337/) |
| 死亡搁浅 | 3/16/2025 | 06:06:56 | Part 3 | [【quin录播】 2025-03-16 死亡搁浅](https://www.bilibili.com/video/av114172494879511/) |
| 死亡搁浅 | 3/18/2025 | 06:20:36 | Part 4 | [【quin录播】 2025-03-18 死亡搁浅 + 看刺客信条：影宣传片](https://www.bilibili.com/video/av114183853120562/) |
| 死亡搁浅 | 4/8/2025 | 04:40:12 | Part 5 | [【quin录播】 2025-04-08 死亡搁浅](https://www.bilibili.com/video/av114302635743477/) |
| 死亡搁浅 | 4/9/2025 | 04:56:30 | Part 6 | [【quin录播】 2025-04-09 死亡搁浅](https://www.bilibili.com/video/av114308340061664/) |
| 死亡搁浅 | 4/10/2025 | 06:15:19 | Part 7 | [【quin录播】 2025-04-10 死亡搁浅](https://www.bilibili.com/video/av114313960359133/) |
| 死亡搁浅 | 4/14/2025 | 04:35:01 | Part 8 | [【quin录播】 2025-04-14 死亡搁浅 + 合金装备5幻痛](https://www.bilibili.com/video/av114336609605971/) |

## 合金装备5幻痛

| 游戏名称 | 直播日期 | 时长 | 集数   | 标题                                                         |
| -------- | -------- | ---- | ------ | ------------------------------------------------------------ |
| 合金装备5幻痛 | 4/14/2025 | 04:35:01 | Part 1 | [【quin录播】 2025-04-14 死亡搁浅 + 合金装备5幻痛](https://www.bilibili.com/video/av114336609605971/) |

## 黑暗世界：因与果

| 游戏名称 | 直播日期 | 时长 | 集数   | 标题                                                         |
| -------- | -------- | ---- | ------ | ------------------------------------------------------------ |
| 黑暗世界：因与果 | 4/6/2025 | 04:32:23 | Part 1 | [【quin录播】 2025-04-06 黑暗世界：因与果](https://www.bilibili.com/video/av114291311120546/) |

## 怪物猎人：荒野

| 游戏名称 | 直播日期 | 时长 | 集数   | 标题                                                         |
| -------- | -------- | ---- | ------ | ------------------------------------------------------------ |
| 怪物猎人：荒野 | 10/29/2024 | 04:52:32 | Part 1 | [【quin录播】 2024-10-29 怪物猎人：荒野](https://www.bilibili.com/video/av113390978598083/) |
| 怪物猎人：荒野 | 10/30/2024 | 04:56:57 | Part 2 | [【quin录播】 2024-10-30 怪物猎人：荒野 + 13F + 骗子酒馆](https://www.bilibili.com/video/av113396615939933/) |
| 怪物猎人：荒野 | 11/2/2024 | 04:20:55 | Part 3 | [【quin录播】 2024-11-02 cod21 + 怪物猎人：荒野](https://www.bilibili.com/video/av113413661460356/) |
| 怪物猎人：荒野 | 2/27/2025 | 05:31:27 | Part 4 | [【quin录播】 2025-02-27 小米发布会 + 怪物猎人：荒野](https://www.bilibili.com/video/av114076143329101/) |
| 怪物猎人：荒野 | 2/28/2025 | 06:21:10 | Part 5 | [【quin录播】 2025-02-28 怪物猎人：荒野](https://www.bilibili.com/video/av114081461699044/) |
| 怪物猎人：荒野 | 3/1/2025 | 05:32:00 | Part 6 | [【quin录播】 2025-03-01 怪物猎人：荒野](https://www.bilibili.com/video/av114087467942829/) |
| 怪物猎人：荒野 | 3/2/2025 | 06:17:27 | Part 7 | [【quin录播】 2025-03-02 怪物猎人：荒野](https://www.bilibili.com/video/av114093088310128/) |
| 怪物猎人：荒野 | 3/3/2025 | 03:56:45 | Part 8 | [【quin录播】 2025-03-03 怪物猎人：荒野](https://www.bilibili.com/video/av114098826118028/) |
| 怪物猎人：荒野 | 3/25/2025 | 05:02:20 | Part 9 | [【quin录播】 2025-03-25 怪物猎人：荒野](https://www.bilibili.com/video/av114223396946957/) |
| 怪物猎人：荒野 | 4/5/2025 | 04:02:00 | Part 10 | [【quin录播】 2025-04-05 怪物猎人：荒野](https://www.bilibili.com/video/av114285858525709/) |

## 无限机兵

| 游戏名称 | 直播日期 | 时长 | 集数   | 标题                                                         |
| -------- | -------- | ---- | ------ | ------------------------------------------------------------ |
| 无限机兵 | 3/30/2025 | 04:10:16 | Part 1 | [【quin录播】 2025-03-30 无限机兵](https://www.bilibili.com/video/av114251800775003/) |
| 无限机兵 | 3/31/2025 | 05:19:48 | Part 2 | [【quin录播】 2025-03-31 无限机兵](https://www.bilibili.com/video/av114257437920007/) |
| 无限机兵 | 4/2/2025 | 05:02:01 | Part 3 | [【quin录播】 2025-04-02 任天堂直面会 + 无限机兵](https://www.bilibili.com/video/av114269316255315/) |
| 无限机兵 | 4/3/2025 | 04:32:28 | Part 4 | [【quin录播】 2025-04-03 无限机兵](https://www.bilibili.com/video/av114274433241773/) |

## 任天堂直面会

| 游戏名称 | 直播日期 | 时长 | 集数   | 标题                                                         |
| -------- | -------- | ---- | ------ | ------------------------------------------------------------ |
| 任天堂直面会 | 4/2/2025 | 05:02:01 | Part 1 | [【quin录播】 2025-04-02 任天堂直面会 + 无限机兵](https://www.bilibili.com/video/av114269316255315/) |

## inZOI

| 游戏名称 | 直播日期 | 时长 | 集数   | 标题                                                         |
| -------- | -------- | ---- | ------ | ------------------------------------------------------------ |
| inZOI | 3/28/2025 | 05:11:17 | Part 1 | [【quin录播】 2025-03-28 inZOI](https://www.bilibili.com/video/av114240476223342/) |

## r.e.p.o

| 游戏名称 | 直播日期 | 时长 | 集数   | 标题                                                         |
| -------- | -------- | ---- | ------ | ------------------------------------------------------------ |
| r.e.p.o | 3/6/2025 | 07:27:31 | Part 1 | [【quin录播】 2025-03-06 r.e.p.o + 漫威争锋 + 双影奇境](https://www.bilibili.com/video/av114115687224766/) |
| r.e.p.o | 3/26/2025 | 04:12:57 | Part 2 | [【quin录播】 2025-03-26 r.e.p.o + 刺客信条：影](https://www.bilibili.com/video/av114229117981869/) |
| r.e.p.o | 3/27/2025 | 05:17:59 | Part 3 | [【quin录播】 2025-03-27 r.e.p.o +任天堂Switch2直面会 +刺客信条：影](https://www.bilibili.com/video/av114234788681372/) |

## 任天堂Switch2直面会

| 游戏名称 | 直播日期 | 时长 | 集数   | 标题                                                         |
| -------- | -------- | ---- | ------ | ------------------------------------------------------------ |
| 任天堂Switch2直面会 | 3/27/2025 | 05:17:59 | Part 1 | [【quin录播】 2025-03-27 r.e.p.o +任天堂Switch2直面会 +刺客信条：影](https://www.bilibili.com/video/av114234788681372/) |

## 刺客信条：影

| 游戏名称 | 直播日期 | 时长 | 集数   | 标题                                                         |
| -------- | -------- | ---- | ------ | ------------------------------------------------------------ |
| 刺客信条：影 | 3/19/2025 | 06:36:13 | Part 1 | [【quin录播】 2025-03-19 刺客信条：影](https://www.bilibili.com/video/av114189456645423/) |
| 刺客信条：影 | 3/20/2025 | 04:00:03 | Part 2 | [【quin录播】 2025-03-20 刺客信条：影（已爆炸）](https://www.bilibili.com/video/av114195127410129/) |
| 刺客信条：影 | 3/22/2025 | 03:51:14 | Part 3 | [【quin录播】 2025-03-22 刺客信条：影](https://www.bilibili.com/video/av114206401699328/) |
| 刺客信条：影 | 3/26/2025 | 04:12:57 | Part 4 | [【quin录播】 2025-03-26 r.e.p.o + 刺客信条：影](https://www.bilibili.com/video/av114229117981869/) |
| 刺客信条：影 | 3/27/2025 | 05:17:59 | Part 5 | [【quin录播】 2025-03-27 r.e.p.o +任天堂Switch2直面会 +刺客信条：影](https://www.bilibili.com/video/av114234788681372/) |

## 双影奇境

| 游戏名称 | 直播日期 | 时长 | 集数   | 标题                                                         |
| -------- | -------- | ---- | ------ | ------------------------------------------------------------ |
| 双影奇境 | 3/6/2025 | 07:27:31 | Part 1 | [【quin录播】 2025-03-06 r.e.p.o + 漫威争锋 + 双影奇境](https://www.bilibili.com/video/av114115687224766/) |
| 双影奇境 | 3/7/2025 | 05:21:30 | Part 2 | [【quin录播】 2025-03-07 双影奇境](https://www.bilibili.com/video/av114121391473864/) |
| 双影奇境 | 3/8/2025 | 05:00:43 | Part 3 | [【quin录播】 2025-03-08 双影奇境 + 漫威争锋](https://www.bilibili.com/video/av114127095795658/) |
| 双影奇境 | 3/23/2025 | 04:43:02 | Part 4 | [【quin录播】 2025-03-23 双影奇境隐藏关](https://www.bilibili.com/video/av114212156218404/) |

## 看刺客信条：影宣传片

| 游戏名称 | 直播日期 | 时长 | 集数   | 标题                                                         |
| -------- | -------- | ---- | ------ | ------------------------------------------------------------ |
| 看刺客信条：影宣传片 | 3/18/2025 | 06:20:36 | Part 1 | [【quin录播】 2025-03-18 死亡搁浅 + 看刺客信条：影宣传片](https://www.bilibili.com/video/av114183853120562/) |

## 机械制造者Trailmakers

| 游戏名称 | 直播日期 | 时长 | 集数   | 标题                                                         |
| -------- | -------- | ---- | ------ | ------------------------------------------------------------ |
| 机械制造者Trailmakers | 3/13/2025 | 05:33:59 | Part 1 | [【quin录播】 2025-03-13 机械制造者Trailmakers](https://www.bilibili.com/video/av114155432451520/) |

## 小米发布会

| 游戏名称 | 直播日期 | 时长 | 集数   | 标题                                                         |
| -------- | -------- | ---- | ------ | ------------------------------------------------------------ |
| 小米发布会 | 2/27/2025 | 05:31:27 | Part 1 | [【quin录播】 2025-02-27 小米发布会 + 怪物猎人：荒野](https://www.bilibili.com/video/av114076143329101/) |

## 天国拯救2

| 游戏名称 | 直播日期 | 时长 | 集数   | 标题                                                         |
| -------- | -------- | ---- | ------ | ------------------------------------------------------------ |
| 天国拯救2 | 2/5/2025 | 04:33:47 | Part 1 | [【quin录播】 2025-02-05 天国拯救2](https://www.bilibili.com/video/av113946841318320/) |
| 天国拯救2 | 2/5/2025 | 04:00:03 | Part 2 | [【quin录播】 2025-02-05 天国拯救2（已爆炸）](https://www.bilibili.com/video/av113951589270254/) |
| 天国拯救2 | 2/6/2025 | 06:39:15 | Part 3 | [【quin录播】 2025-02-06 天国拯救2](https://www.bilibili.com/video/av113957041931761/) |
| 天国拯救2 | 2/7/2025 | 06:13:54 | Part 4 | [【quin录播】 2025-02-07 天国拯救2](https://www.bilibili.com/video/av113962863564335/) |
| 天国拯救2 | 2/9/2025 | 07:56:49 | Part 5 | [【quin录播】 2025-02-09 天国拯救2](https://www.bilibili.com/video/av113974003634984/) |
| 天国拯救2 | 2/10/2025 | 07:07:37 | Part 6 | [【quin录播】 2025-02-10 天国拯救2](https://www.bilibili.com/video/av113979858879816/) |
| 天国拯救2 | 2/11/2025 | 04:27:20 | Part 7 | [【quin录播】 2025-02-11 天国拯救2](https://www.bilibili.com/video/av113985630310904/) |
| 天国拯救2 | 2/13/2025 | 05:24:54 | Part 8 | [【quin录播】 2025-02-13 天国拯救2](https://www.bilibili.com/video/av113996954864696/) |
| 天国拯救2 | 2/15/2025 | 04:44:48 | Part 9 | [【quin录播】 2025-02-15 天国拯救2](https://www.bilibili.com/video/av114008313108727/) |
| 天国拯救2 | 2/16/2025 | 05:28:24 | Part 10 | [【quin录播】 2025-02-16 天国拯救2](https://www.bilibili.com/video/av114013849519461/) |
| 天国拯救2 | 2/17/2025 | 05:11:55 | Part 11 | [【quin录播】 2025-02-17 天国拯救2](https://www.bilibili.com/video/av114019687996309/) |
| 天国拯救2 | 2/19/2025 | 05:02:51 | Part 12 | [【quin录播】 2025-02-19 天国拯救2](https://www.bilibili.com/video/av114031012611510/) |
| 天国拯救2 | 2/20/2025 | 05:14:35 | Part 13 | [【quin录播】 2025-02-20 天国拯救2](https://www.bilibili.com/video/av114036582653583/) |
| 天国拯救2 | 2/23/2025 | 05:01:16 | Part 14 | [【quin录播】 2025-02-23 天国拯救2 + 漫威争锋](https://www.bilibili.com/video/av114053594750728/) |
| 天国拯救2 | 2/24/2025 | 04:31:58 | Part 15 | [【quin录播】 2025-02-24 天国拯救2](https://www.bilibili.com/video/av114059248669949/) |
| 天国拯救2 | 2/25/2025 | 06:03:35 | Part 16 | [【quin录播】 2025-02-25 天国拯救2](https://www.bilibili.com/video/av114064902591124/) |
| 天国拯救2 | 2/26/2025 | 04:35:57 | Part 17 | [【quin录播】 2025-02-26 天国拯救2 + 漫威争锋](https://www.bilibili.com/video/av114070606840789/) |

## 三角洲行动

| 游戏名称 | 直播日期 | 时长 | 集数   | 标题                                                         |
| -------- | -------- | ---- | ------ | ------------------------------------------------------------ |
| 三角洲行动 | 10/10/2024 | 02:33:17 | Part 1 | [【quin录播】 2024-10-10 三角洲行动 + 无畏契约](https://www.bilibili.com/video/av113283571059539/) |
| 三角洲行动 | 10/12/2024 | 04:23:23 | Part 2 | [【quin录播】 2024-10-12 三角洲行动 + 无畏契约](https://www.bilibili.com/video/av113294727710308/) |
| 三角洲行动 | 10/14/2024 | 04:06:58 | Part 3 | [【quin录播】 2024-10-14 无畏契约 + 三角洲行动](https://www.bilibili.com/video/av113306119440221/) |
| 三角洲行动 | 11/21/2024 | 04:45:53 | Part 4 | [【quin录播】 2024-11-21 三角洲行动](https://www.bilibili.com/video/av113521236905522/) |
| 三角洲行动 | 2/21/2025 | 05:21:38 | Part 5 | [【quin录播】 2025-02-21 三角洲 + 漫威争锋](https://www.bilibili.com/video/av114042001691890/) |

## 天国拯救

| 游戏名称 | 直播日期 | 时长 | 集数   | 标题                                                         |
| -------- | -------- | ---- | ------ | ------------------------------------------------------------ |
| 天国拯救 | 1/2/2025 | 04:21:51 | Part 1 | [【quin录播】 2025-01-02 天国拯救](https://www.bilibili.com/video/av113759674699356/) |
| 天国拯救 | 1/5/2025 | 05:41:16 | Part 2 | [【quin录播】 2025-01-05 天国拯救 + 漫威争锋](https://www.bilibili.com/video/av113776166765149/) |
| 天国拯救 | 1/6/2025 | 05:27:51 | Part 3 | [【quin录播】 2025-01-06 天国拯救](https://www.bilibili.com/video/av113781770291991/) |
| 天国拯救 | 1/7/2025 | 05:35:10 | Part 4 | [【quin录播】 2025-01-07 天国拯救 + 漫威争锋](https://www.bilibili.com/video/av113787457771847/) |
| 天国拯救 | 1/9/2025 | 05:14:27 | Part 5 | [【quin录播】 2025-01-09 天国拯救](https://www.bilibili.com/video/av113798816010969/) |
| 天国拯救 | 1/11/2025 | 05:42:55 | Part 6 | [【quin录播】 2025-01-11 天国拯救](https://www.bilibili.com/video/av113810123788458/) |
| 天国拯救 | 1/30/2025 | 05:10:48 | Part 7 | [【quin录播】 2025-01-30 天国拯救](https://www.bilibili.com/video/av113917648966420/) |
| 天国拯救 | 1/31/2025 | 05:36:44 | Part 8 | [【quin录播】 2025-01-31 天国拯救](https://www.bilibili.com/video/av113923353285289/) |

## 真三国无双起源

| 游戏名称 | 直播日期 | 时长 | 集数   | 标题                                                         |
| -------- | -------- | ---- | ------ | ------------------------------------------------------------ |
| 真三国无双起源 | 1/14/2025 | 07:38:21 | Part 1 | [【quin录播】 2025-01-14 真三国无双起源 + 漫威争锋](https://www.bilibili.com/video/av113826884295688/) |
| 真三国无双起源 | 1/15/2025 | 02:00:01 | Part 2 | [【quin录播】 2025-01-15 真三国无双起源（已爆炸）](https://www.bilibili.com/video/av113832773030335/) |
| 真三国无双起源 | 1/16/2025 | 06:15:20 | Part 3 | [【quin录播】 2025-01-16 真三国无双起源 + 漫威争锋](https://www.bilibili.com/video/av113838376682938/) |
| 真三国无双起源 | 1/19/2025 | 06:01:09 | Part 4 | [【quin录播】 2025-01-19 真三国无双起源 + 漫威争锋](https://www.bilibili.com/video/av113855338388165/) |
| 真三国无双起源 | 1/22/2025 | 05:00:55 | Part 5 | [【quin录播】 2025-01-22 真三国无双起源](https://www.bilibili.com/video/av113872233039199/) |
| 真三国无双起源 | 1/23/2025 | 04:49:31 | Part 6 | [【quin录播】 2025-01-23 真三国无双起源](https://www.bilibili.com/video/av113878037958485/) |
| 真三国无双起源 | 1/24/2025 | 04:47:13 | Part 7 | [【quin录播】 2025-01-24 真三国无双起源](https://www.bilibili.com/video/av113883624770154/) |
| 真三国无双起源 | 1/25/2025 | 05:42:51 | Part 8 | [【quin录播】 2025-01-25 真三国无双起源 + 抽奖 + nuclear nightmare + 漫威争锋](https://www.bilibili.com/video/av113889228365665/) |

## 抽奖

| 游戏名称 | 直播日期 | 时长 | 集数   | 标题                                                         |
| -------- | -------- | ---- | ------ | ------------------------------------------------------------ |
| 抽奖 | 1/25/2025 | 05:42:51 | Part 1 | [【quin录播】 2025-01-25 真三国无双起源 + 抽奖 + nuclear nightmare + 漫威争锋](https://www.bilibili.com/video/av113889228365665/) |

## nuclear nightmare

| 游戏名称 | 直播日期 | 时长 | 集数   | 标题                                                         |
| -------- | -------- | ---- | ------ | ------------------------------------------------------------ |
| nuclear nightmare | 1/25/2025 | 05:42:51 | Part 1 | [【quin录播】 2025-01-25 真三国无双起源 + 抽奖 + nuclear nightmare + 漫威争锋](https://www.bilibili.com/video/av113889228365665/) |

## 明日方舟终末地

| 游戏名称 | 直播日期 | 时长 | 集数   | 标题                                                         |
| -------- | -------- | ---- | ------ | ------------------------------------------------------------ |
| 明日方舟终末地 | 1/17/2025 | 06:08:49 | Part 1 | [【quin录播】 2025-01-17 明日方舟终末地](https://www.bilibili.com/video/av113843913098749/) |
| 明日方舟终末地 | 1/18/2025 | 06:27:24 | Part 2 | [【quin录播】 2025-01-18 明日方舟终末地 + 漫威争锋](https://www.bilibili.com/video/av113849600575991/) |

## 晃晃人生

| 游戏名称 | 直播日期 | 时长 | 集数   | 标题                                                         |
| -------- | -------- | ---- | ------ | ------------------------------------------------------------ |
| 晃晃人生 | 1/4/2025 | 05:51:22 | Part 1 | [【quin录播】 2025-01-04 晃晃人生 + 漫威争锋](https://www.bilibili.com/video/av113770680552247/) |

## zort

| 游戏名称 | 直播日期 | 时长 | 集数   | 标题                                                         |
| -------- | -------- | ---- | ------ | ------------------------------------------------------------ |
| zort | 1/1/2025 | 04:58:26 | Part 1 | [【quin录播】 2025-01-01 zort + 暗黑潜水员 + 漫威争锋](https://www.bilibili.com/video/av113753483907511/) |

## 暗黑潜水员

| 游戏名称 | 直播日期 | 时长 | 集数   | 标题                                                         |
| -------- | -------- | ---- | ------ | ------------------------------------------------------------ |
| 暗黑潜水员 | 7/11/2024 | 06:22:36 | Part 1 | [【quin录播】 2024-07-11 暗黑潜水员 + 团战经理](https://www.bilibili.com/video/av1106204510/) |
| 暗黑潜水员 | 1/1/2025 | 04:58:26 | Part 2 | [【quin录播】 2025-01-01 zort + 暗黑潜水员 + 漫威争锋](https://www.bilibili.com/video/av113753483907511/) |

## 懒虫：荣耀手推车

| 游戏名称 | 直播日期 | 时长 | 集数   | 标题                                                         |
| -------- | -------- | ---- | ------ | ------------------------------------------------------------ |
| 懒虫：荣耀手推车 | 12/30/2024 | 05:02:41 | Part 1 | [【quin录播】 2024-12-30 小丑牌 + 懒虫：荣耀手推车 + 严阵以待](https://www.bilibili.com/video/av113742041844052/) |
| 懒虫：荣耀手推车 | 12/31/2024 | 04:31:15 | Part 2 | [【quin录播】 2024-12-31 懒虫：荣耀手推车 + 你画我猜](https://www.bilibili.com/video/av113747846764153/) |

## Draw & Guess/你画我猜

| 游戏名称 | 直播日期 | 时长 | 集数   | 标题                                                         |
| -------- | -------- | ---- | ------ | ------------------------------------------------------------ |
| Draw & Guess/你画我猜 | 9/4/2024 | 05:14:44 | Part 1 | [【quin录播】 2024-09-04 幽灵尖叫 + FOREWARNED + 你画我猜](https://www.bilibili.com/video/av113079257923902/) |
| Draw & Guess/你画我猜 | 9/10/2024 | 04:48:00 | Part 2 | [【quin录播】 2024-09-10 你画我猜](https://www.bilibili.com/video/av113113265407546/) |
| Draw & Guess/你画我猜 | 12/31/2024 | 04:31:15 | Part 3 | [【quin录播】 2024-12-31 懒虫：荣耀手推车 + 你画我猜](https://www.bilibili.com/video/av113747846764153/) |

## 小丑牌

| 游戏名称 | 直播日期 | 时长 | 集数   | 标题                                                         |
| -------- | -------- | ---- | ------ | ------------------------------------------------------------ |
| 小丑牌 | 12/30/2024 | 05:02:41 | Part 1 | [【quin录播】 2024-12-30 小丑牌 + 懒虫：荣耀手推车 + 严阵以待](https://www.bilibili.com/video/av113742041844052/) |

## 严阵以待

| 游戏名称 | 直播日期 | 时长 | 集数   | 标题                                                         |
| -------- | -------- | ---- | ------ | ------------------------------------------------------------ |
| 严阵以待 | 12/30/2024 | 05:02:41 | Part 1 | [【quin录播】 2024-12-30 小丑牌 + 懒虫：荣耀手推车 + 严阵以待](https://www.bilibili.com/video/av113742041844052/) |

## 笼子

| 游戏名称 | 直播日期 | 时长 | 集数   | 标题                                                         |
| -------- | -------- | ---- | ------ | ------------------------------------------------------------ |
| 笼子 | 12/17/2024 | 05:21:25 | Part 1 | [【quin录播】 2024-12-17 笼子 + 黑神话：悟空 + 漫威争锋](https://www.bilibili.com/video/av113668507308155/) |

## 绝地潜兵2

| 游戏名称 | 直播日期 | 时长 | 集数   | 标题                                                         |
| -------- | -------- | ---- | ------ | ------------------------------------------------------------ |
| 绝地潜兵2 | 10/21/2024 | 04:55:48 | Part 1 | [【quin录播】 2024-10-21 绝地潜兵2 + 漫威争锋](https://www.bilibili.com/video/av113346267320209/) |
| 绝地潜兵2 | 12/13/2024 | 05:18:04 | Part 2 | [【quin录播】 2024-12-13 绝地潜兵2 + 漫威争锋](https://www.bilibili.com/video/av113646311048512/) |

## TGA

| 游戏名称 | 直播日期 | 时长 | 集数   | 标题                                                         |
| -------- | -------- | ---- | ------ | ------------------------------------------------------------ |
| TGA | 12/13/2024 | 03:32:40 | Part 1 | [【quin录播】 2024-12-13 TGA](https://www.bilibili.com/video/av113643274373680/) |

## 已爆炸

| 游戏名称 | 直播日期 | 时长 | 集数   | 标题                                                         |
| -------- | -------- | ---- | ------ | ------------------------------------------------------------ |
| 已爆炸 | 12/12/2024 | 02:08:22 | Part 1 | [【quin录播】 2024-12-12 已爆炸（漫威争锋）](https://www.bilibili.com/video/av113640019592662/) |

## 模拟人生4

| 游戏名称 | 直播日期 | 时长 | 集数   | 标题                                                         |
| -------- | -------- | ---- | ------ | ------------------------------------------------------------ |
| 模拟人生4 | 11/19/2024 | 06:15:35 | Part 1 | [【quin录播】 2024-11-19 模拟人生4（后2p没弹幕）](https://www.bilibili.com/video/av113509912285163/) |
| 模拟人生4 | 11/20/2024 | 05:29:25 | Part 2 | [【quin录播】 2024-11-20 模拟人生4](https://www.bilibili.com/video/av113515297769871/) |
| 模拟人生4 | 11/24/2024 | 06:03:30 | Part 3 | [【quin录播】 2024-11-24 抓抓地牢 + 模拟人生4](https://www.bilibili.com/video/av113538249068381/) |
| 模拟人生4 | 11/29/2024 | 05:54:12 | Part 4 | [【quin录播】 2024-11-29 模拟人生4](https://www.bilibili.com/video/av113566602631600/) |
| 模拟人生4 | 12/3/2024 | 05:41:44 | Part 5 | [【quin录播】 2024-12-03 Nuclear Nightmare + 骗子酒馆 + 模拟人生4](https://www.bilibili.com/video/av113589167856522/) |
| 模拟人生4 | 12/4/2024 | 06:07:40 | Part 6 | [【quin录播】 2024-12-04 模拟人生4](https://www.bilibili.com/video/av113594586894767/) |

## Nuclear Nightmare

| 游戏名称 | 直播日期 | 时长 | 集数   | 标题                                                         |
| -------- | -------- | ---- | ------ | ------------------------------------------------------------ |
| Nuclear Nightmare | 12/1/2024 | 04:39:14 | Part 1 | [【quin录播】 2024-12-01 Nuclear Nightmare + 骗子酒馆 + 狗与哥布林](https://www.bilibili.com/video/av113577893628197/) |
| Nuclear Nightmare | 12/2/2024 | 04:13:51 | Part 2 | [【quin录播】 2024-12-02 Nuclear Nightmare](https://www.bilibili.com/video/av113583530907841/) |
| Nuclear Nightmare | 12/3/2024 | 05:41:44 | Part 3 | [【quin录播】 2024-12-03 Nuclear Nightmare + 骗子酒馆 + 模拟人生4](https://www.bilibili.com/video/av113589167856522/) |

## 骗子酒馆

| 游戏名称 | 直播日期 | 时长 | 集数   | 标题                                                         |
| -------- | -------- | ---- | ------ | ------------------------------------------------------------ |
| 骗子酒馆 | 10/25/2024 | 04:11:18 | Part 1 | [【quin录播】 2024-10-25 土豆兄弟dlc + 骗子酒馆](https://www.bilibili.com/video/av113368329356701/) |
| 骗子酒馆 | 10/30/2024 | 04:56:57 | Part 2 | [【quin录播】 2024-10-30 怪物猎人：荒野 + 13F + 骗子酒馆](https://www.bilibili.com/video/av113396615939933/) |
| 骗子酒馆 | 10/31/2024 | 04:08:22 | Part 3 | [【quin录播】 2024-10-31 劫盗惊魂夜 + 骗子酒馆](https://www.bilibili.com/video/av113402387171571/) |
| 骗子酒馆 | 11/13/2024 | 04:43:50 | Part 4 | [【quin录播】 2024-11-13 链在一起 + 骗子酒馆 + 硬币游戏](https://www.bilibili.com/video/av113475921642009/) |
| 骗子酒馆 | 12/1/2024 | 04:39:14 | Part 5 | [【quin录播】 2024-12-01 Nuclear Nightmare + 骗子酒馆 + 狗与哥布林](https://www.bilibili.com/video/av113577893628197/) |
| 骗子酒馆 | 12/3/2024 | 05:41:44 | Part 6 | [【quin录播】 2024-12-03 Nuclear Nightmare + 骗子酒馆 + 模拟人生4](https://www.bilibili.com/video/av113589167856522/) |

## 狗与哥布林

| 游戏名称 | 直播日期 | 时长 | 集数   | 标题                                                         |
| -------- | -------- | ---- | ------ | ------------------------------------------------------------ |
| 狗与哥布林 | 11/25/2024 | 04:17:10 | Part 1 | [【quin录播】 2024-11-25 抓抓地牢 + 狗与哥布林](https://www.bilibili.com/video/av113543953253553/) |
| 狗与哥布林 | 12/1/2024 | 04:39:14 | Part 2 | [【quin录播】 2024-12-01 Nuclear Nightmare + 骗子酒馆 + 狗与哥布林](https://www.bilibili.com/video/av113577893628197/) |

## 虚空航船

| 游戏名称 | 直播日期 | 时长 | 集数   | 标题                                                         |
| -------- | -------- | ---- | ------ | ------------------------------------------------------------ |
| 虚空航船 | 11/26/2024 | 04:48:34 | Part 1 | [【quin录播】 2024-11-26 虚空航船](https://www.bilibili.com/video/av113549607175844/) |
| 虚空航船 | 11/27/2024 | 04:53:25 | Part 2 | [【quin录播】 2024-11-27 虚空航船](https://www.bilibili.com/video/av113555177213787/) |

## 抓抓地牢

| 游戏名称 | 直播日期 | 时长 | 集数   | 标题                                                         |
| -------- | -------- | ---- | ------ | ------------------------------------------------------------ |
| 抓抓地牢 | 11/24/2024 | 06:03:30 | Part 1 | [【quin录播】 2024-11-24 抓抓地牢 + 模拟人生4](https://www.bilibili.com/video/av113538249068381/) |
| 抓抓地牢 | 11/25/2024 | 04:17:10 | Part 2 | [【quin录播】 2024-11-25 抓抓地牢 + 狗与哥布林](https://www.bilibili.com/video/av113543953253553/) |

## 真三国无双 起源

| 游戏名称 | 直播日期 | 时长 | 集数   | 标题                                                         |
| -------- | -------- | ---- | ------ | ------------------------------------------------------------ |
| 真三国无双 起源 | 11/22/2024 | 06:03:34 | Part 1 | [【quin录播】 2024-11-22 （无弹幕）真三国无双 起源 + 土豆兄弟 + 潜行者2：切尔诺贝利之心](https://www.bilibili.com/video/av113528082006615/) |

## Brotato/土豆兄弟

| 游戏名称 | 直播日期 | 时长 | 集数   | 标题                                                         |
| -------- | -------- | ---- | ------ | ------------------------------------------------------------ |
| Brotato/土豆兄弟 | 10/25/2024 | 04:11:18 | Part 1 | [【quin录播】 2024-10-25 土豆兄弟dlc + 骗子酒馆](https://www.bilibili.com/video/av113368329356701/) |
| Brotato/土豆兄弟 | 11/22/2024 | 06:03:34 | Part 2 | [【quin录播】 2024-11-22 （无弹幕）真三国无双 起源 + 土豆兄弟 + 潜行者2：切尔诺贝利之心](https://www.bilibili.com/video/av113528082006615/) |

## 潜行者2：切尔诺贝利之心

| 游戏名称 | 直播日期 | 时长 | 集数   | 标题                                                         |
| -------- | -------- | ---- | ------ | ------------------------------------------------------------ |
| 潜行者2：切尔诺贝利之心 | 11/22/2024 | 06:03:34 | Part 1 | [【quin录播】 2024-11-22 （无弹幕）真三国无双 起源 + 土豆兄弟 + 潜行者2：切尔诺贝利之心](https://www.bilibili.com/video/av113528082006615/) |

## 菜市场模拟器

| 游戏名称 | 直播日期 | 时长 | 集数   | 标题                                                         |
| -------- | -------- | ---- | ------ | ------------------------------------------------------------ |
| 菜市场模拟器 | 11/18/2024 | 05:53:10 | Part 1 | [【quin录播】 2024-11-18 菜市场模拟器](https://www.bilibili.com/video/av113504208030254/) |

## 长途旅行

| 游戏名称 | 直播日期 | 时长 | 集数   | 标题                                                         |
| -------- | -------- | ---- | ------ | ------------------------------------------------------------ |
| 长途旅行 | 11/14/2024 | 04:45:06 | Part 1 | [【quin录播】 2024-11-14 长途旅行](https://www.bilibili.com/video/av113481776891782/) |

## 链在一起

| 游戏名称 | 直播日期 | 时长 | 集数   | 标题                                                         |
| -------- | -------- | ---- | ------ | ------------------------------------------------------------ |
| 链在一起 | 11/13/2024 | 04:43:50 | Part 1 | [【quin录播】 2024-11-13 链在一起 + 骗子酒馆 + 硬币游戏](https://www.bilibili.com/video/av113475921642009/) |

## 硬币游戏

| 游戏名称 | 直播日期 | 时长 | 集数   | 标题                                                         |
| -------- | -------- | ---- | ------ | ------------------------------------------------------------ |
| 硬币游戏 | 11/13/2024 | 04:43:50 | Part 1 | [【quin录播】 2024-11-13 链在一起 + 骗子酒馆 + 硬币游戏](https://www.bilibili.com/video/av113475921642009/) |

## cod21

| 游戏名称 | 直播日期 | 时长 | 集数   | 标题                                                         |
| -------- | -------- | ---- | ------ | ------------------------------------------------------------ |
| cod21 | 10/28/2024 | 05:38:12 | Part 1 | [【quin录播】 2024-10-28 cod21](https://www.bilibili.com/video/av113385307965416/) |
| cod21 | 11/2/2024 | 04:20:55 | Part 2 | [【quin录播】 2024-11-02 cod21 + 怪物猎人：荒野](https://www.bilibili.com/video/av113413661460356/) |

## 劫盗惊魂夜

| 游戏名称 | 直播日期 | 时长 | 集数   | 标题                                                         |
| -------- | -------- | ---- | ------ | ------------------------------------------------------------ |
| 劫盗惊魂夜 | 10/31/2024 | 04:08:22 | Part 1 | [【quin录播】 2024-10-31 劫盗惊魂夜 + 骗子酒馆](https://www.bilibili.com/video/av113402387171571/) |

## 13F

| 游戏名称 | 直播日期 | 时长 | 集数   | 标题                                                         |
| -------- | -------- | ---- | ------ | ------------------------------------------------------------ |
| 13F | 10/30/2024 | 04:56:57 | Part 1 | [【quin录播】 2024-10-30 怪物猎人：荒野 + 13F + 骗子酒馆](https://www.bilibili.com/video/av113396615939933/) |

## 骰子浪游者

| 游戏名称 | 直播日期 | 时长 | 集数   | 标题                                                         |
| -------- | -------- | ---- | ------ | ------------------------------------------------------------ |
| 骰子浪游者 | 10/24/2024 | 04:38:26 | Part 1 | [【quin录播】 2024-10-24 骰子浪游者 + 无畏契约](https://www.bilibili.com/video/av113362742542761/) |

## 沙威玛传奇

| 游戏名称 | 直播日期 | 时长 | 集数   | 标题                                                         |
| -------- | -------- | ---- | ------ | ------------------------------------------------------------ |
| 沙威玛传奇 | 9/23/2024 | 04:49:11 | Part 1 | [【quin录播】 2024-09-23 人类一败涂地 + 万物皆可赛车 + 沙威玛传奇](https://www.bilibili.com/video/av113187085093659/) |
| 沙威玛传奇 | 9/24/2024 | 04:27:34 | Part 2 | [【quin录播】 2024-09-24 picopark2 + 沙威玛传奇](https://www.bilibili.com/video/av113192823033207/) |
| 沙威玛传奇 | 9/25/2024 | 05:06:15 | Part 3 | [【quin录播】 2024-09-25 多人超市 + 沙威玛传奇](https://www.bilibili.com/video/av113198443269395/) |
| 沙威玛传奇 | 9/28/2024 | 04:07:41 | Part 4 | [【quin录播】 2024-09-28 无畏契约 + 沙威玛传奇](https://www.bilibili.com/video/av113215505698665/) |

## 塞尔达传说：智慧的再现

| 游戏名称 | 直播日期 | 时长 | 集数   | 标题                                                         |
| -------- | -------- | ---- | ------ | ------------------------------------------------------------ |
| 塞尔达传说：智慧的再现 | 9/26/2024 | 04:56:37 | Part 1 | [【quin录播】 2024-09-26 塞尔达传说：智慧的再现](https://www.bilibili.com/video/av113203879153347/) |
| 塞尔达传说：智慧的再现 | 9/27/2024 | 05:28:29 | Part 2 | [【quin录播】 2024-09-27 塞尔达传说：智慧的再现](https://www.bilibili.com/video/av113209834996884/) |

## 多人超市

| 游戏名称 | 直播日期 | 时长 | 集数   | 标题                                                         |
| -------- | -------- | ---- | ------ | ------------------------------------------------------------ |
| 多人超市 | 9/25/2024 | 05:06:15 | Part 1 | [【quin录播】 2024-09-25 多人超市 + 沙威玛传奇](https://www.bilibili.com/video/av113198443269395/) |

## picopark2

| 游戏名称 | 直播日期 | 时长 | 集数   | 标题                                                         |
| -------- | -------- | ---- | ------ | ------------------------------------------------------------ |
| picopark2 | 9/13/2024 | 05:19:34 | Part 1 | [【quin录播】 2024-09-13 picopark2](https://www.bilibili.com/video/av113130579431021/) |
| picopark2 | 9/24/2024 | 04:27:34 | Part 2 | [【quin录播】 2024-09-24 picopark2 + 沙威玛传奇](https://www.bilibili.com/video/av113192823033207/) |

## 人类一败涂地

| 游戏名称 | 直播日期 | 时长 | 集数   | 标题                                                         |
| -------- | -------- | ---- | ------ | ------------------------------------------------------------ |
| 人类一败涂地 | 1/11/2023 | 04:25:28 | Part 1 | [【quin录播】 23-01-11 人类一败涂地  秦国春晚再开](https://www.bilibili.com/video/av307696902/) |
| 人类一败涂地 | 9/23/2024 | 04:49:11 | Part 2 | [【quin录播】 2024-09-23 人类一败涂地 + 万物皆可赛车 + 沙威玛传奇](https://www.bilibili.com/video/av113187085093659/) |

## 万物皆可赛车

| 游戏名称 | 直播日期 | 时长 | 集数   | 标题                                                         |
| -------- | -------- | ---- | ------ | ------------------------------------------------------------ |
| 万物皆可赛车 | 9/23/2024 | 04:49:11 | Part 1 | [【quin录播】 2024-09-23 人类一败涂地 + 万物皆可赛车 + 沙威玛传奇](https://www.bilibili.com/video/av113187085093659/) |

## 枪火重生

| 游戏名称 | 直播日期 | 时长 | 集数   | 标题                                                         |
| -------- | -------- | ---- | ------ | ------------------------------------------------------------ |
| 枪火重生 | 9/20/2024 | 04:13:20 | Part 1 | [【quin录播】 2024-09-20 枪火重生](https://www.bilibili.com/video/av113170223989672/) |

## 白色情人节：恐怖学校

| 游戏名称 | 直播日期 | 时长 | 集数   | 标题                                                         |
| -------- | -------- | ---- | ------ | ------------------------------------------------------------ |
| 白色情人节：恐怖学校 | 9/19/2024 | 04:37:56 | Part 1 | [【quin录播】 2024-09-19 白色情人节：恐怖学校 + 星际战士1](https://www.bilibili.com/video/av113164385521462/) |

## 星际战士1

| 游戏名称 | 直播日期 | 时长 | 集数   | 标题                                                         |
| -------- | -------- | ---- | ------ | ------------------------------------------------------------ |
| 星际战士1 | 9/19/2024 | 04:37:56 | Part 1 | [【quin录播】 2024-09-19 白色情人节：恐怖学校 + 星际战士1](https://www.bilibili.com/video/av113164385521462/) |

## 致命公司

| 游戏名称 | 直播日期 | 时长 | 集数   | 标题                                                         |
| -------- | -------- | ---- | ------ | ------------------------------------------------------------ |
| 致命公司 | 9/11/2024 | 05:36:38 | Part 1 | [【quin录播】 2024-09-11 致命公司](https://www.bilibili.com/video/av113119036704483/) |
| 致命公司 | 9/15/2024 | 04:52:29 | Part 2 | [【quin录播】 2024-09-15 超级键盘侠 + 致命公司](https://www.bilibili.com/video/av113144588404643/) |
| 致命公司 | 9/17/2024 | 04:13:59 | Part 3 | [【quin录播】 2024-09-17 致命公司 + perennial order](https://www.bilibili.com/video/av113153312556994/) |

## perennial order

| 游戏名称 | 直播日期 | 时长 | 集数   | 标题                                                         |
| -------- | -------- | ---- | ------ | ------------------------------------------------------------ |
| perennial order | 9/16/2024 | 05:42:00 | Part 1 | [【quin录播】 2024-09-16 超级键盘侠 + perennial order](https://www.bilibili.com/video/av113147591591783/) |
| perennial order | 9/17/2024 | 04:13:59 | Part 2 | [【quin录播】 2024-09-17 致命公司 + perennial order](https://www.bilibili.com/video/av113153312556994/) |

## 超级键盘侠

| 游戏名称 | 直播日期 | 时长 | 集数   | 标题                                                         |
| -------- | -------- | ---- | ------ | ------------------------------------------------------------ |
| 超级键盘侠 | 9/12/2024 | 04:51:58 | Part 1 | [【quin录播】 2024-09-12 超级键盘侠](https://www.bilibili.com/video/av113124808067632/) |
| 超级键盘侠 | 9/15/2024 | 04:52:29 | Part 2 | [【quin录播】 2024-09-15 超级键盘侠 + 致命公司](https://www.bilibili.com/video/av113144588404643/) |
| 超级键盘侠 | 9/16/2024 | 05:42:00 | Part 3 | [【quin录播】 2024-09-16 超级键盘侠 + perennial order](https://www.bilibili.com/video/av113147591591783/) |

## 传说酒馆

| 游戏名称 | 直播日期 | 时长 | 集数   | 标题                                                         |
| -------- | -------- | ---- | ------ | ------------------------------------------------------------ |
| 传说酒馆 | 9/7/2024 | 04:27:11 | Part 1 | [【quin录播】 2024-09-07 传说酒馆](https://www.bilibili.com/video/av113096605634529/) |
| 传说酒馆 | 9/8/2024 | 05:12:06 | Part 2 | [【quin录播】 2024-09-08 传说酒馆 + cato黄油猫](https://www.bilibili.com/video/av113102074938635/) |

## cato黄油猫

| 游戏名称 | 直播日期 | 时长 | 集数   | 标题                                                         |
| -------- | -------- | ---- | ------ | ------------------------------------------------------------ |
| cato黄油猫 | 9/8/2024 | 05:12:06 | Part 1 | [【quin录播】 2024-09-08 传说酒馆 + cato黄油猫](https://www.bilibili.com/video/av113102074938635/) |

## 星际战士2

| 游戏名称 | 直播日期 | 时长 | 集数   | 标题                                                         |
| -------- | -------- | ---- | ------ | ------------------------------------------------------------ |
| 星际战士2 | 9/6/2024 | 06:49:56 | Part 1 | [【quin录播】 2024-09-06 星际战士2](https://www.bilibili.com/video/av113091001978723/) |
| 星际战士2 | 9/5/2024 | 06:09:51 | Part 2 | [【quin录播】 2024-09-05 星际战士2](https://www.bilibili.com/video/av113088955155440/) |

## 幽灵尖叫

| 游戏名称 | 直播日期 | 时长 | 集数   | 标题                                                         |
| -------- | -------- | ---- | ------ | ------------------------------------------------------------ |
| 幽灵尖叫 | 9/4/2024 | 05:14:44 | Part 1 | [【quin录播】 2024-09-04 幽灵尖叫 + FOREWARNED + 你画我猜](https://www.bilibili.com/video/av113079257923902/) |

## FOREWARNED

| 游戏名称 | 直播日期 | 时长 | 集数   | 标题                                                         |
| -------- | -------- | ---- | ------ | ------------------------------------------------------------ |
| FOREWARNED | 9/4/2024 | 05:14:44 | Part 1 | [【quin录播】 2024-09-04 幽灵尖叫 + FOREWARNED + 你画我猜](https://www.bilibili.com/video/av113079257923902/) |

## the classrooms

| 游戏名称 | 直播日期 | 时长 | 集数   | 标题                                                         |
| -------- | -------- | ---- | ------ | ------------------------------------------------------------ |
| the classrooms | 9/2/2024 | 05:11:43 | Part 1 | [【quin录播】 2024-09-02 the classrooms + 黑神话：悟空](https://www.bilibili.com/video/av113068050744651/) |

## storyteller

| 游戏名称 | 直播日期 | 时长 | 集数   | 标题                                                         |
| -------- | -------- | ---- | ------ | ------------------------------------------------------------ |
| storyteller | 9/1/2024 | 05:46:39 | Part 1 | [【quin录播】 2024-09-01 storyteller + the bathhouse](https://www.bilibili.com/video/av113062195495978/) |

## the bathhouse

| 游戏名称 | 直播日期 | 时长 | 集数   | 标题                                                         |
| -------- | -------- | ---- | ------ | ------------------------------------------------------------ |
| the bathhouse | 9/1/2024 | 05:46:39 | Part 1 | [【quin录播】 2024-09-01 storyteller + the bathhouse](https://www.bilibili.com/video/av113062195495978/) |

## 宝莲灯

| 游戏名称 | 直播日期 | 时长 | 集数   | 标题                                                         |
| -------- | -------- | ---- | ------ | ------------------------------------------------------------ |
| 宝莲灯 | 8/18/2024 | 05:00:05 | Part 1 | [【quin录播】 2024-08-18 宝莲灯 + 西游记](https://www.bilibili.com/video/av112983476801380/) |

## 西游记

| 游戏名称 | 直播日期 | 时长 | 集数   | 标题                                                         |
| -------- | -------- | ---- | ------ | ------------------------------------------------------------ |
| 西游记 | 8/18/2024 | 05:00:05 | Part 1 | [【quin录播】 2024-08-18 宝莲灯 + 西游记](https://www.bilibili.com/video/av112983476801380/) |

## 饿殍：明末千里行

| 游戏名称 | 直播日期 | 时长 | 集数   | 标题                                                         |
| -------- | -------- | ---- | ------ | ------------------------------------------------------------ |
| 饿殍：明末千里行 | 8/16/2024 | 05:41:51 | Part 1 | [【quin录播】 2024-08-16 饿殍：明末千里行](https://www.bilibili.com/video/av112971716166267/) |
| 饿殍：明末千里行 | 8/17/2024 | 01:00:40 | Part 2 | [【quin录播】 2024-08-17 饿殍：明末千里行——残缺](https://www.bilibili.com/video/av112977319693609/) |

## 虚幻大圣

| 游戏名称 | 直播日期 | 时长 | 集数   | 标题                                                         |
| -------- | -------- | ---- | ------ | ------------------------------------------------------------ |
| 虚幻大圣 | 8/15/2024 | 06:39:03 | Part 1 | [【quin录播】 2024-08-15 虚幻大圣 + 大圣归来](https://www.bilibili.com/video/av112966062113722/) |

## 大圣归来

| 游戏名称 | 直播日期 | 时长 | 集数   | 标题                                                         |
| -------- | -------- | ---- | ------ | ------------------------------------------------------------ |
| 大圣归来 | 7/10/2024 | 05:07:10 | Part 1 | [【quin录播】 2024-07-10 大圣归来dlc + 角斗士工会经理 + 团战经理](https://www.bilibili.com/video/av1756183775/) |
| 大圣归来 | 8/15/2024 | 06:39:03 | Part 2 | [【quin录播】 2024-08-15 虚幻大圣 + 大圣归来](https://www.bilibili.com/video/av112966062113722/) |

## 火柴人

| 游戏名称 | 直播日期 | 时长 | 集数   | 标题                                                         |
| -------- | -------- | ---- | ------ | ------------------------------------------------------------ |
| 火柴人 | 7/20/2024 | 06:43:44 | Part 1 | [【quin录播】 2024-07-20 火柴人 + 中国式网游](https://www.bilibili.com/video/av1806472780/) |

## 中国式网游

| 游戏名称 | 直播日期 | 时长 | 集数   | 标题                                                         |
| -------- | -------- | ---- | ------ | ------------------------------------------------------------ |
| 中国式网游 | 7/19/2024 | 06:47:59 | Part 1 | [【quin录播】 2024-07-19 中国式网游 + 曼尼汉堡店 + 团战经理](https://www.bilibili.com/video/av1306410397/) |
| 中国式网游 | 7/20/2024 | 06:43:44 | Part 2 | [【quin录播】 2024-07-20 火柴人 + 中国式网游](https://www.bilibili.com/video/av1806472780/) |

## 曼尼汉堡店

| 游戏名称 | 直播日期 | 时长 | 集数   | 标题                                                         |
| -------- | -------- | ---- | ------ | ------------------------------------------------------------ |
| 曼尼汉堡店 | 7/19/2024 | 06:47:59 | Part 1 | [【quin录播】 2024-07-19 中国式网游 + 曼尼汉堡店 + 团战经理](https://www.bilibili.com/video/av1306410397/) |

## 团战经理

| 游戏名称 | 直播日期 | 时长 | 集数   | 标题                                                         |
| -------- | -------- | ---- | ------ | ------------------------------------------------------------ |
| 团战经理 | 7/10/2024 | 05:07:10 | Part 1 | [【quin录播】 2024-07-10 大圣归来dlc + 角斗士工会经理 + 团战经理](https://www.bilibili.com/video/av1756183775/) |
| 团战经理 | 7/11/2024 | 06:22:36 | Part 2 | [【quin录播】 2024-07-11 暗黑潜水员 + 团战经理](https://www.bilibili.com/video/av1106204510/) |
| 团战经理 | 7/12/2024 | 04:26:49 | Part 3 | [【quin录播】 2024-07-12 团战经理](https://www.bilibili.com/video/av1556165119/) |
| 团战经理 | 7/13/2024 | 04:29:05 | Part 4 | [【quin录播】 2024-07-13 团战经理](https://www.bilibili.com/video/av1706002349/) |
| 团战经理 | 7/19/2024 | 06:47:59 | Part 5 | [【quin录播】 2024-07-19 中国式网游 + 曼尼汉堡店 + 团战经理](https://www.bilibili.com/video/av1306410397/) |

## 清零计划2

| 游戏名称 | 直播日期 | 时长 | 集数   | 标题                                                         |
| -------- | -------- | ---- | ------ | ------------------------------------------------------------ |
| 清零计划2 | 7/4/2024 | 04:55:51 | Part 1 | [【quin录播】 2024-07-04 艾尔登法环 + 清零计划2](https://www.bilibili.com/video/av1106128498/) |
| 清零计划2 | 7/14/2024 | 04:37:20 | Part 2 | [【quin录播】 2024-07-14 清零计划2](https://www.bilibili.com/video/av1806071514/) |

## 角斗士工会经理

| 游戏名称 | 直播日期 | 时长 | 集数   | 标题                                                         |
| -------- | -------- | ---- | ------ | ------------------------------------------------------------ |
| 角斗士工会经理 | 7/6/2024 | 05:11:02 | Part 1 | [【quin录播】 2024-07-06 联机艾尔登法环 + 角斗士工会经理](https://www.bilibili.com/video/av1506080287/) |
| 角斗士工会经理 | 7/10/2024 | 05:07:10 | Part 2 | [【quin录播】 2024-07-10 大圣归来dlc + 角斗士工会经理 + 团战经理](https://www.bilibili.com/video/av1756183775/) |

## 小丑之死

| 游戏名称 | 直播日期 | 时长 | 集数   | 标题                                                         |
| -------- | -------- | ---- | ------ | ------------------------------------------------------------ |
| 小丑之死 | 7/7/2024 | 00:07:17 | Part 1 | [【quin录播】 2024-07-07 小丑之死](https://www.bilibili.com/video/av1406222860/) |

## 火炬之光无限

| 游戏名称 | 直播日期 | 时长 | 集数   | 标题                                                         |
| -------- | -------- | ---- | ------ | ------------------------------------------------------------ |
| 火炬之光无限 | 7/5/2024 | 03:00:05 | Part 1 | [【quin录播】 2024-07-05 残缺——火炬之光无限](https://www.bilibili.com/video/av1506163531/) |

## Chained Together

| 游戏名称 | 直播日期 | 时长 | 集数   | 标题                                                         |
| -------- | -------- | ---- | ------ | ------------------------------------------------------------ |
| Chained Together | 6/26/2024 | 07:09:43 | Part 1 | [【quin录播】 2024-06-26 Chained Together + 艾尔登法环dlc](https://www.bilibili.com/video/av1205815092/) |
| Chained Together | 6/30/2024 | 06:28:23 | Part 2 | [【quin录播】 2024-06-30 Chained Together](https://www.bilibili.com/video/av1305802661/) |

## 酒店大改造hotel renovator

| 游戏名称 | 直播日期 | 时长 | 集数   | 标题                                                         |
| -------- | -------- | ---- | ------ | ------------------------------------------------------------ |
| 酒店大改造hotel renovator | 3/8/2023 | 05:51:03 | Part 1 | [【quin录播】 23-03-08 酒店大改造hotel renovator + 缉私警察contraband police](https://www.bilibili.com/video/av568128951/) |

## 缉私警察contraband police

| 游戏名称 | 直播日期 | 时长 | 集数   | 标题                                                         |
| -------- | -------- | ---- | ------ | ------------------------------------------------------------ |
| 缉私警察contraband police | 3/8/2023 | 05:51:03 | Part 1 | [【quin录播】 23-03-08 酒店大改造hotel renovator + 缉私警察contraband police](https://www.bilibili.com/video/av568128951/) |

## 叛乱：沙漠风暴

| 游戏名称 | 直播日期 | 时长 | 集数   | 标题                                                         |
| -------- | -------- | ---- | ------ | ------------------------------------------------------------ |
| 叛乱：沙漠风暴 | 3/7/2023 | 05:18:09 | Part 1 | [【quin录播】 23-03-07 叛乱：沙漠风暴](https://www.bilibili.com/video/av823168896/) |

## 勇敢之地

| 游戏名称 | 直播日期 | 时长 | 集数   | 标题                                                         |
| -------- | -------- | ---- | ------ | ------------------------------------------------------------ |
| 勇敢之地 | 3/6/2023 | 04:29:13 | Part 1 | [【quin录播】 23-03-06 勇敢之地(Knights of Braveland) + 灾厄乐队](https://www.bilibili.com/video/av525527529/) |

## 灾厄乐队

| 游戏名称 | 直播日期 | 时长 | 集数   | 标题                                                         |
| -------- | -------- | ---- | ------ | ------------------------------------------------------------ |
| 灾厄乐队 | 3/6/2023 | 04:29:13 | Part 1 | [【quin录播】 23-03-06 勇敢之地(Knights of Braveland) + 灾厄乐队](https://www.bilibili.com/video/av525527529/) |

## gbo2

| 游戏名称 | 直播日期 | 时长 | 集数   | 标题                                                         |
| -------- | -------- | ---- | ------ | ------------------------------------------------------------ |
| gbo2 | 1/28/2023 | 04:46:18 | Part 1 | [【quin录播】 23-01-28 gbo2 part 1  钢之魂！弹幕狂欢之夜](https://www.bilibili.com/video/av906112704/) |

## 战争传说

| 游戏名称 | 直播日期 | 时长 | 集数   | 标题                                                         |
| -------- | -------- | ---- | ------ | ------------------------------------------------------------ |
| 战争传说 | 1/1/2023 | 04:53:00 | Part 1 | [【quin录播】 23-01-01 战争传说 part 1](https://www.bilibili.com/video/av607221352/) |
| 战争传说 | 1/2/2023 | 04:57:41 | Part 2 | [【quin录播】 23-01-02 战争传说 part 2](https://www.bilibili.com/video/av692181549/) |
| 战争传说 | 1/3/2023 | 05:17:49 | Part 3 | [【Quin录播】 23-01-03 战争传说 part 3](https://www.bilibili.com/video/av434678405/) |
| 战争传说 | 1/4/2023 | 04:40:32 | Part 4 | [【quin录播】 23-01-04 战争传说 part 4 重走西游路](https://www.bilibili.com/video/av777271381/) |
| 战争传说 | 1/6/2023 | 04:44:15 | Part 5 | [【quin录播】 23-01-06 战争传说 part 5](https://www.bilibili.com/video/av519923572/) |
| 战争传说 | 1/7/2023 | 05:30:41 | Part 6 | [【quin录播】 23-01-07 战争传说 part 6 贼王现世](https://www.bilibili.com/video/av349894679/) |
| 战争传说 | 1/8/2023 | 05:17:03 | Part 7 | [【quin录播】 23-01-08 战争传说 part 7 韦天人称小巫医](https://www.bilibili.com/video/av905016582/) |
| 战争传说 | 1/9/2023 | 05:28:36 | Part 8 | [【quin录播】 23-01-09 战争传说 part 8   二次元童年之夜：韦天人设崩塌](https://www.bilibili.com/video/av480075716/) |
| 战争传说 | 1/27/2023 | 04:43:14 | Part 9 | [【quin录播】 23-01-27 战争传说 part 9 兄弟归来](https://www.bilibili.com/video/av820932754/) |

## 光环无限

| 游戏名称 | 直播日期 | 时长 | 集数   | 标题                                                         |
| -------- | -------- | ---- | ------ | ------------------------------------------------------------ |
| 光环无限 | 1/24/2023 | 04:57:01 | Part 1 | [【quin录播】 23-01-24 光环无限 part 1 狗头人黑楼洗粉之夜](https://www.bilibili.com/video/av820779264/) |
| 光环无限 | 1/25/2023 | 04:54:46 | Part 2 | [【quin录播】 23-01-25 光环无限 part 2](https://www.bilibili.com/video/av820773841/) |
| 光环无限 | 1/26/2023 | 05:18:26 | Part 3 | [【quin录播】 23-01-26 光环无限 part 3 + 光环：士官长合集](https://www.bilibili.com/video/av948472335/) |

## 光环：士官长合集

| 游戏名称 | 直播日期 | 时长 | 集数   | 标题                                                         |
| -------- | -------- | ---- | ------ | ------------------------------------------------------------ |
| 光环：士官长合集 | 1/26/2023 | 05:18:26 | Part 1 | [【quin录播】 23-01-26 光环无限 part 3 + 光环：士官长合集](https://www.bilibili.com/video/av948472335/) |

## 街机游戏

| 游戏名称 | 直播日期 | 时长 | 集数   | 标题                                                         |
| -------- | -------- | ---- | ------ | ------------------------------------------------------------ |
| 街机游戏 | 1/12/2023 | 02:43:44 | Part 1 | [【quin录播】 23-01-12 街机游戏](https://www.bilibili.com/video/av777684134/) |

## 宝可梦朱紫

| 游戏名称 | 直播日期 | 时长 | 集数   | 标题                                                         |
| -------- | -------- | ---- | ------ | ------------------------------------------------------------ |
| 宝可梦朱紫 | 1/10/2023 | 06:48:30 | Part 1 | [【quin录播】 23-01-10 宝可梦朱紫 无闪耻辱下播之夜](https://www.bilibili.com/video/av905023525/) |

## 猛男寨mc宝可梦之夜

| 游戏名称 | 直播日期 | 时长 | 集数   | 标题                                                         |
| -------- | -------- | ---- | ------ | ------------------------------------------------------------ |
| 猛男寨mc宝可梦之夜 | 12/31/2022 | 04:54:18 | Part 1 | [【quin录播】 22-12-31 猛男寨mc宝可梦之夜](https://www.bilibili.com/video/av649604600/) |