# 机皇 直播回放 (from 自行车二层)

| 主播 | 机皇 |
| -------------------- | ------------------------------------------------------------ |
| **上传者** | **自行车二层** |
| **数据更新时间** | **1/11/2026, 6:24:40 PM** |
| **累积计入视频数量** | **43** |
| **最旧视频** | [【机皇录播】 23-01-13 哆啦A梦](https://www.bilibili.com/video/av777813857/) |
| **最新视频** | [【机皇录播】 2025-08-20 魔法少女的魔女审判](https://www.bilibili.com/video/av115061301447773/) |

---

[TOC]

---

## 魔法少女的魔女审判

| 游戏名称 | 直播日期 | 时长 | 集数   | 标题                                                         |
| -------- | -------- | ---- | ------ | ------------------------------------------------------------ |
| 魔法少女的魔女审判 | 8/10/2025 | 05:47:41 | Part 1 | [【机皇录播】 2025-08-10 魔法少女的魔女审判](https://www.bilibili.com/video/av115004829338692/) |
| 魔法少女的魔女审判 | 8/12/2025 | 03:48:36 | Part 2 | [【机皇录播】 2025-08-12 魔法少女的魔女审判](https://www.bilibili.com/video/av115016154027323/) |
| 魔法少女的魔女审判 | 8/14/2025 | 03:39:53 | Part 3 | [【机皇录播】 2025-08-14 魔法少女的魔女审判](https://www.bilibili.com/video/av115027445026632/) |
| 魔法少女的魔女审判 | 8/16/2025 | 05:28:03 | Part 4 | [【机皇录播】 2025-08-16 魔法少女的魔女审判](https://www.bilibili.com/video/av115038669052265/) |
| 魔法少女的魔女审判 | 8/17/2025 | 03:38:39 | Part 5 | [【机皇录播】 2025-08-17 魔法少女的魔女审判](https://www.bilibili.com/video/av115044457121156/) |
| 魔法少女的魔女审判 | 8/19/2025 | 05:54:11 | Part 6 | [【机皇录播】 2025-08-19 魔法少女的魔女审判](https://www.bilibili.com/video/av115055630879982/) |
| 魔法少女的魔女审判 | 8/20/2025 | 07:09:46 | Part 7 | [【机皇录播】 2025-08-20 魔法少女的魔女审判](https://www.bilibili.com/video/av115061301447773/) |

## 爱氏物语

| 游戏名称 | 直播日期 | 时长 | 集数   | 标题                                                         |
| -------- | -------- | ---- | ------ | ------------------------------------------------------------ |
| 爱氏物语 | 8/7/2025 | 04:24:11 | Part 1 | [【机皇录播】 2025-08-07 爱氏物语](https://www.bilibili.com/video/av114987766976577/) |
| 爱氏物语 | 8/8/2025 | 04:29:17 | Part 2 | [【机皇录播】 2025-08-08 爱氏物语 + 乌合之众demo](https://www.bilibili.com/video/av114993471167105/) |

## 乌合之众demo

| 游戏名称 | 直播日期 | 时长 | 集数   | 标题                                                         |
| -------- | -------- | ---- | ------ | ------------------------------------------------------------ |
| 乌合之众demo | 8/8/2025 | 04:29:17 | Part 1 | [【机皇录播】 2025-08-08 爱氏物语 + 乌合之众demo](https://www.bilibili.com/video/av114993471167105/) |

## 沉没意志

| 游戏名称 | 直播日期 | 时长 | 集数   | 标题                                                         |
| -------- | -------- | ---- | ------ | ------------------------------------------------------------ |
| 沉没意志 | 10/3/2024 | 04:23:02 | Part 1 | [【机皇录播】 2024-10-03 bloomtown + 13F + 沉没意志 + 沙威玛传奇](https://www.bilibili.com/video/av113243674706796/) |
| 沉没意志 | 10/6/2024 | 05:18:07 | Part 2 | [【机皇录播】 2024-10-06 沉没意志 + 沙威玛传奇 + 那一天，我的输出7万亿](https://www.bilibili.com/video/av113260653185178/) |

## 沙威玛传奇

| 游戏名称 | 直播日期 | 时长 | 集数   | 标题                                                         |
| -------- | -------- | ---- | ------ | ------------------------------------------------------------ |
| 沙威玛传奇 | 10/3/2024 | 04:23:02 | Part 1 | [【机皇录播】 2024-10-03 bloomtown + 13F + 沉没意志 + 沙威玛传奇](https://www.bilibili.com/video/av113243674706796/) |
| 沙威玛传奇 | 10/6/2024 | 05:18:07 | Part 2 | [【机皇录播】 2024-10-06 沉没意志 + 沙威玛传奇 + 那一天，我的输出7万亿](https://www.bilibili.com/video/av113260653185178/) |

## 那一天，我的输出7万亿

| 游戏名称 | 直播日期 | 时长 | 集数   | 标题                                                         |
| -------- | -------- | ---- | ------ | ------------------------------------------------------------ |
| 那一天，我的输出7万亿 | 10/6/2024 | 05:18:07 | Part 1 | [【机皇录播】 2024-10-06 沉没意志 + 沙威玛传奇 + 那一天，我的输出7万亿](https://www.bilibili.com/video/av113260653185178/) |

## bloomtown

| 游戏名称 | 直播日期 | 时长 | 集数   | 标题                                                         |
| -------- | -------- | ---- | ------ | ------------------------------------------------------------ |
| bloomtown | 9/29/2024 | 04:17:04 | Part 1 | [【机皇录播】 2024-09-29 bloomtown](https://www.bilibili.com/video/av113221025402738/) |
| bloomtown | 9/30/2024 | 04:18:16 | Part 2 | [【机皇录播】 2024-09-30 bloomtown](https://www.bilibili.com/video/av113226679322071/) |
| bloomtown | 10/2/2024 | 06:22:43 | Part 3 | [【机皇录播】 2024-10-02 bloomtown](https://www.bilibili.com/video/av113237819460093/) |
| bloomtown | 10/3/2024 | 04:23:02 | Part 4 | [【机皇录播】 2024-10-03 bloomtown + 13F + 沉没意志 + 沙威玛传奇](https://www.bilibili.com/video/av113243674706796/) |

## 13F

| 游戏名称 | 直播日期 | 时长 | 集数   | 标题                                                         |
| -------- | -------- | ---- | ------ | ------------------------------------------------------------ |
| 13F | 10/3/2024 | 04:23:02 | Part 1 | [【机皇录播】 2024-10-03 bloomtown + 13F + 沉没意志 + 沙威玛传奇](https://www.bilibili.com/video/av113243674706796/) |

## 背包乱斗

| 游戏名称 | 直播日期 | 时长 | 集数   | 标题                                                         |
| -------- | -------- | ---- | ------ | ------------------------------------------------------------ |
| 背包乱斗 | 7/24/2024 | 03:36:49 | Part 1 | [【机皇录播】 2024-07-24 背包乱斗 + 接线疑云](https://www.bilibili.com/video/av1756294467/) |

## 接线疑云

| 游戏名称 | 直播日期 | 时长 | 集数   | 标题                                                         |
| -------- | -------- | ---- | ------ | ------------------------------------------------------------ |
| 接线疑云 | 7/24/2024 | 03:36:49 | Part 1 | [【机皇录播】 2024-07-24 背包乱斗 + 接线疑云](https://www.bilibili.com/video/av1756294467/) |

## 山河旅探

| 游戏名称 | 直播日期 | 时长 | 集数   | 标题                                                         |
| -------- | -------- | ---- | ------ | ------------------------------------------------------------ |
| 山河旅探 | 2/8/2024 | 02:40:36 | Part 1 | [【机皇录播】 24-02-08 山河旅探](https://www.bilibili.com/video/av1000478808/) |
| 山河旅探 | 2/9/2024 | 04:30:05 | Part 2 | [【机皇录播】 24-02-09 山河旅探](https://www.bilibili.com/video/av1650359881/) |

## 梦蝶

| 游戏名称 | 直播日期 | 时长 | 集数   | 标题                                                         |
| -------- | -------- | ---- | ------ | ------------------------------------------------------------ |
| 梦蝶 | 7/5/2023 | 04:10:40 | Part 1 | [【机皇录播】 23-07-05 梦蝶 + 超侦探事件簿：雾雨迷宫](https://www.bilibili.com/video/av615580014/) |

## 超侦探事件簿：雾雨迷宫

| 游戏名称 | 直播日期 | 时长 | 集数   | 标题                                                         |
| -------- | -------- | ---- | ------ | ------------------------------------------------------------ |
| 超侦探事件簿：雾雨迷宫 | 6/30/2023 | 03:59:52 | Part 1 | [【机皇录播】 23-06-30 超侦探事件簿：雾雨迷宫](https://www.bilibili.com/video/av742992033/) |
| 超侦探事件簿：雾雨迷宫 | 7/5/2023 | 04:10:40 | Part 2 | [【机皇录播】 23-07-05 梦蝶 + 超侦探事件簿：雾雨迷宫](https://www.bilibili.com/video/av615580014/) |

## 时空勇士

| 游戏名称 | 直播日期 | 时长 | 集数   | 标题                                                         |
| -------- | -------- | ---- | ------ | ------------------------------------------------------------ |
| 时空勇士 | 6/9/2023 | 05:42:46 | Part 1 | [【机皇录播】 23-06-09 时空勇士](https://www.bilibili.com/video/av827193266/) |
| 时空勇士 | 6/13/2023 | 04:08:37 | Part 2 | [【机皇录播】 23-06-13 时空勇士](https://www.bilibili.com/video/av784775385/) |
| 时空勇士 | 6/27/2023 | 05:39:35 | Part 3 | [【机皇录播】 23-06-27 时空勇士](https://www.bilibili.com/video/av402840144/) |

## Chicory

| 游戏名称 | 直播日期 | 时长 | 集数   | 标题                                                         |
| -------- | -------- | ---- | ------ | ------------------------------------------------------------ |
| Chicory | 6/4/2023 | 04:09:05 | Part 1 | [【机皇录播】 23-06-04 Chicory](https://www.bilibili.com/video/av826902001/) |

## Poly Bridge 3/桥梁建筑师3

| 游戏名称 | 直播日期 | 时长 | 集数   | 标题                                                         |
| -------- | -------- | ---- | ------ | ------------------------------------------------------------ |
| Poly Bridge 3/桥梁建筑师3 | 5/31/2023 | 04:08:55 | Part 1 | [【机皇录播】 23-05-31  Poly Bridge 3/桥梁建筑师3 + LIVE A LIVE/时空勇士](https://www.bilibili.com/video/av444337475/) |

## LIVE A LIVE/时空勇士

| 游戏名称 | 直播日期 | 时长 | 集数   | 标题                                                         |
| -------- | -------- | ---- | ------ | ------------------------------------------------------------ |
| LIVE A LIVE/时空勇士 | 5/31/2023 | 04:08:55 | Part 1 | [【机皇录播】 23-05-31  Poly Bridge 3/桥梁建筑师3 + LIVE A LIVE/时空勇士](https://www.bilibili.com/video/av444337475/) |

## 不要喂猴子

| 游戏名称 | 直播日期 | 时长 | 集数   | 标题                                                         |
| -------- | -------- | ---- | ------ | ------------------------------------------------------------ |
| 不要喂猴子 | 5/30/2023 | 04:09:24 | Part 1 | [【机皇录播】 23-05-30 不要喂猴子 + 塞尔达传说：王国之泪——科研](https://www.bilibili.com/video/av399323075/) |

## 塞尔达传说：王国之泪

| 游戏名称 | 直播日期 | 时长 | 集数   | 标题                                                         |
| -------- | -------- | ---- | ------ | ------------------------------------------------------------ |
| 塞尔达传说：王国之泪 | 5/23/2023 | 03:41:55 | Part 1 | [【机皇录播】 23-05-23 塞尔达传说：御天之剑 + 塞尔达传说：王国之泪](https://www.bilibili.com/video/av443973582/) |
| 塞尔达传说：王国之泪 | 5/30/2023 | 04:09:24 | Part 2 | [【机皇录播】 23-05-30 不要喂猴子 + 塞尔达传说：王国之泪——科研](https://www.bilibili.com/video/av399323075/) |

## 塞尔达传说：御天之剑

| 游戏名称 | 直播日期 | 时长 | 集数   | 标题                                                         |
| -------- | -------- | ---- | ------ | ------------------------------------------------------------ |
| 塞尔达传说：御天之剑 | 4/27/2023 | 03:17:15 | Part 1 | [【机皇录播】 23-04-27 塞尔达传说：御天之剑 + Nobodies + Trailmakers/机械制造者](https://www.bilibili.com/video/av910539745/) |
| 塞尔达传说：御天之剑 | 5/3/2023 | 03:50:43 | Part 2 | [【机皇录播】 23-05-03 塞尔达传说：御天之剑 + Trailmakers/机械制造者](https://www.bilibili.com/video/av868240449/) |
| 塞尔达传说：御天之剑 | 5/10/2023 | 03:39:19 | Part 3 | [【机皇录播】 23-05-10 Trailmakers/机械制造者 + 塞尔达传说：御天之剑](https://www.bilibili.com/video/av741039068/) |
| 塞尔达传说：御天之剑 | 5/23/2023 | 03:41:55 | Part 4 | [【机皇录播】 23-05-23 塞尔达传说：御天之剑 + 塞尔达传说：王国之泪](https://www.bilibili.com/video/av443973582/) |

## Trailmakers/机械制造者

| 游戏名称 | 直播日期 | 时长 | 集数   | 标题                                                         |
| -------- | -------- | ---- | ------ | ------------------------------------------------------------ |
| Trailmakers/机械制造者 | 4/27/2023 | 03:17:15 | Part 1 | [【机皇录播】 23-04-27 塞尔达传说：御天之剑 + Nobodies + Trailmakers/机械制造者](https://www.bilibili.com/video/av910539745/) |
| Trailmakers/机械制造者 | 5/3/2023 | 03:50:43 | Part 2 | [【机皇录播】 23-05-03 塞尔达传说：御天之剑 + Trailmakers/机械制造者](https://www.bilibili.com/video/av868240449/) |
| Trailmakers/机械制造者 | 5/10/2023 | 03:39:19 | Part 3 | [【机皇录播】 23-05-10 Trailmakers/机械制造者 + 塞尔达传说：御天之剑](https://www.bilibili.com/video/av741039068/) |

## Nobodies

| 游戏名称 | 直播日期 | 时长 | 集数   | 标题                                                         |
| -------- | -------- | ---- | ------ | ------------------------------------------------------------ |
| Nobodies | 4/27/2023 | 03:17:15 | Part 1 | [【机皇录播】 23-04-27 塞尔达传说：御天之剑 + Nobodies + Trailmakers/机械制造者](https://www.bilibili.com/video/av910539745/) |

## 宝可梦朱紫

| 游戏名称 | 直播日期 | 时长 | 集数   | 标题                                                         |
| -------- | -------- | ---- | ------ | ------------------------------------------------------------ |
| 宝可梦朱紫 | 3/31/2023 | 04:08:17 | Part 1 | [【机皇录播】 23-03-31 宝可梦朱紫 + 火焰纹章engage](https://www.bilibili.com/video/av654460153/) |

## 火焰纹章engage

| 游戏名称 | 直播日期 | 时长 | 集数   | 标题                                                         |
| -------- | -------- | ---- | ------ | ------------------------------------------------------------ |
| 火焰纹章engage | 1/19/2023 | 04:25:57 | Part 1 | [【机皇录播】 23-01-19 真探 part 6  +《角色扮演游戏时间！ ～光之传说～》 part 3 + 火焰纹章engage part 1](https://www.bilibili.com/video/av905537383/) |
| 火焰纹章engage | 1/20/2023 | 05:21:55 | Part 2 | [【机皇录播】 23-01-20 raft part 3+ 火焰纹章engage part 2](https://www.bilibili.com/video/av478241861/) |
| 火焰纹章engage | 1/21/2023 | 04:26:19 | Part 3 | [【机皇录播】 23-01-21 火焰纹章engage part 3](https://www.bilibili.com/video/av435739284/) |
| 火焰纹章engage | 1/22/2023 | 04:54:12 | Part 4 | [【机皇录播】 23-01-22 《角色扮演游戏时间！ ～光之传说～》 part 4 + 火焰纹章engage part 4](https://www.bilibili.com/video/av350661220/) |
| 火焰纹章engage | 1/23/2023 | 04:16:56 | Part 5 | [【机皇录播】 23-01-23 火焰纹章engage part 5](https://www.bilibili.com/video/av778276893/) |
| 火焰纹章engage | 3/27/2023 | 03:15:31 | Part 6 | [【机皇录播】 23-03-27 火焰纹章engage](https://www.bilibili.com/video/av781735206/) |
| 火焰纹章engage | 3/31/2023 | 04:08:17 | Part 7 | [【机皇录播】 23-03-31 宝可梦朱紫 + 火焰纹章engage](https://www.bilibili.com/video/av654460153/) |

## 飞禽律师之事件簿

| 游戏名称 | 直播日期 | 时长 | 集数   | 标题                                                         |
| -------- | -------- | ---- | ------ | ------------------------------------------------------------ |
| 飞禽律师之事件簿 | 3/5/2023 | 03:21:43 | Part 1 | [【机皇录播】 23-03-05 飞禽律师之事件簿 + Phantom Brigade + 坎巴拉太空计划2](https://www.bilibili.com/video/av310543056/) |

## Phantom Brigade

| 游戏名称 | 直播日期 | 时长 | 集数   | 标题                                                         |
| -------- | -------- | ---- | ------ | ------------------------------------------------------------ |
| Phantom Brigade | 3/5/2023 | 03:21:43 | Part 1 | [【机皇录播】 23-03-05 飞禽律师之事件簿 + Phantom Brigade + 坎巴拉太空计划2](https://www.bilibili.com/video/av310543056/) |

## 坎巴拉太空计划2

| 游戏名称 | 直播日期 | 时长 | 集数   | 标题                                                         |
| -------- | -------- | ---- | ------ | ------------------------------------------------------------ |
| 坎巴拉太空计划2 | 3/5/2023 | 03:21:43 | Part 1 | [【机皇录播】 23-03-05 飞禽律师之事件簿 + Phantom Brigade + 坎巴拉太空计划2](https://www.bilibili.com/video/av310543056/) |

## 角色扮演游戏时间！ ～光之传说～

| 游戏名称 | 直播日期 | 时长 | 集数   | 标题                                                         |
| -------- | -------- | ---- | ------ | ------------------------------------------------------------ |
| 角色扮演游戏时间！ ～光之传说～ | 1/17/2023 | 04:46:57 | Part 1 | [【机皇录播】 23-01-17 真探 part 4  +《角色扮演游戏时间！ ～光之传说～》 part 1](https://www.bilibili.com/video/av477918972/) |
| 角色扮演游戏时间！ ～光之传说～ | 1/18/2023 | 04:47:32 | Part 2 | [【机皇录播】 23-01-18 真探 part 5  +《角色扮演游戏时间！ ～光之传说～》 part 2](https://www.bilibili.com/video/av778103351/) |
| 角色扮演游戏时间！ ～光之传说～ | 1/19/2023 | 04:25:57 | Part 3 | [【机皇录播】 23-01-19 真探 part 6  +《角色扮演游戏时间！ ～光之传说～》 part 3 + 火焰纹章engage part 1](https://www.bilibili.com/video/av905537383/) |
| 角色扮演游戏时间！ ～光之传说～ | 1/22/2023 | 04:54:12 | Part 4 | [【机皇录播】 23-01-22 《角色扮演游戏时间！ ～光之传说～》 part 4 + 火焰纹章engage part 4](https://www.bilibili.com/video/av350661220/) |

## raft

| 游戏名称 | 直播日期 | 时长 | 集数   | 标题                                                         |
| -------- | -------- | ---- | ------ | ------------------------------------------------------------ |
| raft | 1/14/2023 | 05:52:17 | Part 1 | [【机皇录播】 23-01-14 真探 part 1 + raft part 1](https://www.bilibili.com/video/av650299050/) |
| raft | 1/15/2023 | 06:40:26 | Part 2 | [【机皇录播】 23-01-15 真探 part2 + raft part 2](https://www.bilibili.com/video/av777888025/) |
| raft | 1/20/2023 | 05:21:55 | Part 3 | [【机皇录播】 23-01-20 raft part 3+ 火焰纹章engage part 2](https://www.bilibili.com/video/av478241861/) |

## 真探

| 游戏名称 | 直播日期 | 时长 | 集数   | 标题                                                         |
| -------- | -------- | ---- | ------ | ------------------------------------------------------------ |
| 真探 | 1/14/2023 | 05:52:17 | Part 1 | [【机皇录播】 23-01-14 真探 part 1 + raft part 1](https://www.bilibili.com/video/av650299050/) |
| 真探 | 1/15/2023 | 06:40:26 | Part 2 | [【机皇录播】 23-01-15 真探 part2 + raft part 2](https://www.bilibili.com/video/av777888025/) |
| 真探 | 1/16/2023 | 04:14:27 | Part 3 | [【机皇录播】 23-01-16 真探 part 3](https://www.bilibili.com/video/av777987345/) |
| 真探 | 1/17/2023 | 04:46:57 | Part 4 | [【机皇录播】 23-01-17 真探 part 4  +《角色扮演游戏时间！ ～光之传说～》 part 1](https://www.bilibili.com/video/av477918972/) |
| 真探 | 1/18/2023 | 04:47:32 | Part 5 | [【机皇录播】 23-01-18 真探 part 5  +《角色扮演游戏时间！ ～光之传说～》 part 2](https://www.bilibili.com/video/av778103351/) |
| 真探 | 1/19/2023 | 04:25:57 | Part 6 | [【机皇录播】 23-01-19 真探 part 6  +《角色扮演游戏时间！ ～光之传说～》 part 3 + 火焰纹章engage part 1](https://www.bilibili.com/video/av905537383/) |

## 哆啦A梦

| 游戏名称 | 直播日期 | 时长 | 集数   | 标题                                                         |
| -------- | -------- | ---- | ------ | ------------------------------------------------------------ |
| 哆啦A梦 | 1/13/2023 | 03:56:31 | Part 1 | [【机皇录播】 23-01-13 哆啦A梦](https://www.bilibili.com/video/av777813857/) |