# 北极熊剩饭 直播回放 (from 自行车二层)

| 主播 | 北极熊剩饭 |
| -------------------- | ------------------------------------------------------------ |
| **上传者** | **自行车二层** |
| **数据更新时间** | **1/11/2026, 6:24:40 PM** |
| **累积计入视频数量** | **271** |
| **最旧视频** | [【剩饭录播】 2024-06-25 觉醒深渊 +艾尔登法环dlc](https://www.bilibili.com/video/av1355810374/) |
| **最新视频** | [【剩饭录播】 2026-01-09 大寿播](https://www.bilibili.com/video/av115867262125364/) |

---

[TOC]

---

## 大寿播

| 游戏名称 | 直播日期 | 时长 | 集数   | 标题                                                         |
| -------- | -------- | ---- | ------ | ------------------------------------------------------------ |
| 大寿播 | 1/9/2026 | 06:32:06 | Part 1 | [【剩饭录播】 2026-01-09 大寿播](https://www.bilibili.com/video/av115867262125364/) |

## 减脂2026

| 游戏名称 | 直播日期 | 时长 | 集数   | 标题                                                         |
| -------- | -------- | ---- | ------ | ------------------------------------------------------------ |
| 减脂2026 | 1/5/2026 | 07:30:27 | Part 1 | [【剩饭录播】 2026-01-05 减脂2026](https://www.bilibili.com/video/av115844512225255/) |

## 看网页

| 游戏名称 | 直播日期 | 时长 | 集数   | 标题                                                         |
| -------- | -------- | ---- | ------ | ------------------------------------------------------------ |
| 看网页 | 9/5/2025 | 06:23:13 | Part 1 | [【剩饭录播】 2025-09-05 银河破裂者 + 看网页](https://www.bilibili.com/video/av115151747417808/) |
| 看网页 | 9/9/2025 | 05:16:16 | Part 2 | [【剩饭录播】 2025-09-09 空洞骑士：丝之歌 + 看网页](https://www.bilibili.com/video/av115174547724538/) |
| 看网页 | 12/2/2025 | 07:09:50 | Part 3 | [【剩饭录播】 2025-12-02 使命召唤：黑色行动 7 + 明日方舟：终末地 + 看网页](https://www.bilibili.com/video/av115649946852793/) |
| 看网页 | 12/30/2025 | 06:43:17 | Part 4 | [【剩饭录播】 2025-12-30 cookie clicker + 看网页 + 月球任务 + 猛男寨mc](https://www.bilibili.com/video/av115810337035477/) |
| 看网页 | 12/31/2025 | 07:58:16 | Part 5 | [【剩饭录播】 2025-12-31 猛男寨mc + 看电影 + 看网页](https://www.bilibili.com/video/av115816628492037/) |
| 看网页 | 1/2/2026 | 06:37:50 | Part 6 | [【剩饭录播】 2026-01-02 看网页 + 鲁特里一家死了](https://www.bilibili.com/video/av115827785335311/) |
| 看网页 | 1/3/2026 | 05:56:45 | Part 7 | [【剩饭录播】 2026-01-03 看网页 + 鲁特里一家死了](https://www.bilibili.com/video/av115833036605273/) |

## 鲁特里一家死了

| 游戏名称 | 直播日期 | 时长 | 集数   | 标题                                                         |
| -------- | -------- | ---- | ------ | ------------------------------------------------------------ |
| 鲁特里一家死了 | 1/2/2026 | 06:37:50 | Part 1 | [【剩饭录播】 2026-01-02 看网页 + 鲁特里一家死了](https://www.bilibili.com/video/av115827785335311/) |
| 鲁特里一家死了 | 1/3/2026 | 05:56:45 | Part 2 | [【剩饭录播】 2026-01-03 看网页 + 鲁特里一家死了](https://www.bilibili.com/video/av115833036605273/) |

## 猛男寨mc

| 游戏名称 | 直播日期 | 时长 | 集数   | 标题                                                         |
| -------- | -------- | ---- | ------ | ------------------------------------------------------------ |
| 猛男寨mc | 7/29/2024 | 06:15:51 | Part 1 | [【剩饭录播】 2024-07-29 猛男寨mc](https://www.bilibili.com/video/av1706486539/) |
| 猛男寨mc | 7/30/2024 | 06:12:31 | Part 2 | [【剩饭录播】 2024-07-30 猛男寨mc](https://www.bilibili.com/video/av112875817405802/) |
| 猛男寨mc | 7/31/2024 | 06:23:39 | Part 3 | [【剩饭录播】 2024-07-31 猛男寨mc](https://www.bilibili.com/video/av112881219669962/) |
| 猛男寨mc | 8/2/2024 | 03:43:36 | Part 4 | [【剩饭录播】 2024-08-02 残缺——猛男寨mc](https://www.bilibili.com/video/av112893332817079/) |
| 猛男寨mc | 8/3/2024 | 07:19:09 | Part 5 | [【剩饭录播】 2024-08-03 猛男寨mc（无弹幕）](https://www.bilibili.com/video/av112903684426627/) |
| 猛男寨mc | 8/4/2024 | 06:34:49 | Part 6 | [【剩饭录播】 2024-08-04 猛男寨mc](https://www.bilibili.com/video/av112904036680289/) |
| 猛男寨mc | 8/8/2024 | 05:17:12 | Part 7 | [【剩饭录播】 2024-08-08 猛男寨mc + nikke](https://www.bilibili.com/video/av112926635721379/) |
| 猛男寨mc | 12/30/2025 | 06:43:17 | Part 8 | [【剩饭录播】 2025-12-30 cookie clicker + 看网页 + 月球任务 + 猛男寨mc](https://www.bilibili.com/video/av115810337035477/) |
| 猛男寨mc | 12/31/2025 | 07:58:16 | Part 9 | [【剩饭录播】 2025-12-31 猛男寨mc + 看电影 + 看网页](https://www.bilibili.com/video/av115816628492037/) |

## 看电影

| 游戏名称 | 直播日期 | 时长 | 集数   | 标题                                                         |
| -------- | -------- | ---- | ------ | ------------------------------------------------------------ |
| 看电影 | 12/31/2025 | 07:58:16 | Part 1 | [【剩饭录播】 2025-12-31 猛男寨mc + 看电影 + 看网页](https://www.bilibili.com/video/av115816628492037/) |

## cookie clicker

| 游戏名称 | 直播日期 | 时长 | 集数   | 标题                                                         |
| -------- | -------- | ---- | ------ | ------------------------------------------------------------ |
| cookie clicker | 12/30/2025 | 06:43:17 | Part 1 | [【剩饭录播】 2025-12-30 cookie clicker + 看网页 + 月球任务 + 猛男寨mc](https://www.bilibili.com/video/av115810337035477/) |

## 月球任务

| 游戏名称 | 直播日期 | 时长 | 集数   | 标题                                                         |
| -------- | -------- | ---- | ------ | ------------------------------------------------------------ |
| 月球任务 | 12/30/2025 | 06:43:17 | Part 1 | [【剩饭录播】 2025-12-30 cookie clicker + 看网页 + 月球任务 + 猛男寨mc](https://www.bilibili.com/video/av115810337035477/) |

## 接线疑云

| 游戏名称 | 直播日期 | 时长 | 集数   | 标题                                                         |
| -------- | -------- | ---- | ------ | ------------------------------------------------------------ |
| 接线疑云 | 12/29/2025 | 05:45:53 | Part 1 | [【剩饭录播】 2025-12-29 接线疑云 + 疑案追声](https://www.bilibili.com/video/av115802904725631/) |

## 疑案追声

| 游戏名称 | 直播日期 | 时长 | 集数   | 标题                                                         |
| -------- | -------- | ---- | ------ | ------------------------------------------------------------ |
| 疑案追声 | 12/29/2025 | 05:45:53 | Part 1 | [【剩饭录播】 2025-12-29 接线疑云 + 疑案追声](https://www.bilibili.com/video/av115802904725631/) |

## 看b站

| 游戏名称 | 直播日期 | 时长 | 集数   | 标题                                                         |
| -------- | -------- | ---- | ------ | ------------------------------------------------------------ |
| 看b站 | 4/2/2025 | 05:52:47 | Part 1 | [【剩饭录播】 2025-04-02 装机 + 深海迷航 + 看b站 + 任天堂直面会](https://www.bilibili.com/video/av114267856636226/) |
| 看b站 | 6/22/2025 | 04:14:40 | Part 2 | [【剩饭录播】 2025-06-22 PEAK + 看b站](https://www.bilibili.com/video/av114727418138475/) |
| 看b站 | 10/30/2025 | 05:43:27 | Part 3 | [【剩饭录播】 2025-10-30 我们到了吗？ + 物种：未知 + 看b站](https://www.bilibili.com/video/av115463182877411/) |
| 看b站 | 12/27/2025 | 05:41:16 | Part 4 | [【剩饭录播】 2025-12-27 看b站 + 冲就完事模拟器2](https://www.bilibili.com/video/av115791412334540/) |

## 冲就完事模拟器2

| 游戏名称 | 直播日期 | 时长 | 集数   | 标题                                                         |
| -------- | -------- | ---- | ------ | ------------------------------------------------------------ |
| 冲就完事模拟器2 | 12/26/2025 | 06:43:38 | Part 1 | [【剩饭录播】 2025-12-26 冲就完事模拟器2 + 我们到了吗？](https://www.bilibili.com/video/av115785758416475/) |
| 冲就完事模拟器2 | 12/27/2025 | 05:41:16 | Part 2 | [【剩饭录播】 2025-12-27 看b站 + 冲就完事模拟器2](https://www.bilibili.com/video/av115791412334540/) |

## 我们到了吗？

| 游戏名称 | 直播日期 | 时长 | 集数   | 标题                                                         |
| -------- | -------- | ---- | ------ | ------------------------------------------------------------ |
| 我们到了吗？ | 10/29/2025 | 05:49:45 | Part 1 | [【剩饭录播】 2025-10-29 我们到了吗？](https://www.bilibili.com/video/av115457394808927/) |
| 我们到了吗？ | 10/30/2025 | 05:43:27 | Part 2 | [【剩饭录播】 2025-10-30 我们到了吗？ + 物种：未知 + 看b站](https://www.bilibili.com/video/av115463182877411/) |
| 我们到了吗？ | 12/26/2025 | 06:43:38 | Part 3 | [【剩饭录播】 2025-12-26 冲就完事模拟器2 + 我们到了吗？](https://www.bilibili.com/video/av115785758416475/) |

## 密室逃脱模拟器2

| 游戏名称 | 直播日期 | 时长 | 集数   | 标题                                                         |
| -------- | -------- | ---- | ------ | ------------------------------------------------------------ |
| 密室逃脱模拟器2 | 12/21/2025 | 05:54:37 | Part 1 | [【剩饭录播】 2025-12-21 密室逃脱模拟器2](https://www.bilibili.com/video/av115757522355262/) |
| 密室逃脱模拟器2 | 12/23/2025 | 07:16:28 | Part 2 | [【剩饭录播】 2025-12-23 密室逃脱模拟器2 + necesse](https://www.bilibili.com/video/av115768880533876/) |

## necesse

| 游戏名称 | 直播日期 | 时长 | 集数   | 标题                                                         |
| -------- | -------- | ---- | ------ | ------------------------------------------------------------ |
| necesse | 12/23/2025 | 07:16:28 | Part 1 | [【剩饭录播】 2025-12-23 密室逃脱模拟器2 + necesse](https://www.bilibili.com/video/av115768880533876/) |

## 看B站

| 游戏名称 | 直播日期 | 时长 | 集数   | 标题                                                         |
| -------- | -------- | ---- | ------ | ------------------------------------------------------------ |
| 看B站 | 6/6/2025 | 04:26:37 | Part 1 | [【剩饭录播】 2025-06-06 黑夜君临 + 看B站](https://www.bilibili.com/video/av114636888216835/) |
| 看B站 | 12/19/2025 | 04:48:04 | Part 2 | [【剩饭录播】 2025-12-19 看B站 + 僵尸毁灭工程](https://www.bilibili.com/video/av115746449392080/) |

## 僵尸毁灭工程

| 游戏名称 | 直播日期 | 时长 | 集数   | 标题                                                         |
| -------- | -------- | ---- | ------ | ------------------------------------------------------------ |
| 僵尸毁灭工程 | 7/10/2024 | 04:33:01 | Part 1 | [【剩饭录播】 2024-07-10 最后的战役：劫后余生 + 僵尸毁灭工程](https://www.bilibili.com/video/av1156002079/) |
| 僵尸毁灭工程 | 7/15/2024 | 04:01:19 | Part 2 | [【剩饭录播】 2024-07-15 僵尸毁灭工程 + 联机艾尔登法环（缺21）](https://www.bilibili.com/video/av1256192907/) |
| 僵尸毁灭工程 | 7/17/2024 | 05:26:49 | Part 3 | [【剩饭录播】 2024-07-17 僵尸毁灭工程](https://www.bilibili.com/video/av1206185543/) |
| 僵尸毁灭工程 | 7/19/2024 | 04:55:19 | Part 4 | [【剩饭录播】 2024-07-19 僵尸毁灭工程](https://www.bilibili.com/video/av1906439229/) |
| 僵尸毁灭工程 | 7/22/2024 | 06:32:16 | Part 5 | [【剩饭录播】 2024-07-22 僵尸毁灭工程 + 逃离塔科夫](https://www.bilibili.com/video/av1756335753/) |
| 僵尸毁灭工程 | 8/31/2024 | 07:41:53 | Part 6 | [【剩饭录播】 2024-08-31 星球大战：亡命之徒 + 僵尸毁灭工程（最后2p无弹幕）](https://www.bilibili.com/video/av113056742967316/) |
| 僵尸毁灭工程 | 9/1/2024 | 04:43:43 | Part 7 | [【剩饭录播】 2024-09-01 僵尸毁灭工程](https://www.bilibili.com/video/av113062883362095/) |
| 僵尸毁灭工程 | 9/2/2024 | 04:02:05 | Part 8 | [【剩饭录播】 2024-09-02 僵尸毁灭工程](https://www.bilibili.com/video/av113068369577794/) |
| 僵尸毁灭工程 | 9/3/2024 | 06:46:19 | Part 9 | [【剩饭录播】 2024-09-03 僵尸毁灭工程](https://www.bilibili.com/video/av113073889346818/) |
| 僵尸毁灭工程 | 9/4/2024 | 09:32:25 | Part 10 | [【剩饭录播】 2024-09-04 僵尸毁灭工程](https://www.bilibili.com/video/av113079291675498/) |
| 僵尸毁灭工程 | 9/5/2024 | 13:57:15 | Part 11 | [【剩饭录播】 2024-09-05 僵尸毁灭工程 + 星际战士2](https://www.bilibili.com/video/av113085432071269/) |
| 僵尸毁灭工程 | 9/8/2024 | 06:20:38 | Part 12 | [【剩饭录播】 2024-09-08 僵尸毁灭工程](https://www.bilibili.com/video/av113102175799124/) |
| 僵尸毁灭工程 | 9/12/2024 | 07:13:14 | Part 13 | [【剩饭录播】 2024-09-12 僵尸毁灭工程 + GUNDAM 创坏者4](https://www.bilibili.com/video/av113124908794638/) |
| 僵尸毁灭工程 | 12/27/2024 | 03:53:30 | Part 14 | [【剩饭录播】 2024-12-27 燕云十六声 + hitman + 僵尸毁灭工程](https://www.bilibili.com/video/av113724828420558/) |
| 僵尸毁灭工程 | 12/19/2025 | 04:48:04 | Part 15 | [【剩饭录播】 2025-12-19 看B站 + 僵尸毁灭工程](https://www.bilibili.com/video/av115746449392080/) |

## 终结者2D：NO FATE

| 游戏名称 | 直播日期 | 时长 | 集数   | 标题                                                         |
| -------- | -------- | ---- | ------ | ------------------------------------------------------------ |
| 终结者2D：NO FATE | 12/16/2025 | 02:58:21 | Part 1 | [【剩饭录播】 2025-12-16 终结者2D：NO FATE + 密特罗德：融合](https://www.bilibili.com/video/av115729655404749/) |

## 密特罗德：融合

| 游戏名称 | 直播日期 | 时长 | 集数   | 标题                                                         |
| -------- | -------- | ---- | ------ | ------------------------------------------------------------ |
| 密特罗德：融合 | 12/14/2025 | 03:32:17 | Part 1 | [【剩饭录播】 2025-12-14 密特罗德：融合](https://www.bilibili.com/video/av115717022155385/) |
| 密特罗德：融合 | 12/16/2025 | 02:58:21 | Part 2 | [【剩饭录播】 2025-12-16 终结者2D：NO FATE + 密特罗德：融合](https://www.bilibili.com/video/av115729655404749/) |

## TGA

| 游戏名称 | 直播日期 | 时长 | 集数   | 标题                                                         |
| -------- | -------- | ---- | ------ | ------------------------------------------------------------ |
| TGA | 12/13/2024 | 04:02:22 | Part 1 | [【剩饭录播】 2024-12-13 僚机计划 + TGA](https://www.bilibili.com/video/av113642922122862/) |
| TGA | 12/12/2025 | 03:52:12 | Part 2 | [【剩饭录播】 2025-12-12 TGA](https://www.bilibili.com/video/av115704053437055/) |

## 密特罗德：生存恐惧

| 游戏名称 | 直播日期 | 时长 | 集数   | 标题                                                         |
| -------- | -------- | ---- | ------ | ------------------------------------------------------------ |
| 密特罗德：生存恐惧 | 6/9/2025 | 06:58:16 | Part 1 | [【剩饭录播】 2025-06-09 密特罗德：生存恐惧](https://www.bilibili.com/video/av114653698986168/) |
| 密特罗德：生存恐惧 | 12/9/2025 | 07:11:02 | Part 2 | [【剩饭录播】 2025-12-09 密特罗德：生存恐惧](https://www.bilibili.com/video/av115689222312753/) |
| 密特罗德：生存恐惧 | 12/10/2025 | 05:45:09 | Part 3 | [【剩饭录播】 2025-12-10 密特罗德：生存恐惧](https://www.bilibili.com/video/av115695178226360/) |

## 密特罗德：究极4 穿越未知

| 游戏名称 | 直播日期 | 时长 | 集数   | 标题                                                         |
| -------- | -------- | ---- | ------ | ------------------------------------------------------------ |
| 密特罗德：究极4 穿越未知 | 12/4/2025 | 08:35:52 | Part 1 | [【剩饭录播】 2025-12-04 密特罗德：究极4 穿越未知](https://www.bilibili.com/video/av115661741234423/) |
| 密特罗德：究极4 穿越未知 | 12/5/2025 | 03:32:58 | Part 2 | [【剩饭录播】 2025-12-05 密特罗德：究极4 穿越未知](https://www.bilibili.com/video/av115667311332076/) |

## 使命召唤：黑色行动 7

| 游戏名称 | 直播日期 | 时长 | 集数   | 标题                                                         |
| -------- | -------- | ---- | ------ | ------------------------------------------------------------ |
| 使命召唤：黑色行动 7 | 11/14/2025 | 06:04:42 | Part 1 | [【剩饭录播】 2025-11-14 使命召唤：黑色行动 7 + 失落城堡2](https://www.bilibili.com/video/av115548025258711/) |
| 使命召唤：黑色行动 7 | 12/1/2025 | 04:12:25 | Part 2 | [【剩饭录播】 2025-12-01 使命召唤：黑色行动 7 + 海绵宝宝：潮汐巨神](https://www.bilibili.com/video/av115644997639577/) |
| 使命召唤：黑色行动 7 | 12/2/2025 | 07:09:50 | Part 3 | [【剩饭录播】 2025-12-02 使命召唤：黑色行动 7 + 明日方舟：终末地 + 看网页](https://www.bilibili.com/video/av115649946852793/) |

## 明日方舟：终末地

| 游戏名称 | 直播日期 | 时长 | 集数   | 标题                                                         |
| -------- | -------- | ---- | ------ | ------------------------------------------------------------ |
| 明日方舟：终末地 | 11/28/2025 | 06:26:16 | Part 1 | [【剩饭录播】 2025-11-28 明日方舟：终末地](https://www.bilibili.com/video/av115629092771944/) |
| 明日方舟：终末地 | 11/29/2025 | 04:32:45 | Part 2 | [【剩饭录播】 2025-11-29 明日方舟：终末地](https://www.bilibili.com/video/av115634377655502/) |
| 明日方舟：终末地 | 12/2/2025 | 07:09:50 | Part 3 | [【剩饭录播】 2025-12-02 使命召唤：黑色行动 7 + 明日方舟：终末地 + 看网页](https://www.bilibili.com/video/av115649946852793/) |

## 海绵宝宝：潮汐巨神

| 游戏名称 | 直播日期 | 时长 | 集数   | 标题                                                         |
| -------- | -------- | ---- | ------ | ------------------------------------------------------------ |
| 海绵宝宝：潮汐巨神 | 12/1/2025 | 04:12:25 | Part 1 | [【剩饭录播】 2025-12-01 使命召唤：黑色行动 7 + 海绵宝宝：潮汐巨神](https://www.bilibili.com/video/av115644997639577/) |

## 逃离后室

| 游戏名称 | 直播日期 | 时长 | 集数   | 标题                                                         |
| -------- | -------- | ---- | ------ | ------------------------------------------------------------ |
| 逃离后室 | 11/17/2025 | 05:40:56 | Part 1 | [【剩饭录播】 2025-11-17 逃离后室](https://www.bilibili.com/video/av115565456787041/) |
| 逃离后室 | 11/18/2025 | 02:19:20 | Part 2 | [【剩饭录播】 2025-11-18 逃离后室 + 忍者龙剑传4](https://www.bilibili.com/video/av115571093997597/) |

## 忍者龙剑传4

| 游戏名称 | 直播日期 | 时长 | 集数   | 标题                                                         |
| -------- | -------- | ---- | ------ | ------------------------------------------------------------ |
| 忍者龙剑传4 | 10/27/2025 | 03:37:59 | Part 1 | [【剩饭录播】 2025-10-27 天外世界2 + 忍者龙剑传4](https://www.bilibili.com/video/av115445667466293/) |
| 忍者龙剑传4 | 11/10/2025 | 05:41:39 | Part 2 | [【剩饭录播】 2025-11-10 忍者龙剑传4 + 忍者龙剑传Σ](https://www.bilibili.com/video/av115525376022692/) |
| 忍者龙剑传4 | 11/18/2025 | 02:19:20 | Part 3 | [【剩饭录播】 2025-11-18 逃离后室 + 忍者龙剑传4](https://www.bilibili.com/video/av115571093997597/) |

## 闪电十一人 英雄们的胜利之路

| 游戏名称 | 直播日期 | 时长 | 集数   | 标题                                                         |
| -------- | -------- | ---- | ------ | ------------------------------------------------------------ |
| 闪电十一人 英雄们的胜利之路 | 11/15/2025 | 04:01:28 | Part 1 | [【剩饭录播】 2025-11-15 闪电十一人 英雄们的胜利之路](https://www.bilibili.com/video/av115553746296112/) |

## 失落城堡2

| 游戏名称 | 直播日期 | 时长 | 集数   | 标题                                                         |
| -------- | -------- | ---- | ------ | ------------------------------------------------------------ |
| 失落城堡2 | 11/14/2025 | 06:04:42 | Part 1 | [【剩饭录播】 2025-11-14 使命召唤：黑色行动 7 + 失落城堡2](https://www.bilibili.com/video/av115548025258711/) |

## 超英派遣中心

| 游戏名称 | 直播日期 | 时长 | 集数   | 标题                                                         |
| -------- | -------- | ---- | ------ | ------------------------------------------------------------ |
| 超英派遣中心 | 11/9/2025 | 05:34:36 | Part 1 | [【剩饭录播】 2025-11-09 超英派遣中心 + 忍者龙剑传3](https://www.bilibili.com/video/av115519755721372/) |
| 超英派遣中心 | 11/13/2025 | 06:45:58 | Part 2 | [【剩饭录播】 2025-11-13 超英派遣中心 + 纪元117](https://www.bilibili.com/video/av115542438452821/) |

## 纪元117

| 游戏名称 | 直播日期 | 时长 | 集数   | 标题                                                         |
| -------- | -------- | ---- | ------ | ------------------------------------------------------------ |
| 纪元117 | 11/13/2025 | 06:45:58 | Part 1 | [【剩饭录播】 2025-11-13 超英派遣中心 + 纪元117](https://www.bilibili.com/video/av115542438452821/) |

## 索尼State of Play

| 游戏名称 | 直播日期 | 时长 | 集数   | 标题                                                         |
| -------- | -------- | ---- | ------ | ------------------------------------------------------------ |
| 索尼State of Play | 11/12/2025 | 00:40:27 | Part 1 | [【剩饭录播】 2025-11-12 索尼State of Play](https://www.bilibili.com/video/av115533513033276/) |

## 忍者龙剑传Σ

| 游戏名称 | 直播日期 | 时长 | 集数   | 标题                                                         |
| -------- | -------- | ---- | ------ | ------------------------------------------------------------ |
| 忍者龙剑传Σ | 11/10/2025 | 05:41:39 | Part 1 | [【剩饭录播】 2025-11-10 忍者龙剑传4 + 忍者龙剑传Σ](https://www.bilibili.com/video/av115525376022692/) |

## 忍者龙剑传3

| 游戏名称 | 直播日期 | 时长 | 集数   | 标题                                                         |
| -------- | -------- | ---- | ------ | ------------------------------------------------------------ |
| 忍者龙剑传3 | 11/9/2025 | 05:34:36 | Part 1 | [【剩饭录播】 2025-11-09 超英派遣中心 + 忍者龙剑传3](https://www.bilibili.com/video/av115519755721372/) |

## ck3

| 游戏名称 | 直播日期 | 时长 | 集数   | 标题                                                         |
| -------- | -------- | ---- | ------ | ------------------------------------------------------------ |
| ck3 | 12/25/2024 | 05:44:47 | Part 1 | [【剩饭录播】 2024-12-25 ck3](https://www.bilibili.com/video/av113713671636306/) |
| ck3 | 11/3/2025 | 08:42:05 | Part 2 | [【剩饭录播】 2025-11-03 ck3](https://www.bilibili.com/video/av115485781794098/) |
| ck3 | 11/6/2025 | 05:48:38 | Part 3 | [【剩饭录播】 2025-11-06 ck3](https://www.bilibili.com/video/av115502894552279/) |

## eu4

| 游戏名称 | 直播日期 | 时长 | 集数   | 标题                                                         |
| -------- | -------- | ---- | ------ | ------------------------------------------------------------ |
| eu4 | 11/5/2025 | 06:23:15 | Part 1 | [【剩饭录播】 2025-11-05 eu4](https://www.bilibili.com/video/av115496485652930/) |

## 物种：未知

| 游戏名称 | 直播日期 | 时长 | 集数   | 标题                                                         |
| -------- | -------- | ---- | ------ | ------------------------------------------------------------ |
| 物种：未知 | 10/30/2025 | 05:43:27 | Part 1 | [【剩饭录播】 2025-10-30 我们到了吗？ + 物种：未知 + 看b站](https://www.bilibili.com/video/av115463182877411/) |

## 天外世界2

| 游戏名称 | 直播日期 | 时长 | 集数   | 标题                                                         |
| -------- | -------- | ---- | ------ | ------------------------------------------------------------ |
| 天外世界2 | 10/27/2025 | 03:37:59 | Part 1 | [【剩饭录播】 2025-10-27 天外世界2 + 忍者龙剑传4](https://www.bilibili.com/video/av115445667466293/) |

## 现场手机直播2

| 游戏名称 | 直播日期 | 时长 | 集数   | 标题                                                         |
| -------- | -------- | ---- | ------ | ------------------------------------------------------------ |
| 现场手机直播2 | 10/22/2025 | 01:17:52 | Part 1 | [【剩饭录播】 2025-10-22 现场手机直播2](https://www.bilibili.com/video/av115417095870396/) |

## 现场手机直播

| 游戏名称 | 直播日期 | 时长 | 集数   | 标题                                                         |
| -------- | -------- | ---- | ------ | ------------------------------------------------------------ |
| 现场手机直播 | 10/21/2025 | 03:39:55 | Part 1 | [【剩饭录播】 2025-10-21 现场手机直播](https://www.bilibili.com/video/av115410821316775/) |
| 现场手机直播 | 10/22/2025 | 01:00:01 | Part 2 | [【剩饭录播】 2025-10-22 现场手机直播](https://www.bilibili.com/video/av115416525507172/) |

## 已爆炸

| 游戏名称 | 直播日期 | 时长 | 集数   | 标题                                                         |
| -------- | -------- | ---- | ------ | ------------------------------------------------------------ |
| 已爆炸 | 10/16/2025 | 02:00:03 | Part 1 | [【剩饭录播】 2025-10-16 已爆炸](https://www.bilibili.com/video/av115383994483207/) |

## 战地6

| 游戏名称 | 直播日期 | 时长 | 集数   | 标题                                                         |
| -------- | -------- | ---- | ------ | ------------------------------------------------------------ |
| 战地6 | 10/11/2025 | 07:39:06 | Part 1 | [【剩饭录播】 2025-10-11 战地6](https://www.bilibili.com/video/av115354332299567/) |
| 战地6 | 10/13/2025 | 04:27:40 | Part 2 | [【剩饭录播】 2025-10-13 战地6](https://www.bilibili.com/video/av115366848302084/) |

## 羊蹄山之魂

| 游戏名称 | 直播日期 | 时长 | 集数   | 标题                                                         |
| -------- | -------- | ---- | ------ | ------------------------------------------------------------ |
| 羊蹄山之魂 | 10/1/2025 | 10:27:15 | Part 1 | [【剩饭录播】 2025-10-01 暗区突围 + 羊蹄山之魂](https://www.bilibili.com/video/av115299621805579/) |
| 羊蹄山之魂 | 10/2/2025 | 03:54:46 | Part 2 | [【剩饭录播】 2025-10-02 羊蹄山之魂](https://www.bilibili.com/video/av115304789252147/) |
| 羊蹄山之魂 | 10/5/2025 | 04:55:28 | Part 3 | [【剩饭录播】 2025-10-05 羊蹄山之魂](https://www.bilibili.com/video/av115320241067793/) |
| 羊蹄山之魂 | 10/6/2025 | 07:27:13 | Part 4 | [【剩饭录播】 2025-10-06 羊蹄山之魂](https://www.bilibili.com/video/av115325710441573/) |
| 羊蹄山之魂 | 10/7/2025 | 08:43:20 | Part 5 | [【剩饭录播】 2025-10-07 羊蹄山之魂](https://www.bilibili.com/video/av115331414625463/) |
| 羊蹄山之魂 | 10/8/2025 | 07:05:55 | Part 6 | [【剩饭录播】 2025-10-08 羊蹄山之魂](https://www.bilibili.com/video/av115337219543223/) |
| 羊蹄山之魂 | 10/9/2025 | 04:17:31 | Part 7 | [【剩饭录播】 2025-10-09 羊蹄山之魂](https://www.bilibili.com/video/av115343058018291/) |

## 暗区突围

| 游戏名称 | 直播日期 | 时长 | 集数   | 标题                                                         |
| -------- | -------- | ---- | ------ | ------------------------------------------------------------ |
| 暗区突围 | 5/2/2025 | 04:44:09 | Part 1 | [【剩饭录播】 2025-05-02 暗区突围](https://www.bilibili.com/video/av114438547968639/) |
| 暗区突围 | 10/1/2025 | 10:27:15 | Part 2 | [【剩饭录播】 2025-10-01 暗区突围 + 羊蹄山之魂](https://www.bilibili.com/video/av115299621805579/) |

## 虐杀熔炉

| 游戏名称 | 直播日期 | 时长 | 集数   | 标题                                                         |
| -------- | -------- | ---- | ------ | ------------------------------------------------------------ |
| 虐杀熔炉 | 5/4/2025 | 05:41:04 | Part 1 | [【剩饭录播】 2025-05-04 绝地潜兵2 + 虐杀熔炉](https://www.bilibili.com/video/av114449637705961/) |
| 虐杀熔炉 | 9/28/2025 | 06:17:17 | Part 2 | [【剩饭录播】 2025-09-28 虐杀熔炉 + megabonk](https://www.bilibili.com/video/av115282156722295/) |

## megabonk

| 游戏名称 | 直播日期 | 时长 | 集数   | 标题                                                         |
| -------- | -------- | ---- | ------ | ------------------------------------------------------------ |
| megabonk | 9/28/2025 | 06:17:17 | Part 1 | [【剩饭录播】 2025-09-28 虐杀熔炉 + megabonk](https://www.bilibili.com/video/av115282156722295/) |

## 消逝的光芒3

| 游戏名称 | 直播日期 | 时长 | 集数   | 标题                                                         |
| -------- | -------- | ---- | ------ | ------------------------------------------------------------ |
| 消逝的光芒3 | 9/19/2025 | 08:41:59 | Part 1 | [【剩饭录播】 2025-09-19 消逝的光芒3 + 联机迷踪](https://www.bilibili.com/video/av115230399078222/) |
| 消逝的光芒3 | 9/20/2025 | 06:30:54 | Part 2 | [【剩饭录播】 2025-09-20 消逝的光芒3 + 看爽](https://www.bilibili.com/video/av115236707244144/) |
| 消逝的光芒3 | 9/21/2025 | 05:55:57 | Part 3 | [【剩饭录播】 2025-09-21 空洞骑士：丝之歌 + 消逝的光芒3 + 看爽](https://www.bilibili.com/video/av115242260500516/) |
| 消逝的光芒3 | 9/26/2025 | 04:56:32 | Part 4 | [【剩饭录播】 2025-09-26 消逝的光芒3 + 火星第一物流](https://www.bilibili.com/video/av115270664324688/) |

## 火星第一物流

| 游戏名称 | 直播日期 | 时长 | 集数   | 标题                                                         |
| -------- | -------- | ---- | ------ | ------------------------------------------------------------ |
| 火星第一物流 | 9/26/2025 | 04:56:32 | Part 1 | [【剩饭录播】 2025-09-26 消逝的光芒3 + 火星第一物流](https://www.bilibili.com/video/av115270664324688/) |

## 索尼发布会

| 游戏名称 | 直播日期 | 时长 | 集数   | 标题                                                         |
| -------- | -------- | ---- | ------ | ------------------------------------------------------------ |
| 索尼发布会 | 9/25/2025 | 02:35:49 | Part 1 | [【剩饭录播】 2025-09-25 索尼发布会](https://www.bilibili.com/video/av115261470414281/) |

## 杀戮地带：解放

| 游戏名称 | 直播日期 | 时长 | 集数   | 标题                                                         |
| -------- | -------- | ---- | ------ | ------------------------------------------------------------ |
| 杀戮地带：解放 | 9/23/2025 | 05:10:25 | Part 1 | [【剩饭录播】 2025-09-23 寂静岭f + 杀戮地带：解放](https://www.bilibili.com/video/av115253685782879/) |
| 杀戮地带：解放 | 9/24/2025 | 04:59:48 | Part 2 | [【剩饭录播】 2025-09-24 杀戮地带：解放 + somerville](https://www.bilibili.com/video/av115259507477112/) |

## somerville

| 游戏名称 | 直播日期 | 时长 | 集数   | 标题                                                         |
| -------- | -------- | ---- | ------ | ------------------------------------------------------------ |
| somerville | 9/24/2025 | 04:59:48 | Part 1 | [【剩饭录播】 2025-09-24 杀戮地带：解放 + somerville](https://www.bilibili.com/video/av115259507477112/) |

## 寂静岭f

| 游戏名称 | 直播日期 | 时长 | 集数   | 标题                                                         |
| -------- | -------- | ---- | ------ | ------------------------------------------------------------ |
| 寂静岭f | 9/22/2025 | 06:15:40 | Part 1 | [【剩饭录播】 2025-09-22 空洞骑士：丝之歌 + 无主之地4 + 寂静岭f](https://www.bilibili.com/video/av115248048642601/) |
| 寂静岭f | 9/23/2025 | 05:10:25 | Part 2 | [【剩饭录播】 2025-09-23 寂静岭f + 杀戮地带：解放](https://www.bilibili.com/video/av115253685782879/) |

## 空洞骑士：丝之歌

| 游戏名称 | 直播日期 | 时长 | 集数   | 标题                                                         |
| -------- | -------- | ---- | ------ | ------------------------------------------------------------ |
| 空洞骑士：丝之歌 | 9/8/2025 | 05:30:00 | Part 1 | [【剩饭录播】 2025-09-08 空洞骑士：丝之歌 + 看攻略](https://www.bilibili.com/video/av115168725960240/) |
| 空洞骑士：丝之歌 | 9/9/2025 | 05:16:16 | Part 2 | [【剩饭录播】 2025-09-09 空洞骑士：丝之歌 + 看网页](https://www.bilibili.com/video/av115174547724538/) |
| 空洞骑士：丝之歌 | 9/21/2025 | 05:55:57 | Part 3 | [【剩饭录播】 2025-09-21 空洞骑士：丝之歌 + 消逝的光芒3 + 看爽](https://www.bilibili.com/video/av115242260500516/) |
| 空洞骑士：丝之歌 | 9/22/2025 | 06:15:40 | Part 4 | [【剩饭录播】 2025-09-22 空洞骑士：丝之歌 + 无主之地4 + 寂静岭f](https://www.bilibili.com/video/av115248048642601/) |

## 无主之地4

| 游戏名称 | 直播日期 | 时长 | 集数   | 标题                                                         |
| -------- | -------- | ---- | ------ | ------------------------------------------------------------ |
| 无主之地4 | 9/12/2025 | 04:36:12 | Part 1 | [【剩饭录播】 2025-09-12 无主之地4](https://www.bilibili.com/video/av115191509420786/) |
| 无主之地4 | 9/13/2025 | 05:04:52 | Part 2 | [【剩饭录播】 2025-09-13 无主之地4](https://www.bilibili.com/video/av115197079456080/) |
| 无主之地4 | 9/15/2025 | 06:53:59 | Part 3 | [【剩饭录播】 2025-09-15 无主之地4](https://www.bilibili.com/video/av115208387300949/) |
| 无主之地4 | 9/16/2025 | 04:46:45 | Part 4 | [【剩饭录播】 2025-09-16 无主之地4](https://www.bilibili.com/video/av115214108399642/) |
| 无主之地4 | 9/22/2025 | 06:15:40 | Part 5 | [【剩饭录播】 2025-09-22 空洞骑士：丝之歌 + 无主之地4 + 寂静岭f](https://www.bilibili.com/video/av115248048642601/) |

## 看爽

| 游戏名称 | 直播日期 | 时长 | 集数   | 标题                                                         |
| -------- | -------- | ---- | ------ | ------------------------------------------------------------ |
| 看爽 | 6/7/2025 | 02:19:46 | Part 1 | [【剩饭录播】 2025-06-07 看爽 + 夏日游戏机节](https://www.bilibili.com/video/av114638700156213/) |
| 看爽 | 9/20/2025 | 06:30:54 | Part 2 | [【剩饭录播】 2025-09-20 消逝的光芒3 + 看爽](https://www.bilibili.com/video/av115236707244144/) |
| 看爽 | 9/21/2025 | 05:55:57 | Part 3 | [【剩饭录播】 2025-09-21 空洞骑士：丝之歌 + 消逝的光芒3 + 看爽](https://www.bilibili.com/video/av115242260500516/) |

## 联机迷踪

| 游戏名称 | 直播日期 | 时长 | 集数   | 标题                                                         |
| -------- | -------- | ---- | ------ | ------------------------------------------------------------ |
| 联机迷踪 | 9/19/2025 | 08:41:59 | Part 1 | [【剩饭录播】 2025-09-19 消逝的光芒3 + 联机迷踪](https://www.bilibili.com/video/av115230399078222/) |

## 寻找伪人

| 游戏名称 | 直播日期 | 时长 | 集数   | 标题                                                         |
| -------- | -------- | ---- | ------ | ------------------------------------------------------------ |
| 寻找伪人 | 9/17/2025 | 03:05:55 | Part 1 | [【剩饭录播】 2025-09-17 寻找伪人](https://www.bilibili.com/video/av115220299124445/) |

## 看攻略

| 游戏名称 | 直播日期 | 时长 | 集数   | 标题                                                         |
| -------- | -------- | ---- | ------ | ------------------------------------------------------------ |
| 看攻略 | 9/8/2025 | 05:30:00 | Part 1 | [【剩饭录播】 2025-09-08 空洞骑士：丝之歌 + 看攻略](https://www.bilibili.com/video/av115168725960240/) |

## 时间旅者：重生曙光

| 游戏名称 | 直播日期 | 时长 | 集数   | 标题                                                         |
| -------- | -------- | ---- | ------ | ------------------------------------------------------------ |
| 时间旅者：重生曙光 | 9/6/2025 | 05:36:35 | Part 1 | [【剩饭录播】 2025-09-06 时间旅者：重生曙光 + 地狱即我们](https://www.bilibili.com/video/av115157502006331/) |

## 地狱即我们

| 游戏名称 | 直播日期 | 时长 | 集数   | 标题                                                         |
| -------- | -------- | ---- | ------ | ------------------------------------------------------------ |
| 地狱即我们 | 9/6/2025 | 05:36:35 | Part 1 | [【剩饭录播】 2025-09-06 时间旅者：重生曙光 + 地狱即我们](https://www.bilibili.com/video/av115157502006331/) |

## 银河破裂者

| 游戏名称 | 直播日期 | 时长 | 集数   | 标题                                                         |
| -------- | -------- | ---- | ------ | ------------------------------------------------------------ |
| 银河破裂者 | 9/5/2025 | 06:23:13 | Part 1 | [【剩饭录播】 2025-09-05 银河破裂者 + 看网页](https://www.bilibili.com/video/av115151747417808/) |

## 四海兄弟：故乡

| 游戏名称 | 直播日期 | 时长 | 集数   | 标题                                                         |
| -------- | -------- | ---- | ------ | ------------------------------------------------------------ |
| 四海兄弟：故乡 | 9/2/2025 | 03:48:01 | Part 1 | [【剩饭录播】 2025-09-02 纪元 117 : 罗马和平 + 合金装备3重制版 + 四海兄弟：故乡](https://www.bilibili.com/video/av115134987049650/) |
| 四海兄弟：故乡 | 9/3/2025 | 04:39:49 | Part 2 | [【剩饭录播】 2025-09-03 四海兄弟：故乡](https://www.bilibili.com/video/av115140439579382/) |

## 纪元 117 : 罗马和平

| 游戏名称 | 直播日期 | 时长 | 集数   | 标题                                                         |
| -------- | -------- | ---- | ------ | ------------------------------------------------------------ |
| 纪元 117 : 罗马和平 | 9/2/2025 | 03:48:01 | Part 1 | [【剩饭录播】 2025-09-02 纪元 117 : 罗马和平 + 合金装备3重制版 + 四海兄弟：故乡](https://www.bilibili.com/video/av115134987049650/) |

## 合金装备3重制版

| 游戏名称 | 直播日期 | 时长 | 集数   | 标题                                                         |
| -------- | -------- | ---- | ------ | ------------------------------------------------------------ |
| 合金装备3重制版 | 9/2/2025 | 03:48:01 | Part 1 | [【剩饭录播】 2025-09-02 纪元 117 : 罗马和平 + 合金装备3重制版 + 四海兄弟：故乡](https://www.bilibili.com/video/av115134987049650/) |

## 非生物因素

| 游戏名称 | 直播日期 | 时长 | 集数   | 标题                                                         |
| -------- | -------- | ---- | ------ | ------------------------------------------------------------ |
| 非生物因素 | 7/23/2025 | 06:42:38 | Part 1 | [【剩饭录播】 2025-07-23 非生物因素](https://www.bilibili.com/video/av114902807085128/) |
| 非生物因素 | 7/24/2025 | 04:31:44 | Part 2 | [【剩饭录播】 2025-07-24 非生物因素](https://www.bilibili.com/video/av114908427453772/) |
| 非生物因素 | 7/25/2025 | 03:00:04 | Part 3 | [【剩饭录播】 2025-07-25 非生物因素（不全）](https://www.bilibili.com/video/av114914114931386/) |

## 机械战警

| 游戏名称 | 直播日期 | 时长 | 集数   | 标题                                                         |
| -------- | -------- | ---- | ------ | ------------------------------------------------------------ |
| 机械战警 | 7/18/2025 | 06:08:24 | Part 1 | [【剩饭录播】 2025-07-18 机械战警 + 魔卡学园](https://www.bilibili.com/video/av114874202004865/) |
| 机械战警 | 7/21/2025 | 04:39:52 | Part 2 | [【剩饭录播】 2025-07-21 机械战警](https://www.bilibili.com/video/av114891365028594/) |

## 魔卡学园

| 游戏名称 | 直播日期 | 时长 | 集数   | 标题                                                         |
| -------- | -------- | ---- | ------ | ------------------------------------------------------------ |
| 魔卡学园 | 7/18/2025 | 06:08:24 | Part 1 | [【剩饭录播】 2025-07-18 机械战警 + 魔卡学园](https://www.bilibili.com/video/av114874202004865/) |

## 环世界rimworld

| 游戏名称 | 直播日期 | 时长 | 集数   | 标题                                                         |
| -------- | -------- | ---- | ------ | ------------------------------------------------------------ |
| 环世界rimworld | 7/16/2025 | 07:00:52 | Part 1 | [【剩饭录播】 2025-07-16 环世界rimworld](https://www.bilibili.com/video/av114863179369540/) |

## 死亡搁浅2

| 游戏名称 | 直播日期 | 时长 | 集数   | 标题                                                         |
| -------- | -------- | ---- | ------ | ------------------------------------------------------------ |
| 死亡搁浅2 | 6/24/2025 | 12:02:31 | Part 1 | [【剩饭录播】 2025-06-24 死亡搁浅2](https://www.bilibili.com/video/av114734028297574/) |
| 死亡搁浅2 | 6/24/2025 | 09:00:07 | Part 2 | [【剩饭录播】 2025-06-24 死亡搁浅2——已爆炸](https://www.bilibili.com/video/av114739111794386/) |
| 死亡搁浅2 | 6/25/2025 | 04:00:02 | Part 3 | [【剩饭录播】 2025-06-25 死亡搁浅2——已爆炸](https://www.bilibili.com/video/av114744581227683/) |
| 死亡搁浅2 | 6/27/2025 | 07:15:16 | Part 4 | [【剩饭录播】 2025-06-27 死亡搁浅2](https://www.bilibili.com/video/av114753103994808/) |

## PEAK

| 游戏名称 | 直播日期 | 时长 | 集数   | 标题                                                         |
| -------- | -------- | ---- | ------ | ------------------------------------------------------------ |
| PEAK | 6/22/2025 | 04:14:40 | Part 1 | [【剩饭录播】 2025-06-22 PEAK + 看b站](https://www.bilibili.com/video/av114727418138475/) |

## 战锤40K：暗潮

| 游戏名称 | 直播日期 | 时长 | 集数   | 标题                                                         |
| -------- | -------- | ---- | ------ | ------------------------------------------------------------ |
| 战锤40K：暗潮 | 6/18/2025 | 04:47:29 | Part 1 | [【剩饭录播】 2025-06-18 战锤40K：暗潮](https://www.bilibili.com/video/av114704768835388/) |

## 艾尔登法环

| 游戏名称 | 直播日期 | 时长 | 集数   | 标题                                                         |
| -------- | -------- | ---- | ------ | ------------------------------------------------------------ |
| 艾尔登法环 | 6/25/2024 | 07:28:12 | Part 1 | [【剩饭录播】 2024-06-25 觉醒深渊 +艾尔登法环dlc](https://www.bilibili.com/video/av1355810374/) |
| 艾尔登法环 | 6/27/2024 | 07:48:56 | Part 2 | [【剩饭录播】 2024-06-27 艾尔登法环dlc](https://www.bilibili.com/video/av1605965652/) |
| 艾尔登法环 | 6/28/2024 | 05:58:26 | Part 3 | [【剩饭录播】 2024-06-28 艾尔登法环dlc](https://www.bilibili.com/video/av1705950689/) |
| 艾尔登法环 | 7/1/2024 | 02:01:21 | Part 4 | [【剩饭录播】 2024-07-01 残缺——联机艾尔登法环](https://www.bilibili.com/video/av1155771698/) |
| 艾尔登法环 | 7/6/2024 | 04:27:31 | Part 5 | [【剩饭录播】 2024-07-06 艾尔登法环](https://www.bilibili.com/video/av1206053031/) |
| 艾尔登法环 | 7/7/2024 | 03:39:36 | Part 6 | [【剩饭录播】 2024-07-07 联机艾尔登法环](https://www.bilibili.com/video/av1906082892/) |
| 艾尔登法环 | 7/15/2024 | 04:01:19 | Part 7 | [【剩饭录播】 2024-07-15 僵尸毁灭工程 + 联机艾尔登法环（缺21）](https://www.bilibili.com/video/av1256192907/) |
| 艾尔登法环 | 7/16/2024 | 04:27:26 | Part 8 | [【剩饭录播】 2024-07-16 联机艾尔登法环](https://www.bilibili.com/video/av1156152649/) |
| 艾尔登法环 | 5/30/2025 | 06:58:23 | Part 9 | [【剩饭录播】 2025-05-30 黑夜君临](https://www.bilibili.com/video/av114597059107996/) |
| 艾尔登法环 | 5/31/2025 | 07:00:07 | Part 10 | [【剩饭录播】 2025-05-31 黑夜君临](https://www.bilibili.com/video/av114602562027647/) |
| 艾尔登法环 | 6/1/2025 | 06:36:51 | Part 11 | [【剩饭录播】 2025-06-01 黑夜君临](https://www.bilibili.com/video/av114608283062522/) |
| 艾尔登法环 | 6/5/2025 | 04:27:03 | Part 12 | [【剩饭录播】 2025-06-05 黑夜君临](https://www.bilibili.com/video/av114631200739547/) |
| 艾尔登法环 | 6/6/2025 | 04:26:37 | Part 13 | [【剩饭录播】 2025-06-06 黑夜君临 + 看B站](https://www.bilibili.com/video/av114636888216835/) |
| 艾尔登法环 | 6/17/2025 | 05:01:33 | Part 14 | [【剩饭录播】 2025-06-17 黑夜君临](https://www.bilibili.com/video/av114698863252761/) |

## 多重人生

| 游戏名称 | 直播日期 | 时长 | 集数   | 标题                                                         |
| -------- | -------- | ---- | ------ | ------------------------------------------------------------ |
| 多重人生 | 6/15/2025 | 05:35:38 | Part 1 | [【剩饭录播】 2025-06-15 多重人生](https://www.bilibili.com/video/av114687454748355/) |

## 剑星

| 游戏名称 | 直播日期 | 时长 | 集数   | 标题                                                         |
| -------- | -------- | ---- | ------ | ------------------------------------------------------------ |
| 剑星 | 6/13/2025 | 05:13:25 | Part 1 | [【剩饭录播】 2025-06-13 剑星](https://www.bilibili.com/video/av114675962354962/) |

## 匹诺曹的谎言

| 游戏名称 | 直播日期 | 时长 | 集数   | 标题                                                         |
| -------- | -------- | ---- | ------ | ------------------------------------------------------------ |
| 匹诺曹的谎言 | 6/9/2025 | 04:36:11 | Part 1 | [【剩饭录播】 2025-06-09 匹诺曹的谎言 + XBOX游戏发布会](https://www.bilibili.com/video/av114648800039532/) |

## XBOX游戏发布会

| 游戏名称 | 直播日期 | 时长 | 集数   | 标题                                                         |
| -------- | -------- | ---- | ------ | ------------------------------------------------------------ |
| XBOX游戏发布会 | 6/9/2025 | 04:36:11 | Part 1 | [【剩饭录播】 2025-06-09 匹诺曹的谎言 + XBOX游戏发布会](https://www.bilibili.com/video/av114648800039532/) |

## 密特罗德：究极

| 游戏名称 | 直播日期 | 时长 | 集数   | 标题                                                         |
| -------- | -------- | ---- | ------ | ------------------------------------------------------------ |
| 密特罗德：究极 | 6/7/2025 | 03:53:43 | Part 1 | [【剩饭录播】 2025-06-07 密特罗德：究极 + 塞尔达传说：王国之泪](https://www.bilibili.com/video/av114642357589489/) |

## 塞尔达传说：王国之泪

| 游戏名称 | 直播日期 | 时长 | 集数   | 标题                                                         |
| -------- | -------- | ---- | ------ | ------------------------------------------------------------ |
| 塞尔达传说：王国之泪 | 6/7/2025 | 03:53:43 | Part 1 | [【剩饭录播】 2025-06-07 密特罗德：究极 + 塞尔达传说：王国之泪](https://www.bilibili.com/video/av114642357589489/) |

## 夏日游戏机节

| 游戏名称 | 直播日期 | 时长 | 集数   | 标题                                                         |
| -------- | -------- | ---- | ------ | ------------------------------------------------------------ |
| 夏日游戏机节 | 6/7/2025 | 02:19:46 | Part 1 | [【剩饭录播】 2025-06-07 看爽 + 夏日游戏机节](https://www.bilibili.com/video/av114638700156213/) |

## White Knuckle

| 游戏名称 | 直播日期 | 时长 | 集数   | 标题                                                         |
| -------- | -------- | ---- | ------ | ------------------------------------------------------------ |
| White Knuckle | 6/3/2025 | 06:09:23 | Part 1 | [【剩饭录播】 2025-06-03 White Knuckle + 泡姆泡姆](https://www.bilibili.com/video/av114619574127598/) |

## 泡姆泡姆

| 游戏名称 | 直播日期 | 时长 | 集数   | 标题                                                         |
| -------- | -------- | ---- | ------ | ------------------------------------------------------------ |
| 泡姆泡姆 | 10/16/2024 | 05:05:51 | Part 1 | [【剩饭录播】 2024-10-16 泡姆泡姆 + status one + 小游戏合集](https://www.bilibili.com/video/av113317326621388/) |
| 泡姆泡姆 | 6/2/2025 | 04:55:47 | Part 2 | [【剩饭录播】 2025-06-02 泡姆泡姆](https://www.bilibili.com/video/av114614155085184/) |
| 泡姆泡姆 | 6/3/2025 | 06:09:23 | Part 3 | [【剩饭录播】 2025-06-03 White Knuckle + 泡姆泡姆](https://www.bilibili.com/video/av114619574127598/) |

## 幻想生活i：转圈圈的龙与偷取时间的少女

| 游戏名称 | 直播日期 | 时长 | 集数   | 标题                                                         |
| -------- | -------- | ---- | ------ | ------------------------------------------------------------ |
| 幻想生活i：转圈圈的龙与偷取时间的少女 | 5/21/2025 | 04:00:04 | Part 1 | [【剩饭录播】 2025-05-21 幻想生活i + RoadCraft（已爆炸）](https://www.bilibili.com/video/av114545855041728/) |
| 幻想生活i：转圈圈的龙与偷取时间的少女 | 5/23/2025 | 05:07:06 | Part 2 | [【剩饭录播】 2025-05-23 幻想生活i + 脱狱潜龙：惩罚 + 天诛千乱](https://www.bilibili.com/video/av114557364209362/) |

## 脱狱潜龙：惩罚

| 游戏名称 | 直播日期 | 时长 | 集数   | 标题                                                         |
| -------- | -------- | ---- | ------ | ------------------------------------------------------------ |
| 脱狱潜龙：惩罚 | 5/23/2025 | 05:07:06 | Part 1 | [【剩饭录播】 2025-05-23 幻想生活i + 脱狱潜龙：惩罚 + 天诛千乱](https://www.bilibili.com/video/av114557364209362/) |

## 天诛千乱

| 游戏名称 | 直播日期 | 时长 | 集数   | 标题                                                         |
| -------- | -------- | ---- | ------ | ------------------------------------------------------------ |
| 天诛千乱 | 5/23/2025 | 05:07:06 | Part 1 | [【剩饭录播】 2025-05-23 幻想生活i + 脱狱潜龙：惩罚 + 天诛千乱](https://www.bilibili.com/video/av114557364209362/) |

## RoadCraft

| 游戏名称 | 直播日期 | 时长 | 集数   | 标题                                                         |
| -------- | -------- | ---- | ------ | ------------------------------------------------------------ |
| RoadCraft | 2/25/2025 | 04:52:01 | Part 1 | [【剩饭录播】 2025-02-25 RoadCraft + 风暴崛起](https://www.bilibili.com/video/av114064583822252/) |
| RoadCraft | 5/21/2025 | 04:00:04 | Part 2 | [【剩饭录播】 2025-05-21 幻想生活i + RoadCraft（已爆炸）](https://www.bilibili.com/video/av114545855041728/) |
| RoadCraft | 5/22/2025 | 04:41:33 | Part 3 | [【剩饭录播】 2025-05-22 RoadCraft](https://www.bilibili.com/video/av114551827729614/) |

## 绝地潜兵2

| 游戏名称 | 直播日期 | 时长 | 集数   | 标题                                                         |
| -------- | -------- | ---- | ------ | ------------------------------------------------------------ |
| 绝地潜兵2 | 2/1/2025 | 04:29:06 | Part 1 | [【剩饭录播】 2025-02-01 绝地潜兵2](https://www.bilibili.com/video/av113928654817865/) |
| 绝地潜兵2 | 2/3/2025 | 05:57:16 | Part 2 | [【剩饭录播】 2025-02-03 绝地潜兵2](https://www.bilibili.com/video/av113939711006463/) |
| 绝地潜兵2 | 2/5/2025 | 06:01:06 | Part 3 | [【剩饭录播】 2025-02-05 绝地潜兵2 + 天国拯救2](https://www.bilibili.com/video/av113946556109720/) |
| 绝地潜兵2 | 3/14/2025 | 04:56:37 | Part 4 | [【剩饭录播】 2025-03-14 绝地潜兵2 + 命令与征服 心灵终结](https://www.bilibili.com/video/av114161489020191/) |
| 绝地潜兵2 | 5/4/2025 | 05:41:04 | Part 5 | [【剩饭录播】 2025-05-04 绝地潜兵2 + 虐杀熔炉](https://www.bilibili.com/video/av114449637705961/) |
| 绝地潜兵2 | 5/19/2025 | 03:22:50 | Part 6 | [【剩饭录播】 2025-05-19 迸发2 + 绝地潜兵2](https://www.bilibili.com/video/av114534899519501/) |
| 绝地潜兵2 | 5/20/2025 | 06:40:11 | Part 7 | [【剩饭录播】 2025-05-20 绝地潜兵2](https://www.bilibili.com/video/av114539832088146/) |

## 迸发2

| 游戏名称 | 直播日期 | 时长 | 集数   | 标题                                                         |
| -------- | -------- | ---- | ------ | ------------------------------------------------------------ |
| 迸发2 | 5/19/2025 | 03:22:50 | Part 1 | [【剩饭录播】 2025-05-19 迸发2 + 绝地潜兵2](https://www.bilibili.com/video/av114534899519501/) |

## 皇牌空战6

| 游戏名称 | 直播日期 | 时长 | 集数   | 标题                                                         |
| -------- | -------- | ---- | ------ | ------------------------------------------------------------ |
| 皇牌空战6 | 5/17/2025 | 05:40:02 | Part 1 | [【剩饭录播】 2025-05-17 皇牌空战6 + ACVD + 闲聊](https://www.bilibili.com/video/av114523340013936/) |

## ACVD

| 游戏名称 | 直播日期 | 时长 | 集数   | 标题                                                         |
| -------- | -------- | ---- | ------ | ------------------------------------------------------------ |
| ACVD | 5/17/2025 | 05:40:02 | Part 1 | [【剩饭录播】 2025-05-17 皇牌空战6 + ACVD + 闲聊](https://www.bilibili.com/video/av114523340013936/) |

## 闲聊

| 游戏名称 | 直播日期 | 时长 | 集数   | 标题                                                         |
| -------- | -------- | ---- | ------ | ------------------------------------------------------------ |
| 闲聊 | 1/12/2025 | 06:14:55 | Part 1 | [【剩饭录播】 2025-01-12 拼乐高 + 闲聊](https://www.bilibili.com/video/av113815643490365/) |
| 闲聊 | 1/14/2025 | 04:20:25 | Part 2 | [【剩饭录播】 2025-01-14 拼乐高 + 闲聊](https://www.bilibili.com/video/av113822052387120/) |
| 闲聊 | 1/30/2025 | 05:34:25 | Part 3 | [【剩饭录播】 2025-01-30 原子之心 + 闲聊](https://www.bilibili.com/video/av113916759775021/) |
| 闲聊 | 5/17/2025 | 05:40:02 | Part 4 | [【剩饭录播】 2025-05-17 皇牌空战6 + ACVD + 闲聊](https://www.bilibili.com/video/av114523340013936/) |

## 毁灭战士：黑暗时代

| 游戏名称 | 直播日期 | 时长 | 集数   | 标题                                                         |
| -------- | -------- | ---- | ------ | ------------------------------------------------------------ |
| 毁灭战士：黑暗时代 | 5/13/2025 | 11:18:27 | Part 1 | [【剩饭录播】 2025-05-13 毁灭战士：黑暗时代](https://www.bilibili.com/video/av114498123861509/) |
| 毁灭战士：黑暗时代 | 5/14/2025 | 05:46:01 | Part 2 | [【剩饭录播】 2025-05-14 毁灭战士：黑暗时代](https://www.bilibili.com/video/av114506311142035/) |
| 毁灭战士：黑暗时代 | 5/15/2025 | 03:54:13 | Part 3 | [【剩饭录播】 2025-05-15 毁灭战士：黑暗时代 + cubic odyssey](https://www.bilibili.com/video/av114511965130521/) |

## cubic odyssey

| 游戏名称 | 直播日期 | 时长 | 集数   | 标题                                                         |
| -------- | -------- | ---- | ------ | ------------------------------------------------------------ |
| cubic odyssey | 5/15/2025 | 03:54:13 | Part 1 | [【剩饭录播】 2025-05-15 毁灭战士：黑暗时代 + cubic odyssey](https://www.bilibili.com/video/av114511965130521/) |

## 黑暗之魂

| 游戏名称 | 直播日期 | 时长 | 集数   | 标题                                                         |
| -------- | -------- | ---- | ------ | ------------------------------------------------------------ |
| 黑暗之魂 | 4/20/2025 | 03:19:20 | Part 1 | [【剩饭录播】 2025-04-20 联机黑暗之魂](https://www.bilibili.com/video/av114370902231380/) |
| 黑暗之魂 | 4/21/2025 | 05:14:57 | Part 2 | [【剩饭录播】 2025-04-21 联机黑暗之魂](https://www.bilibili.com/video/av114376103233568/) |
| 黑暗之魂 | 4/23/2025 | 05:28:05 | Part 3 | [【剩饭录播】 2025-04-23 联机黑暗之魂](https://www.bilibili.com/video/av114387562009894/) |
| 黑暗之魂 | 4/28/2025 | 03:29:25 | Part 4 | [【剩饭录播】 2025-04-28 联机黑暗之魂](https://www.bilibili.com/video/av114415848456301/) |
| 黑暗之魂 | 5/8/2025 | 04:57:12 | Part 5 | [【剩饭录播】 2025-05-08 联机黑暗之魂](https://www.bilibili.com/video/av114472622558098/) |

## 异星探险家

| 游戏名称 | 直播日期 | 时长 | 集数   | 标题                                                         |
| -------- | -------- | ---- | ------ | ------------------------------------------------------------ |
| 异星探险家 | 4/29/2025 | 05:04:40 | Part 1 | [【剩饭录播】 2025-04-29 异星探险家](https://www.bilibili.com/video/av114421385010129/) |

## 看獭耳迸发

| 游戏名称 | 直播日期 | 时长 | 集数   | 标题                                                         |
| -------- | -------- | ---- | ------ | ------------------------------------------------------------ |
| 看獭耳迸发 | 4/27/2025 | 04:51:33 | Part 1 | [【剩饭录播】 2025-04-27 看獭耳迸发 + 迸发](https://www.bilibili.com/video/av114410194473210/) |

## 迸发

| 游戏名称 | 直播日期 | 时长 | 集数   | 标题                                                         |
| -------- | -------- | ---- | ------ | ------------------------------------------------------------ |
| 迸发 | 4/27/2025 | 04:51:33 | Part 1 | [【剩饭录播】 2025-04-27 看獭耳迸发 + 迸发](https://www.bilibili.com/video/av114410194473210/) |

## 破碎族裔

| 游戏名称 | 直播日期 | 时长 | 集数   | 标题                                                         |
| -------- | -------- | ---- | ------ | ------------------------------------------------------------ |
| 破碎族裔 | 4/26/2025 | 05:05:34 | Part 1 | [【剩饭录播】 2025-04-26 破碎族裔 + world of goo 2](https://www.bilibili.com/video/av114404473442837/) |

## world of goo 2

| 游戏名称 | 直播日期 | 时长 | 集数   | 标题                                                         |
| -------- | -------- | ---- | ------ | ------------------------------------------------------------ |
| world of goo 2 | 4/26/2025 | 05:05:34 | Part 1 | [【剩饭录播】 2025-04-26 破碎族裔 + world of goo 2](https://www.bilibili.com/video/av114404473442837/) |

## 风暴崛起

| 游戏名称 | 直播日期 | 时长 | 集数   | 标题                                                         |
| -------- | -------- | ---- | ------ | ------------------------------------------------------------ |
| 风暴崛起 | 2/25/2025 | 04:52:01 | Part 1 | [【剩饭录播】 2025-02-25 RoadCraft + 风暴崛起](https://www.bilibili.com/video/av114064583822252/) |
| 风暴崛起 | 4/17/2025 | 06:09:02 | Part 2 | [【剩饭录播】 2025-04-17 孤岛惊魂3 + 风暴崛起](https://www.bilibili.com/video/av114353437151845/) |
| 风暴崛起 | 4/25/2025 | 04:43:29 | Part 3 | [【剩饭录播】 2025-04-25 风暴崛起](https://www.bilibili.com/video/av114399037624943/) |

## 孤岛惊魂3

| 游戏名称 | 直播日期 | 时长 | 集数   | 标题                                                         |
| -------- | -------- | ---- | ------ | ------------------------------------------------------------ |
| 孤岛惊魂3 | 4/12/2025 | 05:35:25 | Part 1 | [【剩饭录播】 2025-04-12 盟军敢死队：起源 + 黑暗世界：因与果 + 孤岛惊魂3](https://www.bilibili.com/video/av114325352159419/) |
| 孤岛惊魂3 | 4/17/2025 | 06:09:02 | Part 2 | [【剩饭录播】 2025-04-17 孤岛惊魂3 + 风暴崛起](https://www.bilibili.com/video/av114353437151845/) |

## 星际战士2

| 游戏名称 | 直播日期 | 时长 | 集数   | 标题                                                         |
| -------- | -------- | ---- | ------ | ------------------------------------------------------------ |
| 星际战士2 | 9/5/2024 | 13:57:15 | Part 1 | [【剩饭录播】 2024-09-05 僵尸毁灭工程 + 星际战士2](https://www.bilibili.com/video/av113085432071269/) |
| 星际战士2 | 9/6/2024 | 08:03:50 | Part 2 | [【剩饭录播】 2024-09-06 星际战士2](https://www.bilibili.com/video/av113090666431775/) |
| 星际战士2 | 9/7/2024 | 06:27:51 | Part 3 | [【剩饭录播】 2024-09-07 星际战士2 + 神话时代 重述版](https://www.bilibili.com/video/av113096404304480/) |
| 星际战士2 | 12/29/2024 | 08:44:47 | Part 4 | [【剩饭录播】 2024-12-29 星际战士2 + 看爽天国拯救](https://www.bilibili.com/video/av113736236995356/) |
| 星际战士2 | 12/31/2024 | 07:19:28 | Part 5 | [【剩饭录播】 2024-12-31 星际战士2](https://www.bilibili.com/video/av113747729323214/) |
| 星际战士2 | 2/24/2025 | 07:49:01 | Part 6 | [【剩饭录播】 2025-02-24 星际战士2 + 天国拯救](https://www.bilibili.com/video/av114058980298697/) |
| 星际战士2 | 4/15/2025 | 06:48:14 | Part 7 | [【剩饭录播】 2025-04-15 星际战士2 + 永恒天空 + 天国拯救2](https://www.bilibili.com/video/av114342330703739/) |

## 永恒天空

| 游戏名称 | 直播日期 | 时长 | 集数   | 标题                                                         |
| -------- | -------- | ---- | ------ | ------------------------------------------------------------ |
| 永恒天空 | 2/28/2025 | 06:04:55 | Part 1 | [【剩饭录播】 2025-02-28 永恒天空](https://www.bilibili.com/video/av114081545592277/) |
| 永恒天空 | 3/1/2025 | 05:21:29 | Part 2 | [【剩饭录播】 2025-03-01 永恒天空 + 怪物猎人：荒野](https://www.bilibili.com/video/av114087283465622/) |
| 永恒天空 | 3/3/2025 | 04:20:43 | Part 3 | [【剩饭录播】 2025-03-03 永恒天空 + 命令与征服：变节者](https://www.bilibili.com/video/av114098675129808/) |
| 永恒天空 | 4/15/2025 | 06:48:14 | Part 4 | [【剩饭录播】 2025-04-15 星际战士2 + 永恒天空 + 天国拯救2](https://www.bilibili.com/video/av114342330703739/) |

## 天国拯救2

| 游戏名称 | 直播日期 | 时长 | 集数   | 标题                                                         |
| -------- | -------- | ---- | ------ | ------------------------------------------------------------ |
| 天国拯救2 | 2/5/2025 | 06:01:06 | Part 1 | [【剩饭录播】 2025-02-05 绝地潜兵2 + 天国拯救2](https://www.bilibili.com/video/av113946556109720/) |
| 天国拯救2 | 2/6/2025 | 10:01:29 | Part 2 | [【剩饭录播】 2025-02-06 天国拯救2](https://www.bilibili.com/video/av113956437954388/) |
| 天国拯救2 | 2/7/2025 | 13:54:04 | Part 3 | [【剩饭录播】 2025-02-07 天国拯救2](https://www.bilibili.com/video/av113962662234857/) |
| 天国拯救2 | 2/8/2025 | 09:47:05 | Part 4 | [【剩饭录播】 2025-02-08 天国拯救2](https://www.bilibili.com/video/av113968332936965/) |
| 天国拯救2 | 2/9/2025 | 06:32:12 | Part 5 | [【剩饭录播】 2025-02-09 掘地求财 + 天国拯救2](https://www.bilibili.com/video/av113973751975728/) |
| 天国拯救2 | 2/10/2025 | 07:46:00 | Part 6 | [【剩饭录播】 2025-02-10 天国拯救2](https://www.bilibili.com/video/av113979288458092/) |
| 天国拯救2 | 2/11/2025 | 12:22:26 | Part 7 | [【剩饭录播】 2025-02-11 天国拯救2](https://www.bilibili.com/video/av113985227654044/) |
| 天国拯救2 | 2/12/2025 | 08:57:14 | Part 8 | [【剩饭录播】 2025-02-12 天国拯救2](https://www.bilibili.com/video/av113990948618606/) |
| 天国拯救2 | 4/15/2025 | 06:48:14 | Part 9 | [【剩饭录播】 2025-04-15 星际战士2 + 永恒天空 + 天国拯救2](https://www.bilibili.com/video/av114342330703739/) |

## 盟军敢死队：起源

| 游戏名称 | 直播日期 | 时长 | 集数   | 标题                                                         |
| -------- | -------- | ---- | ------ | ------------------------------------------------------------ |
| 盟军敢死队：起源 | 4/10/2025 | 04:37:43 | Part 1 | [【剩饭录播】 2025-04-10 盟军敢死队：起源 + 看视频 + spilled!](https://www.bilibili.com/video/av114314195241828/) |
| 盟军敢死队：起源 | 4/12/2025 | 05:35:25 | Part 2 | [【剩饭录播】 2025-04-12 盟军敢死队：起源 + 黑暗世界：因与果 + 孤岛惊魂3](https://www.bilibili.com/video/av114325352159419/) |

## 黑暗世界：因与果

| 游戏名称 | 直播日期 | 时长 | 集数   | 标题                                                         |
| -------- | -------- | ---- | ------ | ------------------------------------------------------------ |
| 黑暗世界：因与果 | 3/28/2025 | 06:41:47 | Part 1 | [【剩饭录播】 2025-03-28 刺客信条：影 + 原子陨落 + 黑暗世界：因与果](https://www.bilibili.com/video/av114238647440316/) |
| 黑暗世界：因与果 | 4/12/2025 | 05:35:25 | Part 2 | [【剩饭录播】 2025-04-12 盟军敢死队：起源 + 黑暗世界：因与果 + 孤岛惊魂3](https://www.bilibili.com/video/av114325352159419/) |

## 看视频

| 游戏名称 | 直播日期 | 时长 | 集数   | 标题                                                         |
| -------- | -------- | ---- | ------ | ------------------------------------------------------------ |
| 看视频 | 4/10/2025 | 04:37:43 | Part 1 | [【剩饭录播】 2025-04-10 盟军敢死队：起源 + 看视频 + spilled!](https://www.bilibili.com/video/av114314195241828/) |

## spilled!

| 游戏名称 | 直播日期 | 时长 | 集数   | 标题                                                         |
| -------- | -------- | ---- | ------ | ------------------------------------------------------------ |
| spilled! | 4/10/2025 | 04:37:43 | Part 1 | [【剩饭录播】 2025-04-10 盟军敢死队：起源 + 看视频 + spilled!](https://www.bilibili.com/video/av114314195241828/) |

## 合金装备5幻痛

| 游戏名称 | 直播日期 | 时长 | 集数   | 标题                                                         |
| -------- | -------- | ---- | ------ | ------------------------------------------------------------ |
| 合金装备5幻痛 | 4/9/2025 | 04:14:20 | Part 1 | [【剩饭录播】 2025-04-09 合金装备5幻痛](https://www.bilibili.com/video/av114308289663510/) |

## 测试电脑

| 游戏名称 | 直播日期 | 时长 | 集数   | 标题                                                         |
| -------- | -------- | ---- | ------ | ------------------------------------------------------------ |
| 测试电脑 | 4/6/2025 | 07:50:46 | Part 1 | [【剩饭录播】 2025-04-06 测试电脑 + 生化奇兵2重制版 + 无限机兵](https://www.bilibili.com/video/av114289750840669/) |

## 生化奇兵2重制版

| 游戏名称 | 直播日期 | 时长 | 集数   | 标题                                                         |
| -------- | -------- | ---- | ------ | ------------------------------------------------------------ |
| 生化奇兵2重制版 | 4/6/2025 | 07:50:46 | Part 1 | [【剩饭录播】 2025-04-06 测试电脑 + 生化奇兵2重制版 + 无限机兵](https://www.bilibili.com/video/av114289750840669/) |

## 无限机兵

| 游戏名称 | 直播日期 | 时长 | 集数   | 标题                                                         |
| -------- | -------- | ---- | ------ | ------------------------------------------------------------ |
| 无限机兵 | 4/6/2025 | 07:50:46 | Part 1 | [【剩饭录播】 2025-04-06 测试电脑 + 生化奇兵2重制版 + 无限机兵](https://www.bilibili.com/video/av114289750840669/) |

## 装机

| 游戏名称 | 直播日期 | 时长 | 集数   | 标题                                                         |
| -------- | -------- | ---- | ------ | ------------------------------------------------------------ |
| 装机 | 4/2/2025 | 05:52:47 | Part 1 | [【剩饭录播】 2025-04-02 装机 + 深海迷航 + 看b站 + 任天堂直面会](https://www.bilibili.com/video/av114267856636226/) |

## 深海迷航

| 游戏名称 | 直播日期 | 时长 | 集数   | 标题                                                         |
| -------- | -------- | ---- | ------ | ------------------------------------------------------------ |
| 深海迷航 | 3/12/2025 | 09:36:08 | Part 1 | [【剩饭录播】 2025-03-12 深海迷航](https://www.bilibili.com/video/av114149929521857/) |
| 深海迷航 | 3/15/2025 | 07:58:11 | Part 2 | [【剩饭录播】 2025-03-15 小游戏合集 + 深海迷航](https://www.bilibili.com/video/av114167092677285/) |
| 深海迷航 | 3/16/2025 | 11:35:13 | Part 3 | [【剩饭录播】 2025-03-16 深海迷航](https://www.bilibili.com/video/av114172360658735/) |
| 深海迷航 | 4/2/2025 | 05:52:47 | Part 4 | [【剩饭录播】 2025-04-02 装机 + 深海迷航 + 看b站 + 任天堂直面会](https://www.bilibili.com/video/av114267856636226/) |

## 任天堂直面会

| 游戏名称 | 直播日期 | 时长 | 集数   | 标题                                                         |
| -------- | -------- | ---- | ------ | ------------------------------------------------------------ |
| 任天堂直面会 | 4/2/2025 | 05:52:47 | Part 1 | [【剩饭录播】 2025-04-02 装机 + 深海迷航 + 看b站 + 任天堂直面会](https://www.bilibili.com/video/av114267856636226/) |

## 刺客信条：影

| 游戏名称 | 直播日期 | 时长 | 集数   | 标题                                                         |
| -------- | -------- | ---- | ------ | ------------------------------------------------------------ |
| 刺客信条：影 | 3/20/2025 | 09:59:59 | Part 1 | [【剩饭录播】 2025-03-20 刺客信条：影](https://www.bilibili.com/video/av114192795304965/) |
| 刺客信条：影 | 3/21/2025 | 09:34:07 | Part 2 | [【剩饭录播】 2025-03-21 刺客信条：影](https://www.bilibili.com/video/av114201318133616/) |
| 刺客信条：影 | 3/23/2025 | 06:51:00 | Part 3 | [【剩饭录播】 2025-03-23 刺客信条：影](https://www.bilibili.com/video/av114208263904955/) |
| 刺客信条：影 | 3/23/2025 | 01:52:42 | Part 4 | [【剩饭录播】 2025-03-23 刺客信条：影](https://www.bilibili.com/video/av114211032205966/) |
| 刺客信条：影 | 3/24/2025 | 08:40:46 | Part 5 | [【剩饭录播】 2025-03-24 刺客信条：影](https://www.bilibili.com/video/av114215025119057/) |
| 刺客信条：影 | 3/25/2025 | 05:52:22 | Part 6 | [【剩饭录播】 2025-03-25 刺客信条：影](https://www.bilibili.com/video/av114221568236418/) |
| 刺客信条：影 | 3/27/2025 | 04:50:12 | Part 7 | [【剩饭录播】 2025-03-27 刺客信条：影 + 潜渊症 + 任天堂Switch2直面会](https://www.bilibili.com/video/av114234033708938/) |
| 刺客信条：影 | 3/28/2025 | 06:41:47 | Part 8 | [【剩饭录播】 2025-03-28 刺客信条：影 + 原子陨落 + 黑暗世界：因与果](https://www.bilibili.com/video/av114238647440316/) |

## 原子陨落

| 游戏名称 | 直播日期 | 时长 | 集数   | 标题                                                         |
| -------- | -------- | ---- | ------ | ------------------------------------------------------------ |
| 原子陨落 | 3/28/2025 | 06:41:47 | Part 1 | [【剩饭录播】 2025-03-28 刺客信条：影 + 原子陨落 + 黑暗世界：因与果](https://www.bilibili.com/video/av114238647440316/) |

## 潜渊症

| 游戏名称 | 直播日期 | 时长 | 集数   | 标题                                                         |
| -------- | -------- | ---- | ------ | ------------------------------------------------------------ |
| 潜渊症 | 3/27/2025 | 04:50:12 | Part 1 | [【剩饭录播】 2025-03-27 刺客信条：影 + 潜渊症 + 任天堂Switch2直面会](https://www.bilibili.com/video/av114234033708938/) |

## 任天堂Switch2直面会

| 游戏名称 | 直播日期 | 时长 | 集数   | 标题                                                         |
| -------- | -------- | ---- | ------ | ------------------------------------------------------------ |
| 任天堂Switch2直面会 | 3/27/2025 | 04:50:12 | Part 1 | [【剩饭录播】 2025-03-27 刺客信条：影 + 潜渊症 + 任天堂Switch2直面会](https://www.bilibili.com/video/av114234033708938/) |

## 小游戏合集

| 游戏名称 | 直播日期 | 时长 | 集数   | 标题                                                         |
| -------- | -------- | ---- | ------ | ------------------------------------------------------------ |
| 小游戏合集 | 10/16/2024 | 05:05:51 | Part 1 | [【剩饭录播】 2024-10-16 泡姆泡姆 + status one + 小游戏合集](https://www.bilibili.com/video/av113317326621388/) |
| 小游戏合集 | 2/26/2025 | 04:37:34 | Part 2 | [【剩饭录播】 2025-02-26 小游戏合集](https://www.bilibili.com/video/av114070355184376/) |
| 小游戏合集 | 2/27/2025 | 05:45:00 | Part 3 | [【剩饭录播】 2025-02-27 小游戏合集](https://www.bilibili.com/video/av114075942002555/) |
| 小游戏合集 | 3/15/2025 | 07:58:11 | Part 4 | [【剩饭录播】 2025-03-15 小游戏合集 + 深海迷航](https://www.bilibili.com/video/av114167092677285/) |

## 命令与征服 心灵终结

| 游戏名称 | 直播日期 | 时长 | 集数   | 标题                                                         |
| -------- | -------- | ---- | ------ | ------------------------------------------------------------ |
| 命令与征服 心灵终结 | 3/14/2025 | 04:56:37 | Part 1 | [【剩饭录播】 2025-03-14 绝地潜兵2 + 命令与征服 心灵终结](https://www.bilibili.com/video/av114161489020191/) |

## 地狱潜兵2

| 游戏名称 | 直播日期 | 时长 | 集数   | 标题                                                         |
| -------- | -------- | ---- | ------ | ------------------------------------------------------------ |
| 地狱潜兵2 | 3/11/2025 | 04:36:40 | Part 1 | [【剩饭录播】 2025-03-11 地狱潜兵2](https://www.bilibili.com/video/av114144426596200/) |

## Trailmakers

| 游戏名称 | 直播日期 | 时长 | 集数   | 标题                                                         |
| -------- | -------- | ---- | ------ | ------------------------------------------------------------ |
| Trailmakers | 3/10/2025 | 08:15:16 | Part 1 | [【剩饭录播】 2025-03-10 Trailmakers](https://www.bilibili.com/video/av114133622070275/) |

## 双影奇境

| 游戏名称 | 直播日期 | 时长 | 集数   | 标题                                                         |
| -------- | -------- | ---- | ------ | ------------------------------------------------------------ |
| 双影奇境 | 3/7/2025 | 06:00:06 | Part 1 | [【剩饭录播】 2025-03-07 双影奇境](https://www.bilibili.com/video/av114121559246508/) |

## 命令与征服：变节者

| 游戏名称 | 直播日期 | 时长 | 集数   | 标题                                                         |
| -------- | -------- | ---- | ------ | ------------------------------------------------------------ |
| 命令与征服：变节者 | 3/3/2025 | 04:20:43 | Part 1 | [【剩饭录播】 2025-03-03 永恒天空 + 命令与征服：变节者](https://www.bilibili.com/video/av114098675129808/) |

## 怪物猎人：荒野

| 游戏名称 | 直播日期 | 时长 | 集数   | 标题                                                         |
| -------- | -------- | ---- | ------ | ------------------------------------------------------------ |
| 怪物猎人：荒野 | 11/1/2024 | 04:52:56 | Part 1 | [【剩饭录播】 2024-11-01 怪物猎人：荒野 + 龙腾世纪](https://www.bilibili.com/video/av113408007472504/) |
| 怪物猎人：荒野 | 3/1/2025 | 05:21:29 | Part 2 | [【剩饭录播】 2025-03-01 永恒天空 + 怪物猎人：荒野](https://www.bilibili.com/video/av114087283465622/) |

## 天国拯救

| 游戏名称 | 直播日期 | 时长 | 集数   | 标题                                                         |
| -------- | -------- | ---- | ------ | ------------------------------------------------------------ |
| 天国拯救 | 2/24/2025 | 07:49:01 | Part 1 | [【剩饭录播】 2025-02-24 星际战士2 + 天国拯救](https://www.bilibili.com/video/av114058980298697/) |

## 合金装备崛起：复仇

| 游戏名称 | 直播日期 | 时长 | 集数   | 标题                                                         |
| -------- | -------- | ---- | ------ | ------------------------------------------------------------ |
| 合金装备崛起：复仇 | 2/21/2025 | 06:28:22 | Part 1 | [【剩饭录播】 2025-02-21 蚁托邦 + 三角洲 + 合金装备崛起：复仇](https://www.bilibili.com/video/av114041984979661/) |
| 合金装备崛起：复仇 | 2/22/2025 | 05:37:09 | Part 2 | [【剩饭录播】 2025-02-22 合金装备崛起：复仇](https://www.bilibili.com/video/av114047622121096/) |

## 蚁托邦

| 游戏名称 | 直播日期 | 时长 | 集数   | 标题                                                         |
| -------- | -------- | ---- | ------ | ------------------------------------------------------------ |
| 蚁托邦 | 2/21/2025 | 06:28:22 | Part 1 | [【剩饭录播】 2025-02-21 蚁托邦 + 三角洲 + 合金装备崛起：复仇](https://www.bilibili.com/video/av114041984979661/) |

## 三角洲行动

| 游戏名称 | 直播日期 | 时长 | 集数   | 标题                                                         |
| -------- | -------- | ---- | ------ | ------------------------------------------------------------ |
| 三角洲行动 | 9/26/2024 | 04:29:29 | Part 1 | [【剩饭录播】 2024-09-26 三角洲行动](https://www.bilibili.com/video/av113203929614535/) |
| 三角洲行动 | 9/28/2024 | 04:06:37 | Part 2 | [【剩饭录播】 2024-09-28 三角洲行动](https://www.bilibili.com/video/av113215287660534/) |
| 三角洲行动 | 2/21/2025 | 06:28:22 | Part 3 | [【剩饭录播】 2025-02-21 蚁托邦 + 三角洲 + 合金装备崛起：复仇](https://www.bilibili.com/video/av114041984979661/) |

## avowed

| 游戏名称 | 直播日期 | 时长 | 集数   | 标题                                                         |
| -------- | -------- | ---- | ------ | ------------------------------------------------------------ |
| avowed | 2/17/2025 | 04:26:07 | Part 1 | [【剩饭录播】 2025-02-17 avowed](https://www.bilibili.com/video/av114019402777089/) |

## 掘地求财

| 游戏名称 | 直播日期 | 时长 | 集数   | 标题                                                         |
| -------- | -------- | ---- | ------ | ------------------------------------------------------------ |
| 掘地求财 | 2/9/2025 | 06:32:12 | Part 1 | [【剩饭录播】 2025-02-09 掘地求财 + 天国拯救2](https://www.bilibili.com/video/av113973751975728/) |

## 原子之心

| 游戏名称 | 直播日期 | 时长 | 集数   | 标题                                                         |
| -------- | -------- | ---- | ------ | ------------------------------------------------------------ |
| 原子之心 | 1/30/2025 | 05:34:25 | Part 1 | [【剩饭录播】 2025-01-30 原子之心 + 闲聊](https://www.bilibili.com/video/av113916759775021/) |

## NINJA GAIDEN 2 Black

| 游戏名称 | 直播日期 | 时长 | 集数   | 标题                                                         |
| -------- | -------- | ---- | ------ | ------------------------------------------------------------ |
| NINJA GAIDEN 2 Black | 1/25/2025 | 05:46:52 | Part 1 | [【剩饭录播】 2025-01-25 NINJA GAIDEN 2 Black + 真三国无双起源 + nuclear nightmare](https://www.bilibili.com/video/av113888943145780/) |

## 真三国无双起源

| 游戏名称 | 直播日期 | 时长 | 集数   | 标题                                                         |
| -------- | -------- | ---- | ------ | ------------------------------------------------------------ |
| 真三国无双起源 | 1/14/2025 | 05:02:29 | Part 1 | [【剩饭录播】 2025-01-14 真三国无双起源](https://www.bilibili.com/video/av113827068840591/) |
| 真三国无双起源 | 1/15/2025 | 03:00:02 | Part 2 | [【剩饭录播】 2025-01-15 真三国无双起源（已爆炸）](https://www.bilibili.com/video/av113832454326350/) |
| 真三国无双起源 | 1/16/2025 | 05:33:21 | Part 3 | [【剩饭录播】 2025-01-16 真三国无双起源](https://www.bilibili.com/video/av113837588091541/) |
| 真三国无双起源 | 1/21/2025 | 05:55:52 | Part 4 | [【剩饭录播】 2025-01-21  真三国无双起源 + 明日方舟终末地](https://www.bilibili.com/video/av113867485086080/) |
| 真三国无双起源 | 1/22/2025 | 09:21:55 | Part 5 | [【剩饭录播】 2025-01-22 真三国无双起源 + 明日方舟终末地](https://www.bilibili.com/video/av113871041860513/) |
| 真三国无双起源 | 1/23/2025 | 08:45:24 | Part 6 | [【剩饭录播】 2025-01-23 真三国无双起源 + 明日方舟终末地](https://www.bilibili.com/video/av113876846776316/) |
| 真三国无双起源 | 1/24/2025 | 02:30:01 | Part 7 | [【剩饭录播】 2025-01-24 真三国无双起源 + 明日方舟终末地](https://www.bilibili.com/video/av113882718864891/) |
| 真三国无双起源 | 1/25/2025 | 05:46:52 | Part 8 | [【剩饭录播】 2025-01-25 NINJA GAIDEN 2 Black + 真三国无双起源 + nuclear nightmare](https://www.bilibili.com/video/av113888943145780/) |

## nuclear nightmare

| 游戏名称 | 直播日期 | 时长 | 集数   | 标题                                                         |
| -------- | -------- | ---- | ------ | ------------------------------------------------------------ |
| nuclear nightmare | 1/25/2025 | 05:46:52 | Part 1 | [【剩饭录播】 2025-01-25 NINJA GAIDEN 2 Black + 真三国无双起源 + nuclear nightmare](https://www.bilibili.com/video/av113888943145780/) |

## 明日方舟终末地

| 游戏名称 | 直播日期 | 时长 | 集数   | 标题                                                         |
| -------- | -------- | ---- | ------ | ------------------------------------------------------------ |
| 明日方舟终末地 | 1/21/2025 | 05:55:52 | Part 1 | [【剩饭录播】 2025-01-21  真三国无双起源 + 明日方舟终末地](https://www.bilibili.com/video/av113867485086080/) |
| 明日方舟终末地 | 1/22/2025 | 09:21:55 | Part 2 | [【剩饭录播】 2025-01-22 真三国无双起源 + 明日方舟终末地](https://www.bilibili.com/video/av113871041860513/) |
| 明日方舟终末地 | 1/23/2025 | 08:45:24 | Part 3 | [【剩饭录播】 2025-01-23 真三国无双起源 + 明日方舟终末地](https://www.bilibili.com/video/av113876846776316/) |
| 明日方舟终末地 | 1/24/2025 | 02:30:01 | Part 4 | [【剩饭录播】 2025-01-24 真三国无双起源 + 明日方舟终末地](https://www.bilibili.com/video/av113882718864891/) |

## 拼乐高

| 游戏名称 | 直播日期 | 时长 | 集数   | 标题                                                         |
| -------- | -------- | ---- | ------ | ------------------------------------------------------------ |
| 拼乐高 | 1/9/2025 | 04:24:41 | Part 1 | [【剩饭录播】 2025-01-09 拼乐高](https://www.bilibili.com/video/av113798732127434/) |
| 拼乐高 | 1/12/2025 | 06:14:55 | Part 2 | [【剩饭录播】 2025-01-12 拼乐高 + 闲聊](https://www.bilibili.com/video/av113815643490365/) |
| 拼乐高 | 1/14/2025 | 04:20:25 | Part 3 | [【剩饭录播】 2025-01-14 拼乐高 + 闲聊](https://www.bilibili.com/video/av113822052387120/) |

## 无人

| 游戏名称 | 直播日期 | 时长 | 集数   | 标题                                                         |
| -------- | -------- | ---- | ------ | ------------------------------------------------------------ |
| 无人 | 1/8/2025 | 05:36:16 | Part 1 | [【剩饭录播】 2025-01-08 无人 + 终结者: 黑暗命运 - 反抗 + DUSK + 看爽天国拯救](https://www.bilibili.com/video/av113793178798616/) |

## 终结者: 黑暗命运 - 反抗

| 游戏名称 | 直播日期 | 时长 | 集数   | 标题                                                         |
| -------- | -------- | ---- | ------ | ------------------------------------------------------------ |
| 终结者: 黑暗命运 - 反抗 | 1/8/2025 | 05:36:16 | Part 1 | [【剩饭录播】 2025-01-08 无人 + 终结者: 黑暗命运 - 反抗 + DUSK + 看爽天国拯救](https://www.bilibili.com/video/av113793178798616/) |

## DUSK

| 游戏名称 | 直播日期 | 时长 | 集数   | 标题                                                         |
| -------- | -------- | ---- | ------ | ------------------------------------------------------------ |
| DUSK | 1/8/2025 | 05:36:16 | Part 1 | [【剩饭录播】 2025-01-08 无人 + 终结者: 黑暗命运 - 反抗 + DUSK + 看爽天国拯救](https://www.bilibili.com/video/av113793178798616/) |

## 看爽天国拯救

| 游戏名称 | 直播日期 | 时长 | 集数   | 标题                                                         |
| -------- | -------- | ---- | ------ | ------------------------------------------------------------ |
| 看爽天国拯救 | 12/29/2024 | 08:44:47 | Part 1 | [【剩饭录播】 2024-12-29 星际战士2 + 看爽天国拯救](https://www.bilibili.com/video/av113736236995356/) |
| 看爽天国拯救 | 1/8/2025 | 05:36:16 | Part 2 | [【剩饭录播】 2025-01-08 无人 + 终结者: 黑暗命运 - 反抗 + DUSK + 看爽天国拯救](https://www.bilibili.com/video/av113793178798616/) |

## 巴别塔圣歌

| 游戏名称 | 直播日期 | 时长 | 集数   | 标题                                                         |
| -------- | -------- | ---- | ------ | ------------------------------------------------------------ |
| 巴别塔圣歌 | 1/4/2025 | 03:47:21 | Part 1 | [【剩饭录播】 2025-01-04 巴别塔圣歌](https://www.bilibili.com/video/av113771133537953/) |
| 巴别塔圣歌 | 1/7/2025 | 06:49:42 | Part 2 | [【剩饭录播】 2025-01-07 巴别塔圣歌 + 光环士官长合集](https://www.bilibili.com/video/av113787290060580/) |

## 光环士官长合集

| 游戏名称 | 直播日期 | 时长 | 集数   | 标题                                                         |
| -------- | -------- | ---- | ------ | ------------------------------------------------------------ |
| 光环士官长合集 | 1/7/2025 | 06:49:42 | Part 1 | [【剩饭录播】 2025-01-07 巴别塔圣歌 + 光环士官长合集](https://www.bilibili.com/video/av113787290060580/) |

## 三国志14

| 游戏名称 | 直播日期 | 时长 | 集数   | 标题                                                         |
| -------- | -------- | ---- | ------ | ------------------------------------------------------------ |
| 三国志14 | 1/2/2025 | 06:13:19 | Part 1 | [【剩饭录播】 2025-01-02 三国志14](https://www.bilibili.com/video/av113759758582255/) |

## 木卫四协议

| 游戏名称 | 直播日期 | 时长 | 集数   | 标题                                                         |
| -------- | -------- | ---- | ------ | ------------------------------------------------------------ |
| 木卫四协议 | 12/28/2024 | 03:08:00 | Part 1 | [【剩饭录播】 2024-12-28 木卫四协议](https://www.bilibili.com/video/av113730784332080/) |

## 燕云十六声

| 游戏名称 | 直播日期 | 时长 | 集数   | 标题                                                         |
| -------- | -------- | ---- | ------ | ------------------------------------------------------------ |
| 燕云十六声 | 12/27/2024 | 03:53:30 | Part 1 | [【剩饭录播】 2024-12-27 燕云十六声 + hitman + 僵尸毁灭工程](https://www.bilibili.com/video/av113724828420558/) |

## hitman

| 游戏名称 | 直播日期 | 时长 | 集数   | 标题                                                         |
| -------- | -------- | ---- | ------ | ------------------------------------------------------------ |
| hitman | 12/27/2024 | 03:53:30 | Part 1 | [【剩饭录播】 2024-12-27 燕云十六声 + hitman + 僵尸毁灭工程](https://www.bilibili.com/video/av113724828420558/) |

## 战锤40K：星际战士2

| 游戏名称 | 直播日期 | 时长 | 集数   | 标题                                                         |
| -------- | -------- | ---- | ------ | ------------------------------------------------------------ |
| 战锤40K：星际战士2 | 12/20/2024 | 08:17:02 | Part 1 | [【剩饭录播】 2024-12-20 战锤40K：星际战士2](https://www.bilibili.com/video/av113685418739640/) |

## 彩虹六号：围攻

| 游戏名称 | 直播日期 | 时长 | 集数   | 标题                                                         |
| -------- | -------- | ---- | ------ | ------------------------------------------------------------ |
| 彩虹六号：围攻 | 12/16/2024 | 02:00:02 | Part 1 | [【剩饭录播】 2024-12-16 彩虹六号：围攻](https://www.bilibili.com/video/av113663121822900/) |

## payday3

| 游戏名称 | 直播日期 | 时长 | 集数   | 标题                                                         |
| -------- | -------- | ---- | ------ | ------------------------------------------------------------ |
| payday3 | 12/14/2024 | 07:59:33 | Part 1 | [【剩饭录播】 2024-12-14 payday3 + 战争雷霆](https://www.bilibili.com/video/av113651998525371/) |

## 战争雷霆

| 游戏名称 | 直播日期 | 时长 | 集数   | 标题                                                         |
| -------- | -------- | ---- | ------ | ------------------------------------------------------------ |
| 战争雷霆 | 12/14/2024 | 07:59:33 | Part 1 | [【剩饭录播】 2024-12-14 payday3 + 战争雷霆](https://www.bilibili.com/video/av113651998525371/) |

## 僚机计划

| 游戏名称 | 直播日期 | 时长 | 集数   | 标题                                                         |
| -------- | -------- | ---- | ------ | ------------------------------------------------------------ |
| 僚机计划 | 12/13/2024 | 04:02:22 | Part 1 | [【剩饭录播】 2024-12-13 僚机计划 + TGA](https://www.bilibili.com/video/av113642922122862/) |

## 米塔

| 游戏名称 | 直播日期 | 时长 | 集数   | 标题                                                         |
| -------- | -------- | ---- | ------ | ------------------------------------------------------------ |
| 米塔 | 12/11/2024 | 05:22:19 | Part 1 | [【剩饭录播】 2024-12-11 米塔](https://www.bilibili.com/video/av113634399293331/) |

## 夺宝奇兵：古老之圈

| 游戏名称 | 直播日期 | 时长 | 集数   | 标题                                                         |
| -------- | -------- | ---- | ------ | ------------------------------------------------------------ |
| 夺宝奇兵：古老之圈 | 12/6/2024 | 07:43:16 | Part 1 | [【剩饭录播】 2024-12-06 夺宝奇兵：古老之圈](https://www.bilibili.com/video/av113605827691418/) |
| 夺宝奇兵：古老之圈 | 12/7/2024 | 06:56:27 | Part 2 | [【剩饭录播】 2024-12-07 夺宝奇兵：古老之圈](https://www.bilibili.com/video/av113611800449405/) |
| 夺宝奇兵：古老之圈 | 12/8/2024 | 07:01:06 | Part 3 | [【剩饭录播】 2024-12-08 夺宝奇兵：古老之圈](https://www.bilibili.com/video/av113617303246034/) |

## Nuclear Nightmare

| 游戏名称 | 直播日期 | 时长 | 集数   | 标题                                                         |
| -------- | -------- | ---- | ------ | ------------------------------------------------------------ |
| Nuclear Nightmare | 12/2/2024 | 04:16:20 | Part 1 | [【剩饭录播】 2024-12-02 Nuclear Nightmare](https://www.bilibili.com/video/av113583497154548/) |
| Nuclear Nightmare | 12/3/2024 | 04:24:23 | Part 2 | [【剩饭录播】 2024-12-03 Nuclear Nightmare + 骗子酒馆](https://www.bilibili.com/video/av113589201470102/) |

## 骗子酒馆

| 游戏名称 | 直播日期 | 时长 | 集数   | 标题                                                         |
| -------- | -------- | ---- | ------ | ------------------------------------------------------------ |
| 骗子酒馆 | 12/3/2024 | 04:24:23 | Part 1 | [【剩饭录播】 2024-12-03 Nuclear Nightmare + 骗子酒馆](https://www.bilibili.com/video/av113589201470102/) |

## 潜行者：切尔诺贝利的阴影

| 游戏名称 | 直播日期 | 时长 | 集数   | 标题                                                         |
| -------- | -------- | ---- | ------ | ------------------------------------------------------------ |
| 潜行者：切尔诺贝利的阴影 | 11/28/2024 | 04:54:56 | Part 1 | [【剩饭录播】 2024-11-28 潜行者：切尔诺贝利的阴影 + 潜行者：晴空](https://www.bilibili.com/video/av113560764029070/) |
| 潜行者：切尔诺贝利的阴影 | 11/29/2024 | 04:10:11 | Part 2 | [【剩饭录播】 2024-11-29 潜行者：切尔诺贝利的阴影](https://www.bilibili.com/video/av113566535386447/) |
| 潜行者：切尔诺贝利的阴影 | 12/1/2024 | 05:26:20 | Part 3 | [【剩饭录播】 2024-12-01 潜行者：切尔诺贝利的阴影](https://www.bilibili.com/video/av113577692236166/) |

## 潜行者：晴空

| 游戏名称 | 直播日期 | 时长 | 集数   | 标题                                                         |
| -------- | -------- | ---- | ------ | ------------------------------------------------------------ |
| 潜行者：晴空 | 11/28/2024 | 04:54:56 | Part 1 | [【剩饭录播】 2024-11-28 潜行者：切尔诺贝利的阴影 + 潜行者：晴空](https://www.bilibili.com/video/av113560764029070/) |

## 潜行者2：切尔诺贝利之心

| 游戏名称 | 直播日期 | 时长 | 集数   | 标题                                                         |
| -------- | -------- | ---- | ------ | ------------------------------------------------------------ |
| 潜行者2：切尔诺贝利之心 | 11/21/2024 | 03:05:12 | Part 1 | [【剩饭录播】 2024-11-21 潜行者2：切尔诺贝利之心](https://www.bilibili.com/video/av113516824561390/) |
| 潜行者2：切尔诺贝利之心 | 11/21/2024 | 11:55:02 | Part 2 | [【剩饭录播】 2024-11-21 潜行者2：切尔诺贝利之心](https://www.bilibili.com/video/av113519290813303/) |
| 潜行者2：切尔诺贝利之心 | 11/22/2024 | 02:59:37 | Part 3 | [【剩饭录播】 2024-11-22 潜行者2：切尔诺贝利之心](https://www.bilibili.com/video/av113525498316038/) |
| 潜行者2：切尔诺贝利之心 | 11/22/2024 | 08:39:39 | Part 4 | [【剩饭录播】 2024-11-22 潜行者2：切尔诺贝利之心](https://www.bilibili.com/video/av113528149181744/) |
| 潜行者2：切尔诺贝利之心 | 11/24/2024 | 06:17:10 | Part 5 | [【剩饭录播】 2024-11-24 潜行者2：切尔诺贝利之心](https://www.bilibili.com/video/av113537779240753/) |
| 潜行者2：切尔诺贝利之心 | 11/25/2024 | 09:16:40 | Part 6 | [【剩饭录播】 2024-11-25 潜行者2：切尔诺贝利之心](https://www.bilibili.com/video/av113542694962708/) |
| 潜行者2：切尔诺贝利之心 | 11/27/2024 | 08:01:08 | Part 7 | [【剩饭录播】 2024-11-27 潜行者2：切尔诺贝利之心](https://www.bilibili.com/video/av113550546700886/) |

## 断箭

| 游戏名称 | 直播日期 | 时长 | 集数   | 标题                                                         |
| -------- | -------- | ---- | ------ | ------------------------------------------------------------ |
| 断箭 | 11/19/2024 | 05:16:29 | Part 1 | [【剩饭录播】 2024-11-19 断箭](https://www.bilibili.com/video/av113509862017527/) |

## 游戏王卡片开包

| 游戏名称 | 直播日期 | 时长 | 集数   | 标题                                                         |
| -------- | -------- | ---- | ------ | ------------------------------------------------------------ |
| 游戏王卡片开包 | 11/16/2024 | 04:33:20 | Part 1 | [【剩饭录播】 2024-11-16 游戏王卡片开包 + 拼模型](https://www.bilibili.com/video/av113492732478396/) |

## 拼模型

| 游戏名称 | 直播日期 | 时长 | 集数   | 标题                                                         |
| -------- | -------- | ---- | ------ | ------------------------------------------------------------ |
| 拼模型 | 9/30/2024 | 04:35:36 | Part 1 | [【剩饭录播】 2024-09-30 拼模型 + 星空dlc](https://www.bilibili.com/video/av113227115529558/) |
| 拼模型 | 11/14/2024 | 02:23:25 | Part 2 | [【剩饭录播】 2024-11-14 看画册 + 拼模型](https://www.bilibili.com/video/av113481609119144/) |
| 拼模型 | 11/16/2024 | 04:33:20 | Part 3 | [【剩饭录播】 2024-11-16 游戏王卡片开包 + 拼模型](https://www.bilibili.com/video/av113492732478396/) |

## 荒野大镖客

| 游戏名称 | 直播日期 | 时长 | 集数   | 标题                                                         |
| -------- | -------- | ---- | ------ | ------------------------------------------------------------ |
| 荒野大镖客 | 11/15/2024 | 02:55:18 | Part 1 | [【剩饭录播】 2024-11-15 荒野大镖客](https://www.bilibili.com/video/av113487330148719/) |

## 看画册

| 游戏名称 | 直播日期 | 时长 | 集数   | 标题                                                         |
| -------- | -------- | ---- | ------ | ------------------------------------------------------------ |
| 看画册 | 11/14/2024 | 02:23:25 | Part 1 | [【剩饭录播】 2024-11-14 看画册 + 拼模型](https://www.bilibili.com/video/av113481609119144/) |

## 异星工厂

| 游戏名称 | 直播日期 | 时长 | 集数   | 标题                                                         |
| -------- | -------- | ---- | ------ | ------------------------------------------------------------ |
| 异星工厂 | 10/22/2024 | 04:30:21 | Part 1 | [【剩饭录播】 2024-10-22 异星工厂 + 万神之城 + 战争号令地狱之门：东线](https://www.bilibili.com/video/av113351283706302/) |
| 异星工厂 | 11/2/2024 | 11:00:11 | Part 2 | [【剩饭录播】 2024-11-02 异星工厂](https://www.bilibili.com/video/av113413628038925/) |

## 龙腾世纪

| 游戏名称 | 直播日期 | 时长 | 集数   | 标题                                                         |
| -------- | -------- | ---- | ------ | ------------------------------------------------------------ |
| 龙腾世纪 | 11/1/2024 | 03:08:11 | Part 1 | [【剩饭录播】 2024-11-01 龙腾世纪](https://www.bilibili.com/video/av113403595064180/) |
| 龙腾世纪 | 11/1/2024 | 04:52:56 | Part 2 | [【剩饭录播】 2024-11-01 怪物猎人：荒野 + 龙腾世纪](https://www.bilibili.com/video/av113408007472504/) |

## 战争之人2

| 游戏名称 | 直播日期 | 时长 | 集数   | 标题                                                         |
| -------- | -------- | ---- | ------ | ------------------------------------------------------------ |
| 战争之人2 | 10/28/2024 | 05:13:20 | Part 1 | [【剩饭录播】 2024-10-28 战争之人2 + 后勤模拟器](https://www.bilibili.com/video/av113385408628538/) |

## 后勤模拟器

| 游戏名称 | 直播日期 | 时长 | 集数   | 标题                                                         |
| -------- | -------- | ---- | ------ | ------------------------------------------------------------ |
| 后勤模拟器 | 10/28/2024 | 05:13:20 | Part 1 | [【剩饭录播】 2024-10-28 战争之人2 + 后勤模拟器](https://www.bilibili.com/video/av113385408628538/) |

## 手工

| 游戏名称 | 直播日期 | 时长 | 集数   | 标题                                                         |
| -------- | -------- | ---- | ------ | ------------------------------------------------------------ |
| 手工 | 10/26/2024 | 04:04:43 | Part 1 | [【剩饭录播】 2024-10-26 手工 + 狙击杀手 + 土豆兄弟dlc](https://www.bilibili.com/video/av113373983343959/) |

## 狙击杀手

| 游戏名称 | 直播日期 | 时长 | 集数   | 标题                                                         |
| -------- | -------- | ---- | ------ | ------------------------------------------------------------ |
| 狙击杀手 | 10/26/2024 | 04:04:43 | Part 1 | [【剩饭录播】 2024-10-26 手工 + 狙击杀手 + 土豆兄弟dlc](https://www.bilibili.com/video/av113373983343959/) |

## Brotato/土豆兄弟

| 游戏名称 | 直播日期 | 时长 | 集数   | 标题                                                         |
| -------- | -------- | ---- | ------ | ------------------------------------------------------------ |
| Brotato/土豆兄弟 | 10/26/2024 | 04:04:43 | Part 1 | [【剩饭录播】 2024-10-26 手工 + 狙击杀手 + 土豆兄弟dlc](https://www.bilibili.com/video/av113373983343959/) |

## 万神之城

| 游戏名称 | 直播日期 | 时长 | 集数   | 标题                                                         |
| -------- | -------- | ---- | ------ | ------------------------------------------------------------ |
| 万神之城 | 10/22/2024 | 04:30:21 | Part 1 | [【剩饭录播】 2024-10-22 异星工厂 + 万神之城 + 战争号令地狱之门：东线](https://www.bilibili.com/video/av113351283706302/) |

## 战争号令地狱之门：东线

| 游戏名称 | 直播日期 | 时长 | 集数   | 标题                                                         |
| -------- | -------- | ---- | ------ | ------------------------------------------------------------ |
| 战争号令地狱之门：东线 | 10/21/2024 | 04:47:46 | Part 1 | [【剩饭录播】 2024-10-21 X4：基石 + 战争号令地狱之门：东线](https://www.bilibili.com/video/av113346233765155/) |
| 战争号令地狱之门：东线 | 10/22/2024 | 04:30:21 | Part 2 | [【剩饭录播】 2024-10-22 异星工厂 + 万神之城 + 战争号令地狱之门：东线](https://www.bilibili.com/video/av113351283706302/) |

## X4：基石

| 游戏名称 | 直播日期 | 时长 | 集数   | 标题                                                         |
| -------- | -------- | ---- | ------ | ------------------------------------------------------------ |
| X4：基石 | 10/21/2024 | 04:47:46 | Part 1 | [【剩饭录播】 2024-10-21 X4：基石 + 战争号令地狱之门：东线](https://www.bilibili.com/video/av113346233765155/) |

## VALORANT/无畏契约

| 游戏名称 | 直播日期 | 时长 | 集数   | 标题                                                         |
| -------- | -------- | ---- | ------ | ------------------------------------------------------------ |
| VALORANT/无畏契约 | 10/17/2024 | 05:18:23 | Part 1 | [【剩饭录播】 2024-10-17 无畏契约 + 机甲战士5氏族 + xbox发布会](https://www.bilibili.com/video/av113322997385983/) |

## 机甲战士5氏族

| 游戏名称 | 直播日期 | 时长 | 集数   | 标题                                                         |
| -------- | -------- | ---- | ------ | ------------------------------------------------------------ |
| 机甲战士5氏族 | 10/17/2024 | 05:18:23 | Part 1 | [【剩饭录播】 2024-10-17 无畏契约 + 机甲战士5氏族 + xbox发布会](https://www.bilibili.com/video/av113322997385983/) |

## xbox发布会

| 游戏名称 | 直播日期 | 时长 | 集数   | 标题                                                         |
| -------- | -------- | ---- | ------ | ------------------------------------------------------------ |
| xbox发布会 | 10/17/2024 | 05:18:23 | Part 1 | [【剩饭录播】 2024-10-17 无畏契约 + 机甲战士5氏族 + xbox发布会](https://www.bilibili.com/video/av113322997385983/) |

## status one

| 游戏名称 | 直播日期 | 时长 | 集数   | 标题                                                         |
| -------- | -------- | ---- | ------ | ------------------------------------------------------------ |
| status one | 10/16/2024 | 05:05:51 | Part 1 | [【剩饭录播】 2024-10-16 泡姆泡姆 + status one + 小游戏合集](https://www.bilibili.com/video/av113317326621388/) |

## 寂静岭2

| 游戏名称 | 直播日期 | 时长 | 集数   | 标题                                                         |
| -------- | -------- | ---- | ------ | ------------------------------------------------------------ |
| 寂静岭2 | 10/11/2024 | 03:29:17 | Part 1 | [【剩饭录播】 2024-10-11 寂静岭2](https://www.bilibili.com/video/av113289476443362/) |
| 寂静岭2 | 10/12/2024 | 04:45:55 | Part 2 | [【剩饭录播】 2024-10-12 寂静岭2](https://www.bilibili.com/video/av113294627047228/) |
| 寂静岭2 | 10/14/2024 | 04:21:42 | Part 3 | [【剩饭录播】 2024-10-14 寂静岭2](https://www.bilibili.com/video/av113306002065063/) |
| 寂静岭2 | 10/15/2024 | 02:50:03 | Part 4 | [【剩饭录播】 2024-10-15 寂静岭2 + 13F](https://www.bilibili.com/video/av113311756583565/) |

## 13F

| 游戏名称 | 直播日期 | 时长 | 集数   | 标题                                                         |
| -------- | -------- | ---- | ------ | ------------------------------------------------------------ |
| 13F | 10/15/2024 | 02:50:03 | Part 1 | [【剩饭录播】 2024-10-15 寂静岭2 + 13F](https://www.bilibili.com/video/av113311756583565/) |

## 战锤40K：行商浪人

| 游戏名称 | 直播日期 | 时长 | 集数   | 标题                                                         |
| -------- | -------- | ---- | ------ | ------------------------------------------------------------ |
| 战锤40K：行商浪人 | 10/5/2024 | 04:03:53 | Part 1 | [【剩饭录播】 2024-10-05 战锤40K：行商浪人](https://www.bilibili.com/video/av113255049593790/) |
| 战锤40K：行商浪人 | 10/7/2024 | 04:57:42 | Part 2 | [【剩饭录播】 2024-10-07 战锤40K：行商浪人](https://www.bilibili.com/video/av113266357505836/) |

## 星空dlc

| 游戏名称 | 直播日期 | 时长 | 集数   | 标题                                                         |
| -------- | -------- | ---- | ------ | ------------------------------------------------------------ |
| 星空dlc | 9/30/2024 | 04:35:36 | Part 1 | [【剩饭录播】 2024-09-30 拼模型 + 星空dlc](https://www.bilibili.com/video/av113227115529558/) |

## 全面战争：拿破仑

| 游戏名称 | 直播日期 | 时长 | 集数   | 标题                                                         |
| -------- | -------- | ---- | ------ | ------------------------------------------------------------ |
| 全面战争：拿破仑 | 9/25/2024 | 03:29:22 | Part 1 | [【剩饭录播】 2024-09-25 全面战争：拿破仑 + 叛击士](https://www.bilibili.com/video/av113198392935185/) |

## 叛击士

| 游戏名称 | 直播日期 | 时长 | 集数   | 标题                                                         |
| -------- | -------- | ---- | ------ | ------------------------------------------------------------ |
| 叛击士 | 9/25/2024 | 03:29:22 | Part 1 | [【剩饭录播】 2024-09-25 全面战争：拿破仑 + 叛击士](https://www.bilibili.com/video/av113198392935185/) |

## tyranny

| 游戏名称 | 直播日期 | 时长 | 集数   | 标题                                                         |
| -------- | -------- | ---- | ------ | ------------------------------------------------------------ |
| tyranny | 9/24/2024 | 02:33:01 | Part 1 | [【剩饭录播】 2024-09-24 tyranny](https://www.bilibili.com/video/av113192873233170/) |

## 丧尸围城 Deluxe Remaster

| 游戏名称 | 直播日期 | 时长 | 集数   | 标题                                                         |
| -------- | -------- | ---- | ------ | ------------------------------------------------------------ |
| 丧尸围城 Deluxe Remaster | 9/19/2024 | 04:10:30 | Part 1 | [【剩饭录播】 2024-09-19 丧尸围城 Deluxe Remaster + Frostpunk2](https://www.bilibili.com/video/av113164653956761/) |

## Frostpunk2

| 游戏名称 | 直播日期 | 时长 | 集数   | 标题                                                         |
| -------- | -------- | ---- | ------ | ------------------------------------------------------------ |
| Frostpunk2 | 9/19/2024 | 04:10:30 | Part 1 | [【剩饭录播】 2024-09-19 丧尸围城 Deluxe Remaster + Frostpunk2](https://www.bilibili.com/video/av113164653956761/) |

## 星球大战绝地：陨落的武士团

| 游戏名称 | 直播日期 | 时长 | 集数   | 标题                                                         |
| -------- | -------- | ---- | ------ | ------------------------------------------------------------ |
| 星球大战绝地：陨落的武士团 | 9/15/2024 | 05:08:34 | Part 1 | [【剩饭录播】 2024-09-15 星球大战绝地：陨落的武士团](https://www.bilibili.com/video/av113142038267536/) |

## GUNDAM 创坏者4

| 游戏名称 | 直播日期 | 时长 | 集数   | 标题                                                         |
| -------- | -------- | ---- | ------ | ------------------------------------------------------------ |
| GUNDAM 创坏者4 | 8/29/2024 | 06:18:10 | Part 1 | [【剩饭录播】 2024-08-29 GUNDAM 创坏者4](https://www.bilibili.com/video/av113045770733450/) |
| GUNDAM 创坏者4 | 9/12/2024 | 07:13:14 | Part 2 | [【剩饭录播】 2024-09-12 僵尸毁灭工程 + GUNDAM 创坏者4](https://www.bilibili.com/video/av113124908794638/) |

## Draw & Guess/你画我猜

| 游戏名称 | 直播日期 | 时长 | 集数   | 标题                                                         |
| -------- | -------- | ---- | ------ | ------------------------------------------------------------ |
| Draw & Guess/你画我猜 | 9/10/2024 | 05:29:22 | Part 1 | [【剩饭录播】 2024-09-10 你画我猜 + 群星](https://www.bilibili.com/video/av113113533842995/) |

## 群星

| 游戏名称 | 直播日期 | 时长 | 集数   | 标题                                                         |
| -------- | -------- | ---- | ------ | ------------------------------------------------------------ |
| 群星 | 8/9/2024 | 03:27:09 | Part 1 | [【剩饭录播】 2024-08-09 群星](https://www.bilibili.com/video/av112932255961011/) |
| 群星 | 8/11/2024 | 06:49:17 | Part 2 | [【剩饭录播】 2024-08-11 群星](https://www.bilibili.com/video/av112943463138489/) |
| 群星 | 9/10/2024 | 05:29:22 | Part 3 | [【剩饭录播】 2024-09-10 你画我猜 + 群星](https://www.bilibili.com/video/av113113533842995/) |

## 神话时代 重述版

| 游戏名称 | 直播日期 | 时长 | 集数   | 标题                                                         |
| -------- | -------- | ---- | ------ | ------------------------------------------------------------ |
| 神话时代 重述版 | 9/7/2024 | 06:27:51 | Part 1 | [【剩饭录播】 2024-09-07 星际战士2 + 神话时代 重述版](https://www.bilibili.com/video/av113096404304480/) |

## 星球大战：亡命之徒

| 游戏名称 | 直播日期 | 时长 | 集数   | 标题                                                         |
| -------- | -------- | ---- | ------ | ------------------------------------------------------------ |
| 星球大战：亡命之徒 | 8/26/2024 | 03:52:34 | Part 1 | [【剩饭录播】 2024-08-26 星球大战：亡命之徒 + diannaobaozhale](https://www.bilibili.com/video/av113029094181457/) |
| 星球大战：亡命之徒 | 8/28/2024 | 07:17:17 | Part 2 | [【剩饭录播】 2024-08-28 星球大战：亡命之徒](https://www.bilibili.com/video/av113039948908314/) |
| 星球大战：亡命之徒 | 8/31/2024 | 07:41:53 | Part 3 | [【剩饭录播】 2024-08-31 星球大战：亡命之徒 + 僵尸毁灭工程（最后2p无弹幕）](https://www.bilibili.com/video/av113056742967316/) |

## diannaobaozhale

| 游戏名称 | 直播日期 | 时长 | 集数   | 标题                                                         |
| -------- | -------- | ---- | ------ | ------------------------------------------------------------ |
| diannaobaozhale | 8/26/2024 | 03:52:34 | Part 1 | [【剩饭录播】 2024-08-26 星球大战：亡命之徒 + diannaobaozhale](https://www.bilibili.com/video/av113029094181457/) |

## Intravenous 2

| 游戏名称 | 直播日期 | 时长 | 集数   | 标题                                                         |
| -------- | -------- | ---- | ------ | ------------------------------------------------------------ |
| Intravenous 2 | 8/25/2024 | 04:50:33 | Part 1 | [【剩饭录播】 2024-08-25 Intravenous 2](https://www.bilibili.com/video/av113022869766697/) |

## 黑神话：悟空

| 游戏名称 | 直播日期 | 时长 | 集数   | 标题                                                         |
| -------- | -------- | ---- | ------ | ------------------------------------------------------------ |
| 黑神话：悟空 | 8/21/2024 | 04:00:05 | Part 1 | [【剩饭录播】 2024-08-21 黑神话：悟空](https://www.bilibili.com/video/av112995841609390/) |

## 犯罪现场清理员

| 游戏名称 | 直播日期 | 时长 | 集数   | 标题                                                         |
| -------- | -------- | ---- | ------ | ------------------------------------------------------------ |
| 犯罪现场清理员 | 8/15/2024 | 04:13:04 | Part 1 | [【剩饭录播】 2024-08-15 犯罪现场清理员](https://www.bilibili.com/video/av112966179621119/) |
| 犯罪现场清理员 | 8/17/2024 | 02:00:02 | Part 2 | [【剩饭录播】 2024-08-17 犯罪现场清理员——残缺](https://www.bilibili.com/video/av112977420223195/) |

## vladik brutal

| 游戏名称 | 直播日期 | 时长 | 集数   | 标题                                                         |
| -------- | -------- | ---- | ------ | ------------------------------------------------------------ |
| vladik brutal | 8/13/2024 | 04:43:15 | Part 1 | [【剩饭录播】 2024-08-13 vladik brutal + 兵团突击：现代战争 + 骑马与砍杀2](https://www.bilibili.com/video/av112954854870447/) |

## 兵团突击：现代战争

| 游戏名称 | 直播日期 | 时长 | 集数   | 标题                                                         |
| -------- | -------- | ---- | ------ | ------------------------------------------------------------ |
| 兵团突击：现代战争 | 8/13/2024 | 04:43:15 | Part 1 | [【剩饭录播】 2024-08-13 vladik brutal + 兵团突击：现代战争 + 骑马与砍杀2](https://www.bilibili.com/video/av112954854870447/) |

## 骑马与砍杀2

| 游戏名称 | 直播日期 | 时长 | 集数   | 标题                                                         |
| -------- | -------- | ---- | ------ | ------------------------------------------------------------ |
| 骑马与砍杀2 | 8/13/2024 | 04:43:15 | Part 1 | [【剩饭录播】 2024-08-13 vladik brutal + 兵团突击：现代战争 + 骑马与砍杀2](https://www.bilibili.com/video/av112954854870447/) |

## nikke

| 游戏名称 | 直播日期 | 时长 | 集数   | 标题                                                         |
| -------- | -------- | ---- | ------ | ------------------------------------------------------------ |
| nikke | 8/8/2024 | 05:17:12 | Part 1 | [【剩饭录播】 2024-08-08 猛男寨mc + nikke](https://www.bilibili.com/video/av112926635721379/) |

## mc

| 游戏名称 | 直播日期 | 时长 | 集数   | 标题                                                         |
| -------- | -------- | ---- | ------ | ------------------------------------------------------------ |
| mc | 7/27/2024 | 06:06:04 | Part 1 | [【剩饭录播】 2024-07-27 mc](https://www.bilibili.com/video/av1006397346/) |

## 辐射：伦敦

| 游戏名称 | 直播日期 | 时长 | 集数   | 标题                                                         |
| -------- | -------- | ---- | ------ | ------------------------------------------------------------ |
| 辐射：伦敦 | 7/26/2024 | 06:53:31 | Part 1 | [【剩饭录播】 2024-07-26 辐射：伦敦 + 尘白禁区 + 逃离塔科夫](https://www.bilibili.com/video/av1306373472/) |

## 尘白禁区

| 游戏名称 | 直播日期 | 时长 | 集数   | 标题                                                         |
| -------- | -------- | ---- | ------ | ------------------------------------------------------------ |
| 尘白禁区 | 7/26/2024 | 06:53:31 | Part 1 | [【剩饭录播】 2024-07-26 辐射：伦敦 + 尘白禁区 + 逃离塔科夫](https://www.bilibili.com/video/av1306373472/) |

## 逃离塔科夫

| 游戏名称 | 直播日期 | 时长 | 集数   | 标题                                                         |
| -------- | -------- | ---- | ------ | ------------------------------------------------------------ |
| 逃离塔科夫 | 7/20/2024 | 03:43:34 | Part 1 | [【剩饭录播】 2024-07-20 逃离塔科夫](https://www.bilibili.com/video/av1056323812/) |
| 逃离塔科夫 | 7/22/2024 | 06:32:16 | Part 2 | [【剩饭录播】 2024-07-22 僵尸毁灭工程 + 逃离塔科夫](https://www.bilibili.com/video/av1756335753/) |
| 逃离塔科夫 | 7/26/2024 | 06:53:31 | Part 3 | [【剩饭录播】 2024-07-26 辐射：伦敦 + 尘白禁区 + 逃离塔科夫](https://www.bilibili.com/video/av1306373472/) |

## 总统先生

| 游戏名称 | 直播日期 | 时长 | 集数   | 标题                                                         |
| -------- | -------- | ---- | ------ | ------------------------------------------------------------ |
| 总统先生 | 7/24/2024 | 03:47:14 | Part 1 | [【剩饭录播】 2024-07-24 总统先生 + 忍者杀手：火烧新琦玉 + 战壕惊魂](https://www.bilibili.com/video/av1256257795/) |

## 忍者杀手：火烧新琦玉

| 游戏名称 | 直播日期 | 时长 | 集数   | 标题                                                         |
| -------- | -------- | ---- | ------ | ------------------------------------------------------------ |
| 忍者杀手：火烧新琦玉 | 7/24/2024 | 03:47:14 | Part 1 | [【剩饭录播】 2024-07-24 总统先生 + 忍者杀手：火烧新琦玉 + 战壕惊魂](https://www.bilibili.com/video/av1256257795/) |

## 战壕惊魂

| 游戏名称 | 直播日期 | 时长 | 集数   | 标题                                                         |
| -------- | -------- | ---- | ------ | ------------------------------------------------------------ |
| 战壕惊魂 | 7/24/2024 | 03:47:14 | Part 1 | [【剩饭录播】 2024-07-24 总统先生 + 忍者杀手：火烧新琦玉 + 战壕惊魂](https://www.bilibili.com/video/av1256257795/) |

## 最后的战役：劫后余生

| 游戏名称 | 直播日期 | 时长 | 集数   | 标题                                                         |
| -------- | -------- | ---- | ------ | ------------------------------------------------------------ |
| 最后的战役：劫后余生 | 7/10/2024 | 04:33:01 | Part 1 | [【剩饭录播】 2024-07-10 最后的战役：劫后余生 + 僵尸毁灭工程](https://www.bilibili.com/video/av1156002079/) |

## 骑自行车

| 游戏名称 | 直播日期 | 时长 | 集数   | 标题                                                         |
| -------- | -------- | ---- | ------ | ------------------------------------------------------------ |
| 骑自行车 | 7/8/2024 | 00:52:32 | Part 1 | [【剩饭录播】 2024-07-08 骑自行车](https://www.bilibili.com/video/av1206103207/) |

## Chained Together

| 游戏名称 | 直播日期 | 时长 | 集数   | 标题                                                         |
| -------- | -------- | ---- | ------ | ------------------------------------------------------------ |
| Chained Together | 6/30/2024 | 06:27:47 | Part 1 | [【剩饭录播】 2024-06-30 Chained Together](https://www.bilibili.com/video/av1255900500/) |

## 觉醒深渊

| 游戏名称 | 直播日期 | 时长 | 集数   | 标题                                                         |
| -------- | -------- | ---- | ------ | ------------------------------------------------------------ |
| 觉醒深渊 | 6/25/2024 | 07:28:12 | Part 1 | [【剩饭录播】 2024-06-25 觉醒深渊 +艾尔登法环dlc](https://www.bilibili.com/video/av1355810374/) |